Job Title,Company,Location,Tags,Date,Apply Link
Technical Support Analyst,Yuno,,"analyst, system, technical, support, api, management, operations, operational, reliability, backend",2026-04-16T00:01:12+00:00,https://remoteOK.com/remote-jobs/remote-technical-support-analyst-yuno-1131151
Director Revenue Transformation,Gong.io,Austin | Chicago | New York City | Salt Lake City | San Francisco,"director, system, senior, sales",2026-04-16T00:01:05+00:00,https://remoteOK.com/remote-jobs/remote-director-revenue-transformation-gong-io-1131150
Account Executive,GuidePoint Security,Boston,"infosec, salesforce, security, travel, management, marketing, sales, executive",2026-04-16T00:00:57+00:00,https://remoteOK.com/remote-jobs/remote-account-executive-guidepoint-security-1131149
Partner Development Director,Clozd,"Lehi, UT / Remote","director, embedded, consulting, growth, leader, lead, senior, operations, sales, executive",2026-04-16T00:00:49+00:00,https://remoteOK.com/remote-jobs/remote-partner-development-director-clozd-1131148
Test Automation Engineer,540,,"test, design, system, support, testing, api, engineer, engineering, full-time, digital nomad",2026-04-16T00:00:40+00:00,https://remoteOK.com/remote-jobs/remote-test-automation-engineer-540-1131147
Product Manager,Lively,San Francisco,"manager, design, financial, strategy, lead, senior, health, healthcare, digital nomad",2026-04-16T00:00:31+00:00,https://remoteOK.com/remote-jobs/remote-product-manager-lively-1131146
Senior Solutions Architect,540,,"architect, design, system, technical, support, cloud, lead, senior, operations, reliability, engineering, digital nomad",2026-04-16T00:00:22+00:00,https://remoteOK.com/remote-jobs/remote-senior-solutions-architect-540-1131145
CNAPP Security Engineer Mid Atlantic region,GuidePoint Security,"Reston, VA","infosec, security, code, c, cloud, engineer",2026-04-16T00:00:06+00:00,https://remoteOK.com/remote-jobs/remote-cnapp-security-engineer-mid-atlantic-region-guidepoint-security-1131144
Travel & Visa Manager,Eqvilent,Remote,"travel, manager, support, management, non tech",2026-04-15T16:01:54+00:00,https://remoteOK.com/remote-jobs/remote-travel-visa-manager-eqvilent-1131143
Paralegal Legal Operations,"Sterlington, PLLC",São Paulo,"support, senior, operations, legal, executive, non tech",2026-04-15T16:01:45+00:00,https://remoteOK.com/remote-jobs/remote-paralegal-legal-operations-sterlington-pllc-1131142
Retail Strategic Associate,Rowan,,"training, consulting, strategy, content, operations, health, non tech",2026-04-15T16:01:34+00:00,https://remoteOK.com/remote-jobs/remote-retail-strategic-associate-rowan-1131141
Service Operations Scheduler,Palmetto Clean Technology,Philippines,"system, financial, management, operations",2026-04-15T16:01:05+00:00,https://remoteOK.com/remote-jobs/remote-service-operations-scheduler-palmetto-clean-technology-1131140
Regulatory Manager Senior Regulatory Manager,Precision Medicine Group,"Remote, United Kingdom","manager, strategy, senior, operational, recruiting",2026-04-15T16:00:56+00:00,https://remoteOK.com/remote-jobs/remote-regulatory-manager-senior-regulatory-manager-precision-medicine-group-1131139
Manager Product Analytics,Pinwheel,Remote,"manager, design, financial, banking, analytics, digital nomad",2026-04-15T16:00:47+00:00,https://remoteOK.com/remote-jobs/remote-manager-product-analytics-pinwheel-1131138
Retail Store Associate,Rowan,"Gainesville, FL","training, software, math, management, sales, health",2026-04-15T16:00:38+00:00,https://remoteOK.com/remote-jobs/remote-retail-store-associate-rowan-1131137
Business Development Manager Real World Data,Glooko,,"manager, support, growth, management, sales, biotech, health, healthcare",2026-04-15T16:00:25+00:00,https://remoteOK.com/remote-jobs/remote-business-development-manager-real-world-data-glooko-1131136
Piercing Studio Nurse,Rowan,"Ardmore, PA","training, technical, support, manager, management, operations, operational, sales, health, full-time",2026-04-15T16:00:14+00:00,https://remoteOK.com/remote-jobs/remote-piercing-studio-nurse-rowan-1131135
Director of Content Marketing &amp; Media,Luxury Presence,"New York, NY","director, design, saas, founder, ceo, technical, growth, web, video, investment, c, seo, strategy, lead, content, marketing, full-time, digital nomad",2026-04-15T08:01:00+00:00,https://remoteOK.com/remote-jobs/remote-director-of-content-marketing-amp-media-luxury-presence-1131121
Banking Full Stack Software Developer TSCM 43657,Eleks,Poland,"developer, software, security, python, trainer, full-stack, technical, web, javascript, banking, angular, leader, senior, engineering, digital nomad",2026-04-15T08:00:32+00:00,https://remoteOK.com/remote-jobs/remote-banking-full-stack-software-developer-tscm-43657-eleks-1131120
Manager DashMart Supply Chain Strategy & Analytics,DoorDash USA,"New York, NY; San Francisco, CA; Los Angeles, CA; Chicago, IL; Seattle, WA; Tempe, AZ; Washington D.C.","manager, leader, strategy, lead, senior, operations, analytics",2026-04-15T08:00:25+00:00,https://remoteOK.com/remote-jobs/remote-manager-dashmart-supply-chain-strategy-analytics-doordash-usa-1131119
Principal Specialist Counsel Financial Crime & Compliance,Agoda,Bangkok,"travel, financial, api, management, non tech",2026-04-15T08:00:17+00:00,https://remoteOK.com/remote-jobs/remote-principal-specialist-counsel-financial-crime-compliance-agoda-1131118
Privacy Principal Counsel,Agoda,Bangkok,"support, travel, financial, api, management, legal, non tech",2026-04-15T08:00:07+00:00,https://remoteOK.com/remote-jobs/remote-privacy-principal-counsel-agoda-1131117
Software Engineer Payment Operations,Wingspan,Warsaw,"software, growth, code, payroll, finance, bank, node.js, operations, operational, reliability, health, engineer, engineering, backend",2026-04-15T00:01:21+00:00,https://remoteOK.com/remote-jobs/remote-software-engineer-payment-operations-wingspan-1131116
Senior Manager Associate Director Strategy & Operations,Natera,US Remote,"director, manager, support, strategy, senior, operations",2026-04-15T00:01:11+00:00,https://remoteOK.com/remote-jobs/remote-senior-manager-associate-director-strategy-operations-natera-1131115
Industry Marketing Manager,Gong.io,Austin | Chicago | New York City | Salt Lake City | San Francisco,"manager, design, system, financial, marketing, sales, digital nomad",2026-04-15T00:01:00+00:00,https://remoteOK.com/remote-jobs/remote-industry-marketing-manager-gong-io-1131114
Senior Project Manager,Unlock Health,"Chicago, Illinois, United States; Nashville, Tennessee, United States; Remote","manager, financial, strategy, management, senior, marketing, medical, health, healthcare, non tech",2026-04-15T00:00:51+00:00,https://remoteOK.com/remote-jobs/remote-senior-project-manager-unlock-health-1131113
Manager Growth Marketing & Content,Neighborhoods.com,,"growth, manager, director, leader, strategy, lead, content, marketing, sales",2026-04-15T00:00:42+00:00,https://remoteOK.com/remote-jobs/remote-manager-growth-marketing-content-neighborhoods-com-1131112
Director IT & Security,Octave,Virtual (Remote),"security, director, system, architect, technical, support, growth, strategy, management, operations, operational, health",2026-04-15T00:00:30+00:00,https://remoteOK.com/remote-jobs/remote-director-it-security-octave-1131111
Alignment Engineer,Intelligent Technical Solutions,International,"technical, software, engineer",2026-04-15T00:00:15+00:00,https://remoteOK.com/remote-jobs/remote-alignment-engineer-intelligent-technical-solutions-1131110
1068 Intake and QA expert,GoFasti,,"qa, health",2026-04-15T00:00:06+00:00,https://remoteOK.com/remote-jobs/remote-1068-intake-and-qa-expert-gofasti-1131109
Culture & People Development Specialist,Ekumen,,"training, technical, software, growth, strategy, go, engineering",2026-04-14T16:00:05+00:00,https://remoteOK.com/remote-jobs/remote-culture-people-development-specialist-ekumen-1131108
Operations Coordinator Clinical Trials,HealthMatch,United States,"founder, ceo, coordinator, director, manager, operations",2026-04-14T08:00:09+00:00,https://remoteOK.com/remote-jobs/remote-operations-coordinator-clinical-trials-healthmatch-1131107
Technical Support L3 Weekends,Redis,,"redis, sysadmin, technical, support, software, code, voice, cloud, nosql, reliability, health, engineer, engineering, recruitment",2026-04-14T08:00:03+00:00,https://remoteOK.com/remote-jobs/remote-technical-support-l3-weekends-redis-1131106
Implementation Specialist,LaunchBrightly,,"full time, customer support, web dev, ops, sys admin, quality assurance, dev",2026-04-14T00:28:20+00:00,https://remoteOK.com/remote-jobs/remote-implementation-specialist-launchbrightly-1131105
Sr Software Engineer B E,"Rebuy, Inc.",,"software, design, jira, saas, system, security, architect, ceo, technical, recruiter, support, growth, coo, code, voice, manager, financial, php, api, lead, go, engineer, engineering, backend, shopify, digital nomad",2026-04-14T00:01:13+00:00,https://remoteOK.com/remote-jobs/remote-sr-software-engineer-b-e-rebuy-inc-1131104
Senior Product Designer Product Design UX,Ubiminds,Remote,"design, ux, saas, designer, support, software, test, growth, web, mobile, lead, senior, analytics, engineering, ecommerce, full-time, digital nomad",2026-04-14T00:01:02+00:00,https://remoteOK.com/remote-jobs/remote-senior-product-designer-product-design-ux-ubiminds-1131103
Engineering Manager Data Platform,TrueML,Remote in USA,"manager, design, system, python, architect, technical, software, code, financial, fintech, java, nosql, management, engineering, digital nomad",2026-04-14T00:00:55+00:00,https://remoteOK.com/remote-jobs/remote-engineering-manager-data-platform-trueml-1131102
Independent Mental Health Therapist New Mexico,Ascend Healthcare,New Mexico,"support, operational, health, medical, healthcare, non tech",2026-04-14T00:00:36+00:00,https://remoteOK.com/remote-jobs/remote-independent-mental-health-therapist-new-mexico-ascend-healthcare-1131101
Product Manager,WorkOS,San Francisco,"manager, design, saas, technical, support, developer, software, travel, strategy, go, healthcare, recruiting, engineering, recruitment, digital nomad",2026-04-14T00:00:20+00:00,https://remoteOK.com/remote-jobs/remote-product-manager-workos-1131100
Vice President Client Success West,EnableComp,"Franklin, TN","support, software, growth, travel, financial, education, management, lead, senior, operations, sales, go, health, healthcare, executive",2026-04-14T00:00:13+00:00,https://remoteOK.com/remote-jobs/remote-vice-president-client-success-west-enablecomp-1131099
Product Manager Market Platform,Voltus,Remote,"manager, system, security, technical, travel, financial, investment, engineering, full-time",2026-04-14T00:00:05+00:00,https://remoteOK.com/remote-jobs/remote-product-manager-market-platform-voltus-1131098
Principal Care Management Care Coordinator,MTC Care,,"coordinator, support, manager, microsoft, management, excel, health, healthcare, non tech",2026-04-13T16:01:12+00:00,https://remoteOK.com/remote-jobs/remote-principal-care-management-care-coordinator-mtc-care-1131097
Customer Success Associate,Workera AI,Remote,"strategy, management, lead",2026-04-13T16:01:00+00:00,https://remoteOK.com/remote-jobs/remote-customer-success-associate-workera-ai-1131096
Senior Software Engineer II Applied AI and Evaluations,Smartsheet,,"software, design, embedded, qa, management, senior, engineer, engineering, digital nomad",2026-04-13T16:00:47+00:00,https://remoteOK.com/remote-jobs/remote-senior-software-engineer-ii-applied-ai-and-evaluations-smartsheet-1131095
Customer Success Manager II,Renaissance Learning North America,IL,"manager, teacher, education, administrator, leader, educational, non tech",2026-04-13T00:00:17+00:00,https://remoteOK.com/remote-jobs/remote-customer-success-manager-ii-renaissance-learning-north-america-1131091
Inside Sales Specialist Lead Manager,House Buyers of America,Remote,"manager, web, lead, sales, non tech",2026-04-13T00:00:07+00:00,https://remoteOK.com/remote-jobs/remote-inside-sales-specialist-lead-manager-house-buyers-of-america-1131090
Senior Cloud Architect ML AI,DoiT,,"architect, technical, growth, cloud, microsoft, senior, engineering",2026-04-12T16:00:27+00:00,https://remoteOK.com/remote-jobs/remote-senior-cloud-architect-ml-ai-doit-1131089
HONK Client Success Manager,HONK,,"manager, technical, operational, executive",2026-04-12T16:00:17+00:00,https://remoteOK.com/remote-jobs/remote-honk-client-success-manager-honk-1131088
Director of Strategic Accounts Food Service &amp; Alt Channels,Skinny Dipped,USA,"director, strategist, support, growth, financial, leader, strategy, management, lead, senior, sales, go",2026-04-12T16:00:06+00:00,https://remoteOK.com/remote-jobs/remote-director-of-strategic-accounts-food-service-amp-alt-channels-skinny-dipped-1131087
Content Operations Coordinator,Colibri Group,United States,"coordinator, support, test, manager, education, management, content, operations, operational, non tech",2026-04-12T08:00:04+00:00,https://remoteOK.com/remote-jobs/remote-content-operations-coordinator-colibri-group-1131086
Provider Success Manager,Regard,,"manager, director, education, engineering, non tech",2026-04-11T08:00:09+00:00,https://remoteOK.com/remote-jobs/remote-provider-success-manager-regard-1131084
Senior IAM Engineer,IonQ,"Bothell, Washington, United States; Boulder, Colorado, United States; College Park, Maryland, United States; Remote, US","web, senior, engineer",2026-04-11T00:01:12+00:00,https://remoteOK.com/remote-jobs/remote-senior-iam-engineer-ionq-1131083
Machine Learning Engineer,Radformation,,"design, support, software, code, financial, git, junior, engineer, digital nomad",2026-04-11T00:01:01+00:00,https://remoteOK.com/remote-jobs/remote-machine-learning-engineer-radformation-1131082
Senior Engineer Platform Devops,CloudWalk,São Paulo,"security, technical, programmer, code, assistant, devops, cloud, senior, operational, engineer, engineering",2026-04-11T00:00:53+00:00,https://remoteOK.com/remote-jobs/remote-senior-engineer-platform-devops-cloudwalk-1131081
Customer Service Agent,Above Lending,,"hr, support, financial, finance, microsoft, management, recruiting, full-time, non tech",2026-04-11T00:00:46+00:00,https://remoteOK.com/remote-jobs/remote-customer-service-agent-above-lending-1131080
Marketing Operations Specialist HR Solutions,Mitratech,Remote US,"hr, system, support, lead, operations, operational, marketing",2026-04-11T00:00:39+00:00,https://remoteOK.com/remote-jobs/remote-marketing-operations-specialist-hr-solutions-mitratech-1131079
Executive Assistant The CEO,Linus Health,Boston,"ceo, assistant, travel, operational, medical, health, executive",2026-04-11T00:00:29+00:00,https://remoteOK.com/remote-jobs/remote-executive-assistant-the-ceo-linus-health-1131078
Technical Product Manager,SupplyHouse.com,"Remote, India","manager, technical, growth, management, e-commerce",2026-04-11T00:00:18+00:00,https://remoteOK.com/remote-jobs/remote-technical-product-manager-supplyhouse-com-1131077
Helpdesk Customer Support Agent,"Whip, Inc.","Mexico City, MEX","support, operations",2026-04-11T00:00:07+00:00,https://remoteOK.com/remote-jobs/remote-helpdesk-customer-support-agent-whip-inc-1131076
Operations Engineer Kuala Lumpur,Xsolla,Kuala Lumpur,"jira, game, gaming, technical, support, video, fintech, cloud, node, management, lead, operations, operational, health, engineer, engineering",2026-04-10T16:01:07+00:00,https://remoteOK.com/remote-jobs/remote-operations-engineer-kuala-lumpur-xsolla-1131075
Senior Product Designer,Kiefer,Athens,"design, designer, support, ux, manager, senior, engineering, digital nomad",2026-04-10T16:00:30+00:00,https://remoteOK.com/remote-jobs/remote-senior-product-designer-kiefer-1131074
Implementation Specialist Poland,Wemolo,Wroclaw,"training, technical, support, management, go",2026-04-10T16:00:23+00:00,https://remoteOK.com/remote-jobs/remote-implementation-specialist-poland-wemolo-1131073
Xsolla Senior Full stack Engineer,Xsolla,Serbia,"design, react, system, frontend, full-stack, docker, senior, reliability, go, engineer, engineering, backend, digital nomad",2026-04-10T16:00:17+00:00,https://remoteOK.com/remote-jobs/remote-xsolla-senior-full-stack-engineer-xsolla-1131072
Junior Integration Manager US,Xsolla,Remote USA,"manager, training, game, technical, web, video, education, management, junior, educational",2026-04-10T16:00:08+00:00,https://remoteOK.com/remote-jobs/remote-junior-integration-manager-us-xsolla-1131071
Cyber Security Analyst,Trilogy Federal,"Arlington, VA","security, analyst, system, training, technical, support, testing, code, financial, cloud, management, operational",2026-04-10T08:00:21+00:00,https://remoteOK.com/remote-jobs/remote-cyber-security-analyst-trilogy-federal-1131069
Engineering Manager,Hinge Health,Bengaluru,"manager, architect, technical, support, software, growth, payroll, financial, leader, strategy, management, lead, operational, marketing, medical, health, healthcare, recruiting, engineering",2026-04-10T08:00:14+00:00,https://remoteOK.com/remote-jobs/remote-engineering-manager-hinge-health-1131068
Senior FinCrime Support Analyst,Apron,Krakow,"analyst, training, support, growth, financial, fintech, senior, junior",2026-04-10T08:00:08+00:00,https://remoteOK.com/remote-jobs/remote-senior-fincrime-support-analyst-apron-1131067
Staff Software Engineer Full Stack,Ternary,,"software, front-end, technical, support, web, travel, financial, finance, api, junior, analytics, go, health, engineer, engineering, backend",2026-04-10T08:00:02+00:00,https://remoteOK.com/remote-jobs/remote-staff-software-engineer-full-stack-ternary-1131066
Sr Sourcer GTM Leadership,Obsidian Security,East Coast,"infosec, saas, security, technical, sourcer, growth, microsoft, marketing, sales, go",2026-04-10T00:01:28+00:00,https://remoteOK.com/remote-jobs/remote-sr-sourcer-gtm-leadership-obsidian-security-1131065
Direct Response Writer & Creative Lead,The Motley Fool,United States,"back-end, writer, financial, video, investment, investor, lead, content, senior, sales, non tech",2026-04-10T00:01:18+00:00,https://remoteOK.com/remote-jobs/remote-direct-response-writer-creative-lead-the-motley-fool-1131064
Power Systems Engineer,Carbon Direct,United States,"management, engineer",2026-04-10T00:01:08+00:00,https://remoteOK.com/remote-jobs/remote-power-systems-engineer-carbon-direct-1131063
Bilingual Licensed Mental Health Therapist North Carolina,Ascend Healthcare,North Carolina,"support, operational, health, medical, healthcare, non tech",2026-04-10T00:00:59+00:00,https://remoteOK.com/remote-jobs/remote-bilingual-licensed-mental-health-therapist-north-carolina-ascend-healthcare-1131062
Director of Solar Outreach and Market and Strategy,Energy Solutions,Chicago,"director, strategy",2026-04-10T00:00:50+00:00,https://remoteOK.com/remote-jobs/remote-director-of-solar-outreach-and-market-and-strategy-energy-solutions-1131061
Sales Development Representative,eSCRIBE,United States,"technical, growth, lead, marketing, sales",2026-04-10T00:00:40+00:00,https://remoteOK.com/remote-jobs/remote-sales-development-representative-escribe-1131060
Senior UX Researcher & Analyst,Casechek,Remote,"ux, analyst, design, system, designer, lead, senior, health, engineering, digital nomad",2026-04-10T00:00:30+00:00,https://remoteOK.com/remote-jobs/remote-senior-ux-researcher-analyst-casechek-1131059
Front End Engineer,Decile Group,Remote,"design, saas, front-end, software, ui, javascript, investment, css, ruby, rails, engineer, digital nomad",2026-04-10T00:00:20+00:00,https://remoteOK.com/remote-jobs/remote-front-end-engineer-decile-group-1131058
Product Manager,Decile Group,Remote,"manager, design, saas, technical, support, web, voice, financial, investment, management, analytics, legal, engineer, engineering, digital nomad",2026-04-10T00:00:13+00:00,https://remoteOK.com/remote-jobs/remote-product-manager-decile-group-1131057
Consultant Restoration and Remediation,Surefire Cyber,,"consultant, system",2026-04-10T00:00:06+00:00,https://remoteOK.com/remote-jobs/remote-consultant-restoration-and-remediation-surefire-cyber-1131056
Infrastructure &amp; Capital Projects Procurement Specialist ANS,"Accenture Infrastructure &amp; Capital Projects, LLC",Remote,"technical, recruiter, financial, finance, microsoft, legal",2026-04-09T16:01:37+00:00,https://remoteOK.com/remote-jobs/remote-infrastructure-amp-capital-projects-procurement-specialist-ans-accenture-infrastructure-amp-capital-projects-llc-1131055
Senior Security Infrastructure Engineer,Sezzle,Brazil,"security, developer, fintech, cloud, senior, sales, engineer, engineering, digital nomad",2026-04-09T16:01:07+00:00,https://remoteOK.com/remote-jobs/remote-senior-security-infrastructure-engineer-sezzle-1131054
Finance Intern,Presence,,"design, support, controller, travel, manager, accounting, finance, management, senior, health, internship, part-time, digital nomad",2026-04-09T16:00:54+00:00,https://remoteOK.com/remote-jobs/remote-finance-intern-presence-1131053
Technical Support Specialist,Great Minds,,"students, technical, support, growth, banking, math, strategy, management, content, sales, educational",2026-04-09T16:00:44+00:00,https://remoteOK.com/remote-jobs/remote-technical-support-specialist-great-minds-1131052
Licensed Master Social Worker,Brave Health,,"recruiter, support, growth, video, education, senior, medical, health, healthcare",2026-04-09T16:00:38+00:00,https://remoteOK.com/remote-jobs/remote-licensed-master-social-worker-brave-health-1131051
Senior Director Field Engineering,Smartsheet,,"director, technical, support, management, senior, sales, engineering",2026-04-09T16:00:32+00:00,https://remoteOK.com/remote-jobs/remote-senior-director-field-engineering-smartsheet-1131050
Product Designer,Sharebite,Remote,"design, designer, ui, engineering, digital nomad",2026-04-09T16:00:23+00:00,https://remoteOK.com/remote-jobs/remote-product-designer-sharebite-1131049
Product Manager,Sharebite,Remote,"manager, saas, growth, strategy, management, lead",2026-04-09T16:00:07+00:00,https://remoteOK.com/remote-jobs/remote-product-manager-sharebite-1131048
Creative Director,Lumimeds,US-Based,"director, design, management, marketing, e-commerce, digital nomad",2026-04-09T08:00:07+00:00,https://remoteOK.com/remote-jobs/remote-creative-director-lumimeds-1131047
National Account Manager Footwear,ARC&#39;TERYX,"New York, NY","manager, support, growth, travel, education, math, lead, marketing, analytics, sales, health",2026-04-09T00:01:28+00:00,https://remoteOK.com/remote-jobs/remote-national-account-manager-footwear-arc39teryx-1131046
E01 HR Compliance Specialist IV,EXPANSIA,Remote,"hr, design, security, training, support, growth, management, senior, operations, operational, legal, health, digital nomad",2026-04-09T00:01:19+00:00,https://remoteOK.com/remote-jobs/remote-e01-hr-compliance-specialist-iv-expansia-1131045
IT Specialist II,Makpar,,"training, consulting, technical, support, software, cloud, microsoft, operations, operational, legal",2026-04-09T00:01:12+00:00,https://remoteOK.com/remote-jobs/remote-it-specialist-ii-makpar-1131044
Senior Client Data &amp; Analytics Lead,Kraken ,,"system, manager, leader, lead, senior, analytics, full-time",2026-04-09T00:01:04+00:00,https://remoteOK.com/remote-jobs/remote-senior-client-data-amp-analytics-lead-kraken-1131043
Licensed Professional Counselor,Pelago,,"support, growth, c, health",2026-04-09T00:00:55+00:00,https://remoteOK.com/remote-jobs/remote-licensed-professional-counselor-pelago-1131042
Senior Emulation Engineer,EnCharge AI,India,"design, support, software, leader, senior, engineer, digital nomad",2026-04-09T00:00:47+00:00,https://remoteOK.com/remote-jobs/remote-senior-emulation-engineer-encharge-ai-1131041
Mixed Signal IC Layout Design Engineer,Tenstorrent,North America,"design, software, reliability, engineer, digital nomad",2026-04-09T00:00:37+00:00,https://remoteOK.com/remote-jobs/remote-mixed-signal-ic-layout-design-engineer-tenstorrent-1131040
Senior Technical Sourcer Software,Anduril Industries,,"software, system, 3d, technical, sourcer, support, growth, senior, recruitment",2026-04-09T00:00:27+00:00,https://remoteOK.com/remote-jobs/remote-senior-technical-sourcer-software-anduril-industries-1131039
Lead Instructor Applied AI Engineering Summer 2026,CodePath,,"instructor, students, training, technical, support, manager, education, lead, senior, engineering",2026-04-09T00:00:16+00:00,https://remoteOK.com/remote-jobs/remote-lead-instructor-applied-ai-engineering-summer-2026-codepath-1131038
