Job Title,Company,Location,Tags,Date,Apply Link
Account Director,MERGE,Remote,"director, leader, management, lead, senior, marketing, health, healthcare, non tech",2026-03-31T00:00:51+00:00,https://remoteOK.com/remote-jobs/remote-account-director-merge-1130936
Customer Program Manager,Nexxa.AI,Sunnyvale,"manager, jira, training, consulting, cto, technical, qa, management, operations, operational, engineering",2026-03-31T00:00:41+00:00,https://remoteOK.com/remote-jobs/remote-customer-program-manager-nexxa-ai-1130935
Data Scientist Claim Experience Analytics,Extend,"Remote, US","operational, analytics, engineering",2026-03-31T00:00:35+00:00,https://remoteOK.com/remote-jobs/remote-data-scientist-claim-experience-analytics-extend-1130934
Senior Software Engineer Full Stack,Grow Therapy,"New York, NY","software, system, technical, senior, healthcare, engineer, engineering",2026-03-31T00:00:24+00:00,https://remoteOK.com/remote-jobs/remote-senior-software-engineer-full-stack-grow-therapy-1130933
Software Engineer,Clover Health,USA,"software, design, financial, cloud, management, operational, medical, health, healthcare, engineer, digital nomad",2026-03-31T00:00:15+00:00,https://remoteOK.com/remote-jobs/remote-software-engineer-clover-health-1130932
Sales Executive Telecoms & Networking,WebProps.org,,"sales, executive",2026-03-29T16:00:09+00:00,https://remoteOK.com/remote-jobs/remote-sales-executive-telecoms-networking-webprops-org-1130931
Biomedical Clinical Engineer Senior,Ibility,Washington DC,"design, system, security, technical, management, senior, health, healthcare, engineer, engineering, digital nomad",2026-03-29T08:00:15+00:00,https://remoteOK.com/remote-jobs/remote-biomedical-clinical-engineer-senior-ibility-1130930
Clinical Psychologist,LifeStance Health,"Crofton, MD","adult, lead, medical, health, healthcare, non tech",2026-03-28T16:01:20+00:00,https://remoteOK.com/remote-jobs/remote-clinical-psychologist-lifestance-health-1130929
Head of Finance North America,Adyen,San Francisco,"technical, support, growth, financial, finance, microsoft, lead, senior",2026-03-28T16:01:13+00:00,https://remoteOK.com/remote-jobs/remote-head-of-finance-north-america-adyen-1130928
Manager of Revenue Operations,LatamCent,,"manager, design, technical, support, growth, management, lead, operations, operational, marketing, sales, digital nomad",2026-03-28T16:00:59+00:00,https://remoteOK.com/remote-jobs/remote-manager-of-revenue-operations-latamcent-1130927
Product Security Manager,MoonPay,United States (East Coast Time Zone) - Remote,"security, manager, design, web3, crypto, system, training, technical, support, software, testing, code, voice, financial, serverless, cloud, leader, management, lead, operations, healthcare, engineering, digital nomad",2026-03-28T16:00:52+00:00,https://remoteOK.com/remote-jobs/remote-product-security-manager-moonpay-1130926
Applied Computational Nutrition Scientist,WISEcode,United States,"system, support, test, code, math, lead",2026-03-28T16:00:39+00:00,https://remoteOK.com/remote-jobs/remote-applied-computational-nutrition-scientist-wisecode-1130925
Staff Machine Learning Engineer,Fullscript,,"design, system, python, technical, support, code, senior, go, health, healthcare, engineer, engineering, backend, digital nomad",2026-03-28T16:00:32+00:00,https://remoteOK.com/remote-jobs/remote-staff-machine-learning-engineer-fullscript-1130924
Cloud Security Engineer,MoonPay,,"security, crypto, system, swift, training, technical, support, code, voice, financial, cloud, management, lead, healthcare, engineer, engineering",2026-03-28T16:00:25+00:00,https://remoteOK.com/remote-jobs/remote-cloud-security-engineer-moonpay-1130923
Recruiting Coordinator Temporary,SpaceX,"Hawthorne, CA","coordinator, support, microsoft, operations, recruiting",2026-03-28T16:00:17+00:00,https://remoteOK.com/remote-jobs/remote-recruiting-coordinator-temporary-spacex-1130922
Senior Security Engineer Automation,MoonPay,,"security, crypto, system, swift, training, technical, support, software, voice, financial, cloud, api, strategy, management, senior, operational, excel, healthcare, engineer, engineering, backend",2026-03-28T16:00:06+00:00,https://remoteOK.com/remote-jobs/remote-senior-security-engineer-automation-moonpay-1130921
Clinician Experience Specialist,Nabla,New York City,"support, software, travel, assistant, financial, video, senior, operations, excel, health, healthcare, engineering, recruitment, educational",2026-03-28T00:00:33+00:00,https://remoteOK.com/remote-jobs/remote-clinician-experience-specialist-nabla-1130917
Content &amp; Training Manager,Fi,"New York, NY","training, manager, support, education, management, content, senior, full-time, non tech",2026-03-28T00:00:26+00:00,https://remoteOK.com/remote-jobs/remote-content-amp-training-manager-fi-1130916
Staff Software Engineer Platform,SmithRx,,"software, design, system, test, management, healthcare, engineer, engineering, digital nomad",2026-03-28T00:00:19+00:00,https://remoteOK.com/remote-jobs/remote-staff-software-engineer-platform-smithrx-1130915
Senior Staff Data Engineer,SmithRx,Remote,"system, management, senior, analytics, healthcare, engineer, engineering",2026-03-28T00:00:09+00:00,https://remoteOK.com/remote-jobs/remote-senior-staff-data-engineer-smithrx-1130914
AI Data Specialist,micro1,,"senior, marketing, saas, finance, legal, medical, other, stats, exec",2026-03-27T20:24:05+00:00,https://remoteOK.com/remote-jobs/remote-ai-data-specialist-micro1-1130913
Engenharia Software Engineer III Golang Elixir,Stone,Remoto,"software, golang, engineer",2026-03-27T16:01:21+00:00,https://remoteOK.com/remote-jobs/remote-engenharia-software-engineer-iii-golang-elixir-stone-1130912
Salesforce Technical Consultant,Hunt St,,"salesforce, consultant, jira, system, technical, support, developer, web, financial, administrator, management, legal, digital nomad",2026-03-27T16:01:10+00:00,https://remoteOK.com/remote-jobs/remote-salesforce-technical-consultant-hunt-st-1130911
Nurse Practitioner Weekdays 9 00am 6 00pm PST Telehealth Primary Care,Curai,Remote,"video, education, health, healthcare, non tech",2026-03-27T16:01:03+00:00,https://remoteOK.com/remote-jobs/remote-nurse-practitioner-weekdays-9-00am-6-00pm-pst-telehealth-primary-care-curai-1130910
Senior Software Engineer C++ Windows SDK WIN32 API,Ivanti,Hyderabad,"software, design, saas, security, technical, support, c++, cloud, api, microsoft, management, lead, senior, reliability, engineer, engineering, digital nomad",2026-03-27T16:00:54+00:00,https://remoteOK.com/remote-jobs/remote-senior-software-engineer-c-windows-sdk-win32-api-ivanti-1130909
Senior Backend Engineer Integrations,Arbiter AI,New York City,"design, system, python, technical, support, financial, cloud, api, senior, operational, health, healthcare, engineer, engineering, backend, digital nomad",2026-03-27T16:00:44+00:00,https://remoteOK.com/remote-jobs/remote-senior-backend-engineer-integrations-arbiter-ai-1130908
Product Marketing Manager Ecommerce,GetResponse,,"manager, design, saas, recruiter, support, test, growth, video, strategy, content, marketing, sales, health, recruitment, educational, ecommerce, digital nomad",2026-03-27T16:00:37+00:00,https://remoteOK.com/remote-jobs/remote-product-marketing-manager-ecommerce-getresponse-1130907
Brand & Growth Designer,Fluxon,Portugal,"growth, design, designer, support, senior, marketing, sales, engineering, branding, digital nomad",2026-03-27T16:00:31+00:00,https://remoteOK.com/remote-jobs/remote-brand-growth-designer-fluxon-1130906
Scientific Director Medical Affairs,Iovance Biotherapeutics,,"director, system, support, education, leader",2026-03-27T16:00:21+00:00,https://remoteOK.com/remote-jobs/remote-scientific-director-medical-affairs-iovance-biotherapeutics-1130905
VP Data Engineering,Consumer Edge,New York,"technical, financial, investment, cloud, management, lead, engineering",2026-03-27T16:00:07+00:00,https://remoteOK.com/remote-jobs/remote-vp-data-engineering-consumer-edge-1130904
Social Media Content Creator,Remote Chess Academy,,"design, full time, Content Creator",2026-03-27T13:45:19+00:00,https://remoteOK.com/remote-jobs/remote-social-media-content-creator-remote-chess-academy-1130903
Senior Payroll Associate Indian Payroll India,Deel,,"payroll, hr, technical, support, software, cloud, microsoft, leader, management, lead, senior, junior, healthcare",2026-03-27T08:00:53+00:00,https://remoteOK.com/remote-jobs/remote-senior-payroll-associate-indian-payroll-india-deel-1130900
Associate Director CMC,Allucent,,"director, training, consulting, technical, support, growth, manager, management, lead, content, operations, health, recruitment",2026-03-27T08:00:47+00:00,https://remoteOK.com/remote-jobs/remote-associate-director-cmc-allucent-1130899
Talent Partner,Cloudbeds,Peru,"support, strategy, operations, recruiting, recruitment",2026-03-27T08:00:41+00:00,https://remoteOK.com/remote-jobs/remote-talent-partner-cloudbeds-1130898
Spanish Speaking Customer Service Agent For Electronics Company Work Greece,Mercier Consultancy Group,,"consulting, system, swift, consultancy, support, software",2026-03-27T08:00:31+00:00,https://remoteOK.com/remote-jobs/remote-spanish-speaking-customer-service-agent-for-electronics-company-work-greece-mercier-consultancy-group-1130897
Principal Data Engineer,Waymark,,"technical, health, healthcare, engineer, engineering, backend",2026-03-27T08:00:25+00:00,https://remoteOK.com/remote-jobs/remote-principal-data-engineer-waymark-1130896
Associate Social Media Engagement Manager,Nex,,"manager, design, system, gaming, support, content, educational, digital nomad",2026-03-27T08:00:16+00:00,https://remoteOK.com/remote-jobs/remote-associate-social-media-engagement-manager-nex-1130895
Product Designer,OpenRouter,,"design, frontend, designer, technical, developer, growth, code, api, marketing, analytics, engineering, digital nomad",2026-03-27T08:00:07+00:00,https://remoteOK.com/remote-jobs/remote-product-designer-openrouter-1130894
Site Reliability Engineer US West,MinIO,,"software, devops, leader, reliability, engineer, engineering",2026-03-26T16:01:22+00:00,https://remoteOK.com/remote-jobs/remote-site-reliability-engineer-us-west-minio-1130893
Principal Solution Architect Professional Services Finance,Anaplan,Minneapolis,"architect, design, consulting, support, finance, lead, senior, sales, digital nomad",2026-03-26T16:01:05+00:00,https://remoteOK.com/remote-jobs/remote-principal-solution-architect-professional-services-finance-anaplan-1130892
Senior Technical Success Manager,New Relic,Bangalore,"manager, technical, management, senior, executive",2026-03-26T16:00:55+00:00,https://remoteOK.com/remote-jobs/remote-senior-technical-success-manager-new-relic-1130891
Senior Talent Acquisition Coordinator,New Relic,Hyderabad,"coordinator, video, senior, non tech",2026-03-26T16:00:46+00:00,https://remoteOK.com/remote-jobs/remote-senior-talent-acquisition-coordinator-new-relic-1130890
Studio Manager,"Vox Media, LLC","New York, New York","manager, technical, support, video, management, operations, engineering, full-time",2026-03-26T16:00:38+00:00,https://remoteOK.com/remote-jobs/remote-studio-manager-vox-media-llc-1130889
Senior Product Manager Checkout & Post Booking,Tripadvisor,POL Virtual,"manager, testing, travel, lead, senior, non tech",2026-03-26T16:00:28+00:00,https://remoteOK.com/remote-jobs/remote-senior-product-manager-checkout-post-booking-tripadvisor-1130888
Outbound Account Executive US,Amplemarket,"Remote, US","lead, sales, executive",2026-03-26T16:00:18+00:00,https://remoteOK.com/remote-jobs/remote-outbound-account-executive-us-amplemarket-1130887
Commercial Associate,molecule.xyz,,"web3, system, ceo, investor, sales, biotech",2026-03-26T08:00:08+00:00,https://remoteOK.com/remote-jobs/remote-commercial-associate-molecule-xyz-1130884
Ads Video Editor for DTC Group,Paired,,"support, testing, video, ads, content, recruiting, non tech",2026-03-26T08:00:02+00:00,https://remoteOK.com/remote-jobs/remote-ads-video-editor-for-dtc-group-paired-1130883
Staff Accountant LATAM,HireHawk,,accountant,2026-03-26T00:01:02+00:00,https://remoteOK.com/remote-jobs/remote-staff-accountant-latam-hirehawk-1130882
Senior Developer Backend Search CD+E,Ubiminds,Remote,"developer, design, hr, frontend, technical, recruiter, support, software, growth, video, cloud, api, senior, junior, engineering, apache, backend, full-time, digital nomad",2026-03-26T00:00:53+00:00,https://remoteOK.com/remote-jobs/remote-senior-developer-backend-search-cd-e-ubiminds-1130881
Interior Designer,Bold Business,"India, Philippines","design, designer, support, code, part-time, digital nomad",2026-03-26T00:00:30+00:00,https://remoteOK.com/remote-jobs/remote-interior-designer-bold-business-1130880
PMHNP Clinical Autonomy & Total Flexibility,Seasoned Recruitment,,"management, recruiter, non tech",2026-03-26T00:00:20+00:00,https://remoteOK.com/remote-jobs/remote-pmhnp-clinical-autonomy-total-flexibility-seasoned-recruitment-1130879
Senior Manager Strategic Partner Marketing,Vanta,,"manager, security, technical, growth, cloud, strategy, management, senior, marketing, sales, executive",2026-03-26T00:00:09+00:00,https://remoteOK.com/remote-jobs/remote-senior-manager-strategic-partner-marketing-vanta-1130878
Strategic Account Executive,Zip,Stockholm,"saas, leader, sales, executive, e-commerce",2026-03-26T00:00:02+00:00,https://remoteOK.com/remote-jobs/remote-strategic-account-executive-zip-1130877
Lead Security Engineer,Copia Automation,New York City,"security, design, saas, support, developer, cloud, api, management, lead, senior, operations, operational, healthcare, engineer, engineering, linux, executive, digital nomad",2026-03-25T16:00:04+00:00,https://remoteOK.com/remote-jobs/remote-lead-security-engineer-copia-automation-1130876
Fire Protection Engineer,Skillcloud HCM,"Portland, Maine","design, system, software, code, engineer, engineering, digital nomad",2026-03-25T08:00:03+00:00,https://remoteOK.com/remote-jobs/remote-fire-protection-engineer-skillcloud-hcm-1130875
Compensation Analyst,BHG Financial,Remote,"analyst, design, hr, training, support, software, growth, finance, financial, leader, management, lead, excel, healthcare, digital nomad",2026-03-25T00:00:54+00:00,https://remoteOK.com/remote-jobs/remote-compensation-analyst-bhg-financial-1130874
Mid Market Customer Account Manager,Iterable,REMOTE - US,"manager, design, security, growth, digital nomad",2026-03-25T00:00:44+00:00,https://remoteOK.com/remote-jobs/remote-mid-market-customer-account-manager-iterable-1130873
Senior Salesforce Developer,Boulevard,,"salesforce, developer, design, senior, engineer, digital nomad",2026-03-25T00:00:32+00:00,https://remoteOK.com/remote-jobs/remote-senior-salesforce-developer-boulevard-1130872
Senior Frontend Engineer Frontend Platform,Vannevar,Remote,"frontend, developer, code, senior, engineer, digital nomad",2026-03-25T00:00:20+00:00,https://remoteOK.com/remote-jobs/remote-senior-frontend-engineer-frontend-platform-vannevar-1130871
Research Engineer,Turing,Huila,"training, technical, software, code, engineer, engineering",2026-03-24T16:00:25+00:00,https://remoteOK.com/remote-jobs/remote-research-engineer-turing-1130869
Enterprise Account Executive Coda,Superhuman,United States,"travel, assistant, sales, educational, executive",2026-03-24T16:00:15+00:00,https://remoteOK.com/remote-jobs/remote-enterprise-account-executive-coda-superhuman-1130868
Crypto Trader,ELEMENTAL TERRA,,"other, crypto, finance, web3, blockchain, defi, education, bitcoin, ethereum, legal",2026-03-24T14:27:33+00:00,https://remoteOK.com/remote-jobs/remote-crypto-trader-elemental-terra-1130867
Lead Front End Software Engineer,Callibrity,Remote,"software, design, front-end, consulting, technical, developer, angular, leader, lead, engineer, backend, digital nomad",2026-03-24T00:00:14+00:00,https://remoteOK.com/remote-jobs/remote-lead-front-end-software-engineer-callibrity-1130866
Senior Accountant,Blink Health,United States,"accountant, system, security, support, financial, cloud, senior, medical, health, healthcare",2026-03-24T00:00:05+00:00,https://remoteOK.com/remote-jobs/remote-senior-accountant-blink-health-1130865
Purview Consultant,High Tech Genesis,,"consultant, design, security, technical, support, cloud, api, microsoft, management, lead, recruitment, digital nomad",2026-03-23T16:00:13+00:00,https://remoteOK.com/remote-jobs/remote-purview-consultant-high-tech-genesis-1130862
Marketing Manager Events FT Live,Financial Times,London,"manager, support, growth, finance, financial, senior, marketing",2026-03-23T08:00:07+00:00,https://remoteOK.com/remote-jobs/remote-marketing-manager-events-ft-live-financial-times-1130861
Security Engineer II Canada,NerdWallet,,"security, design, python, support, developer, software, test, web, javascript, financial, cloud, operational, healthcare, engineer, engineering, digital nomad",2026-03-22T08:00:02+00:00,https://remoteOK.com/remote-jobs/remote-security-engineer-ii-canada-nerdwallet-1130860
Brand Designer,Vanta,,"design, saas, security, designer, growth, strategy, management, sales, digital nomad",2026-03-21T00:00:11+00:00,https://remoteOK.com/remote-jobs/remote-brand-designer-vanta-1130857
Tech Lead,Zipdev,,"design, system, cto, technical, software, code, lead, content, marketing, engineering, backend, digital nomad",2026-03-21T00:00:05+00:00,https://remoteOK.com/remote-jobs/remote-tech-lead-zipdev-1130856
Sales & Business Development Director,NEAR Foundation,San Francisco,"director, technical, financial, robotics, sales",2026-03-20T16:00:30+00:00,https://remoteOK.com/remote-jobs/remote-sales-business-development-director-near-foundation-1130854
Happiness Engineer Customer Support & Success,Automattic Careers,Remote,"happiness, wordpress, technical, support, growth, senior, engineer, woocommerce",2026-03-20T16:00:14+00:00,https://remoteOK.com/remote-jobs/remote-happiness-engineer-customer-support-success-automattic-careers-1130853
GenAI Senior Integrated Designer,Brandtech+,South Africa,"designer, senior",2026-03-20T16:00:12+00:00,https://remoteOK.com/remote-jobs/remote-genai-senior-integrated-designer-brandtech-1130852
Product Manager Growth,12Go Asia,,"growth, manager, training, technical, seo, ads, strategy, management, content, marketing",2026-03-20T16:00:03+00:00,https://remoteOK.com/remote-jobs/remote-product-manager-growth-12go-asia-1130851
Smart Contract Engineer SVM,Veda Tech Labs,Remote,"defi, front-end, security, technical, testing, growth, code, financial, api, management, operations, engineer, engineering",2026-03-20T13:00:15+00:00,https://remoteOK.com/remote-jobs/remote-smart-contract-engineer-svm-veda-tech-labs-1130849
Senior Product Manager Core Infrastructure,Mesh,,"manager, web3, crypto, teach, technical, strategy, senior, engineering",2026-03-20T13:00:04+00:00,https://remoteOK.com/remote-jobs/remote-senior-product-manager-core-infrastructure-mesh-1130848
Accounting Clerk,"Defense Holdings, Inc.",Manassas Park,"accounting, security, support, software, bookkeeping, financial, finance, microsoft, management, operations, operational",2026-03-20T08:00:36+00:00,https://remoteOK.com/remote-jobs/remote-accounting-clerk-defense-holdings-inc-1130847
Senior 3D Cinematic Animation Artist,thatgamecompany,Los Angeles,"3d, design, game, technical, support, software, animation, senior, health, engineering, digital nomad",2026-03-20T08:00:29+00:00,https://remoteOK.com/remote-jobs/remote-senior-3d-cinematic-animation-artist-thatgamecompany-1130846
Financial Crimes Analyst I,Dave,,"analyst, training, support, manager, financial, fintech, banking, management",2026-03-20T08:00:22+00:00,https://remoteOK.com/remote-jobs/remote-financial-crimes-analyst-i-dave-1130845
Senior Associate Finance,Aksia,,"cfo, accounting, financial, investment, finance, management, senior, non tech",2026-03-20T08:00:17+00:00,https://remoteOK.com/remote-jobs/remote-senior-associate-finance-aksia-1130844
Affiliate Marketing & Partnerships Lead,Material Bank,,"design, growth, code, finance, bank, strategy, lead, content, marketing, digital nomad",2026-03-20T08:00:07+00:00,https://remoteOK.com/remote-jobs/remote-affiliate-marketing-partnerships-lead-material-bank-1130843
Government Underwriter,JMAC Lending,,"education, banking, leader, management, health, non tech",2026-03-20T00:00:10+00:00,https://remoteOK.com/remote-jobs/remote-government-underwriter-jmac-lending-1130842
58134729590 Marketing Operations & Execution Lead,Activate Talent,,"founder, ceo, test, growth, ads, strategy, lead, content, operations, marketing, ecommerce, full-time",2026-03-20T00:00:04+00:00,https://remoteOK.com/remote-jobs/remote-58134729590-marketing-operations-execution-lead-activate-talent-1130841
Forward Deployed Engineer VoIP,Parloa,New York,"voip, embedded, security, architect, technical, test, lead, operational, engineer",2026-03-19T20:00:28+00:00,https://remoteOK.com/remote-jobs/remote-forward-deployed-engineer-voip-parloa-1130840
Senior Staff Software Engineer AI Customer Operations,Monzo,"Cardiff, London","software, financial, education, bank, senior, operations, engineer, engineering",2026-03-19T20:00:17+00:00,https://remoteOK.com/remote-jobs/remote-senior-staff-software-engineer-ai-customer-operations-monzo-1130839
Customer Support Specialist,HighLevel,Remote,"technical, support, manager, education, api, content, senior, marketing, legal, sales",2026-03-19T16:00:01+00:00,https://remoteOK.com/remote-jobs/remote-customer-support-specialist-highlevel-1130837
Lead Product Designer,Alpaca,Remote - Canada - LATAM,"design, crypto, designer, support, web, financial, investment, api, mobile, lead, digital nomad",2026-03-19T09:00:05+00:00,https://remoteOK.com/remote-jobs/remote-lead-product-designer-alpaca-1130835
Go To Market Engineer,TestGorilla,,"sales, marketing, engineer",2026-03-19T05:38:33+00:00,https://remoteOK.com/remote-jobs/remote-go-to-market-engineer-testgorilla-1130833
Revenue Operations Manager,TestGorilla,,"sales, ops, marketing",2026-03-19T05:17:29+00:00,https://remoteOK.com/remote-jobs/remote-revenue-operations-manager-testgorilla-1130832
Assistant $2k Weekly + Welcome Bonus,MASTERCRAFT BOATING COMPANY,,"sales, marketing, admin, customer support, virtual assistant",2026-03-19T05:16:41+00:00,https://remoteOK.com/remote-jobs/remote-assistant-2k-weekly-welcome-bonus-mastercraft-boating-company-1130831
Senior Staff Engineer Product Security,Faire,"San Francisco, CA","security, design, amazon, consult, technical, developer, software, growth, lead, senior, engineer, engineering, e-commerce, digital nomad",2026-03-19T00:00:13+00:00,https://remoteOK.com/remote-jobs/remote-senior-staff-engineer-product-security-faire-1130828
Missing Heir Specialist Estate Claim Sales Representative,Lauth Investigations International Inc,,"legal, sales, non tech",2026-03-19T00:00:04+00:00,https://remoteOK.com/remote-jobs/remote-missing-heir-specialist-estate-claim-sales-representative-lauth-investigations-international-inc-1130827
Principal Machine Learning Engineer,Attentive,United States,"marketing, engineer",2026-03-18T19:00:03+00:00,https://remoteOK.com/remote-jobs/remote-principal-machine-learning-engineer-attentive-1130826
Director MedEcon,Waymark,,"director, support, finance, leader, healthcare, non tech",2026-03-18T16:01:07+00:00,https://remoteOK.com/remote-jobs/remote-director-medecon-waymark-1130825
Data Scientist Subscriptions,Spotify,"New York, NY",growth,2026-03-18T16:00:57+00:00,https://remoteOK.com/remote-jobs/remote-data-scientist-subscriptions-spotify-1130824
Junior Manual QA Engineer,Topstep,United States,"technical, testing, test, web, qa, financial, junior, engineer",2026-03-18T16:00:48+00:00,https://remoteOK.com/remote-jobs/remote-junior-manual-qa-engineer-topstep-1130823
Customer Service Booking Hotels We Will Train You,Destination Knot,"Dallas, Texas","training, support, travel, sales, non tech",2026-03-18T16:00:35+00:00,https://remoteOK.com/remote-jobs/remote-customer-service-booking-hotels-we-will-train-you-destination-knot-1130822
Compliance Program Specialist,Machinify,,"design, training, support, financial, content, operational, legal, health, healthcare, digital nomad",2026-03-18T16:00:18+00:00,https://remoteOK.com/remote-jobs/remote-compliance-program-specialist-machinify-1130821
