Job Title,Company,Location,Tags,Date,Apply Link
Assistant Controller,Treewalk,"Vancouver, Vancouver, British Columbia, Canada","virtual assistant, salesforce, infosec, technical, supervisor, customer support, travel, finance, microsoft, exec, ops, recruiter, accounting, sys admin, education, dev, payroll, senior, medical, full time, digital nomad, controller, golang, ecommerce",2026-07-14T18:36:04+00:00,https://remoteOK.com/remote-jobs/remote-assistant-controller-treewalk-1134904
LSA,King Edward VI Preparatory School,"Staffordshire, ","education, customer support, speech, scheme, exec, ops, recruiter, infosec",2026-07-14T17:46:28+00:00,https://remoteOK.com/remote-jobs/remote-lsa-king-edward-vi-preparatory-school-1134831
Estimator,Airswift,"Port of Spain, ","technical, customer support, dev, api, microsoft, exec, ops, excel, engineer, digital nomad",2026-07-14T17:37:14+00:00,https://remoteOK.com/remote-jobs/remote-estimator-airswift-1134821
Designer,Intelligent Change,"Toronto, Toronto, Ontario, Canada","virtual assistant, salesforce, infosec, technical, supervisor, customer support, travel, finance, microsoft, exec, ops, recruiter, accounting, sys admin, education, dev, payroll, senior, medical, full time, digital nomad, controller, golang, ecommerce, design, designer, copywriting, marketing, web dev, ads, content writing",2026-07-14T16:10:22+00:00,https://remoteOK.com/remote-jobs/remote-designer-intelligent-change-1134905
Photo Editor,Headout,"India, ","teaching, testing, english teacher, non tech, design, virtual assistant, vfx, technical, customer support, education, digital nomad, transcribing, speech, ops, medical",2026-07-14T16:07:35+00:00,https://remoteOK.com/remote-jobs/remote-photo-editor-headout-1134817
Junior Contact Center Agent,Volkswagen Group,"Palmela, ","copywriting, non tech, product manager, exec, design, saas, embedded, customer support, marketing, content writing, senior, ops, recruiter, digital nomad, admin, education, technical, dev, finance, junior, engineer",2026-07-14T15:26:29+00:00,https://remoteOK.com/remote-jobs/remote-junior-contact-center-agent-volkswagen-group-1134886
Proposal &amp; Business Development Specialist,Pubgenius Inc.,"Warszawa, Warszawa, Woj. Mazowieckie, Polska","mobile, engineer, exec, dev, junior, digital nomad, analyst, customer support, marketing, ops, excel, stats, sales, python, consulting, defi, react, react.js, technical, web dev, speech, javascript, finance, content writing, bus dev, medical, full time, part time",2026-07-14T14:27:21+00:00,https://remoteOK.com/remote-jobs/remote-proposal-amp-business-development-specialist-pubgenius-inc-1134924
Business Analyst,EasyPark,"Chişinău, Chişinău, Chișinău, Moldova","mobile, engineer, exec, dev, junior, digital nomad, analyst, customer support, marketing, ops, excel, stats, sales",2026-07-14T14:11:55+00:00,https://remoteOK.com/remote-jobs/remote-business-analyst-easypark-1134922
Caretaker,EQUANS,"Newcastle, ","education, customer support, speech, scheme, exec, ops, recruiter",2026-07-14T13:41:34+00:00,https://remoteOK.com/remote-jobs/remote-caretaker-equans-1134829
Estimating Assistant,RecruitGo Careers,"Quezon City, Quezon City, National Capital Region, Philippines","analyst, junior, virtual assistant, sys admin, customer support, microsoft, exec, senior, excel, legal",2026-07-14T13:23:30+00:00,https://remoteOK.com/remote-jobs/remote-estimating-assistant-recruitgo-careers-1134913
Job Fair July 27 28,Dexterra Group,"Charlottetown, ","education, non tech, ops, exec, full time, part time",2026-07-14T13:20:37+00:00,https://remoteOK.com/remote-jobs/remote-job-fair-july-27-28-dexterra-group-1134853
Técnico De Estudos E Propostas,Wikibuild S.A,"Lisboa, ","mobile, engineer, exec, dev, junior, digital nomad, analyst, customer support, marketing, ops, excel, stats, sales, python, consulting, defi, react, react.js, technical, web dev, speech, javascript, finance, content writing, bus dev, medical, full time, part time, designer, design, amazon, cloud, git, microsoft, ecommerce, shopify, front end, docker, testing, typescript, node, node.js, senior",2026-07-14T13:09:33+00:00,https://remoteOK.com/remote-jobs/remote-tecnico-de-estudos-e-propostas-wikibuild-s-a-1134929
Social Media Manager,aion,"New York, New York, New York, United States","design, marketing, exec, web dev, video, content writing, senior, photoshop, engineer, ecommerce, digital nomad, customer support, travel, education, finance, ops, legal, sales, golang, full time, part time, strategy, admin, full stack, technical, dev, social media",2026-07-14T13:04:29+00:00,https://remoteOK.com/remote-jobs/remote-social-media-manager-aion-1134877
QA Engineer,InEight,"Colombo, ","teaching, customer support, admin, microsoft, exec, ops, marketing, testing, travel, bus dev, sales, medical, recruiter, design, sys admin, dev, quality assurance, engineer, digital nomad",2026-07-14T12:57:45+00:00,https://remoteOK.com/remote-jobs/remote-qa-engineer-ineight-1134965
Customer Success Manager Brazil,Group-IB,"São Paulo, São Paulo, São Paulo, Brasil","design, hadoop, python, digital nomad, c, game dev, speech, exec, ops, bus dev, recruiter, customer support, infosec, education, technical, testing, marketing, golang, medical",2026-07-14T12:11:31+00:00,https://remoteOK.com/remote-jobs/remote-customer-success-manager-brazil-group-ib-1134910
