Job Title,Company,Location,Tags,Date,Apply Link
Adelaide,Dobinsons Spring &amp; Suspension - Middle East &amp; Africa,"Adelaide, ",,2026-07-17T03:14:23+00:00,https://remoteOK.com/remote-jobs/remote-adelaide-dobinsons-spring-amp-suspension-middle-east-amp-africa-1134958
Sydney,Dobinsons Spring &amp; Suspension - Middle East &amp; Africa,"Sydney, ",,2026-07-17T03:14:20+00:00,https://remoteOK.com/remote-jobs/remote-sydney-dobinsons-spring-amp-suspension-middle-east-amp-africa-1134959
Admin &amp; Operation English Speaker,KitaLulus,"Jakarta, Jakarta, Jakarta Raya, Indonesia","teaching, customer support, admin, microsoft, exec, ops, marketing",2026-07-17T01:55:14+00:00,https://remoteOK.com/remote-jobs/remote-admin-amp-operation-english-speaker-kitalulus-1134962
National Account Manager Foodservice,Georgia Pacific,"Greater Houston, ","part time, hr, medical, exec, design, salesforce, customer support, dev, copywriting, testing, travel, speech, video, content writing, marketing, stats, sales, social media, digital nomad, recruiter, finance, microsoft, excel, education",2026-07-17T01:14:34+00:00,https://remoteOK.com/remote-jobs/remote-national-account-manager-foodservice-georgia-pacific-1134987
Content Marketing Manager,Planned Parenthood of Greater New York,"New York, New York, New York, United States","exec, design, amazon, customer support, marketing, travel, speech, video, ads, content writing, ops, shopify, full time, digital nomad, salesforce, sys admin, infosec, microsoft, senior, bus dev, sales, medical, strategy, dev, copywriting, testing, web dev, education, mobile, stats",2026-07-17T01:11:10+00:00,https://remoteOK.com/remote-jobs/remote-content-marketing-manager-planned-parenthood-of-greater-new-york-1134953
Creador de Contenido Pago por Video,Freedx,"México, ","c, microsoft, teaching, video, non tech",2026-07-17T01:10:30+00:00,https://remoteOK.com/remote-jobs/remote-creador-de-contenido-pago-por-video-freedx-1134945
Agente de Reservas Hospitality,Stay U-nique,,"c, microsoft",2026-07-17T01:09:42+00:00,https://remoteOK.com/remote-jobs/remote-agente-de-reservas-hospitality-stay-u-nique-1134943
Analista de Testes Pleno,Melhor Envio,"Brasil, ",,2026-07-17T01:02:51+00:00,https://remoteOK.com/remote-jobs/remote-analista-de-testes-pleno-melhor-envio-1134941
National Account Manager Foodservice Sales Required,Home Market Foods,,"exec, customer support, marketing, sales",2026-07-17T00:00:35+00:00,https://remoteOK.com/remote-jobs/remote-national-account-manager-foodservice-sales-required-home-market-foods-1134940
Community &amp; Social Manager,Pacifica Beauty,"New York, New York, New York, United States","exec, design, amazon, customer support, marketing, travel, speech, video, ads, content writing, ops, shopify, full time, digital nomad",2026-07-16T21:39:00+00:00,https://remoteOK.com/remote-jobs/remote-community-amp-social-manager-pacifica-beauty-1134951
Founders Associate,Bits,"London Area, London Area, United Kingdom","c, exec, travel, finance, medical",2026-07-16T21:34:40+00:00,https://remoteOK.com/remote-jobs/remote-founders-associate-bits-1134976
Creative Strategist,New Engen,"Los Angeles, Los Angeles, California, United States","part time, hr, medical, exec, design, salesforce, customer support, dev, copywriting, testing, travel, speech, video, content writing, marketing, stats, sales, social media, digital nomad, recruiter, finance, microsoft, excel, education, art direction, ops, full time, sys admin, wordpress, teaching, web dev, javascript, c, css, html, drupal, seo, ads, mobile, legal, saas, amazon, infosec, music, consulting, technical, strategy, cloud, senior",2026-07-16T20:10:03+00:00,https://remoteOK.com/remote-jobs/remote-creative-strategist-new-engen-1134990
Junior QA Tester,Work Force Nexus,,"testing, quality assurance, junior",2026-07-16T20:04:26+00:00,https://remoteOK.com/remote-jobs/remote-junior-qa-tester-work-force-nexus-1134935
Executive Assistant the CEO,Jasper,"London, London, England, United Kingdom","c, exec, travel, finance, medical, virtual assistant, customer support, senior, ops, marketing, legal",2026-07-16T19:56:11+00:00,https://remoteOK.com/remote-jobs/remote-executive-assistant-the-ceo-jasper-1134977
Don't see a fit Apply here,"Brothers International Food Holdings, LLC","Rochester, ",exec,2026-07-16T19:26:52+00:00,https://remoteOK.com/remote-jobs/remote-dont-see-a-fit-apply-here-brothers-international-food-holdings-llc-1134946
Procurement Associate,UNOPS,"Bridgetown, ","react, customer support, math, medical, non tech, education, technical, finance, ops, legal",2026-07-16T19:20:11+00:00,https://remoteOK.com/remote-jobs/remote-procurement-associate-unops-1134948
Merchandiser,Brydens Antigua,"St. John's, ","react, customer support, math, medical, non tech, education, technical, finance, ops, legal, hr",2026-07-16T18:28:37+00:00,https://remoteOK.com/remote-jobs/remote-merchandiser-brydens-antigua-1134949
Director Business Development Army,NOBLE,"Florida, Florida, United States","exec, design, amazon, customer support, marketing, travel, speech, video, ads, content writing, ops, shopify, full time, digital nomad, salesforce, sys admin, infosec, microsoft, senior, bus dev, sales, medical",2026-07-16T17:48:43+00:00,https://remoteOK.com/remote-jobs/remote-director-business-development-army-noble-1134952
Content & Digital Marketing Specialist,Outsource Access Careers,,"virtual assistant, full time, sales, content writing, marketing, non tech",2026-07-16T17:07:06+00:00,https://remoteOK.com/remote-jobs/remote-content-digital-marketing-specialist-outsource-access-careers-1134932
Sales Development Representative,Outsource Access Careers,,"virtual assistant, full time, sales",2026-07-16T17:06:25+00:00,https://remoteOK.com/remote-jobs/remote-sales-development-representative-outsource-access-careers-1134931
Administrative Assistant,Azurreo,"Lebanon, ","virtual assistant, full time",2026-07-16T17:03:22+00:00,https://remoteOK.com/remote-jobs/remote-administrative-assistant-azurreo-1134930
Graphic Designer,YouFibre,"Remote, ","mobile, engineer, exec, dev, junior, digital nomad, analyst, customer support, marketing, ops, excel, stats, sales, python, consulting, defi, react, react.js, technical, web dev, speech, javascript, finance, content writing, bus dev, medical, full time, part time, designer",2026-07-16T16:08:59+00:00,https://remoteOK.com/remote-jobs/remote-graphic-designer-youfibre-1134925
Python Developer,YO IT Consulting,,"mobile, engineer, exec, dev, junior, digital nomad, analyst, customer support, marketing, ops, excel, stats, sales, python, consulting",2026-07-16T16:03:54+00:00,https://remoteOK.com/remote-jobs/remote-python-developer-yo-it-consulting-1134923
Junior Software Engineer,Lockwood Publishing Ltd,"UK, ","mobile, engineer, exec, dev, junior, digital nomad",2026-07-16T16:01:52+00:00,https://remoteOK.com/remote-jobs/remote-junior-software-engineer-lockwood-publishing-ltd-1134921
Engineers,Lockwood Publishing Ltd,,"mobile, engineer",2026-07-16T16:00:41+00:00,https://remoteOK.com/remote-jobs/remote-engineers-lockwood-publishing-ltd-1134919
CHANGE THE WORLD,VDS INNOVATION,"Vijayawada East, ",,2026-07-16T15:40:19+00:00,https://remoteOK.com/remote-jobs/remote-change-the-world-vds-innovation-1134966
QA,VDS INNOVATION,"Vijayawada East, ",quality assurance,2026-07-16T15:40:13+00:00,https://remoteOK.com/remote-jobs/remote-qa-vds-innovation-1134968
Founder Residence,Saff,San Francisco Bay Area,"exec, design, amazon, customer support, marketing, travel, speech, video, ads, content writing, ops, shopify, full time, digital nomad, salesforce, sys admin, infosec, microsoft, senior, bus dev, sales, medical, strategy, dev, copywriting, testing, web dev, education, mobile, stats, teaching, technical, finance, golang, engineer, recruiter",2026-07-16T15:02:05+00:00,https://remoteOK.com/remote-jobs/remote-founder-residence-saff-1134956
Public Health Practitioner,Public Health Wales,"Cardiff, ","c, exec, travel, finance, medical, virtual assistant, customer support, senior, ops, marketing, legal, scheme",2026-07-16T12:56:34+00:00,https://remoteOK.com/remote-jobs/remote-public-health-practitioner-public-health-wales-1134978
Exuma Operator,Seven Seas Water Group,"Exuma, ","react, customer support, math, medical, non tech, education, technical, finance, ops, legal, hr, sys admin, supervisor, exec, senior, excel",2026-07-16T12:42:32+00:00,https://remoteOK.com/remote-jobs/remote-exuma-operator-seven-seas-water-group-1134950
Museum Specialist ,Smithsonian Institution,"Suitland, ","exec, design, amazon, customer support, marketing, travel, speech, video, ads, content writing, ops, shopify, full time, digital nomad, salesforce, sys admin, infosec, microsoft, senior, bus dev, sales, medical, strategy, dev, copywriting, testing, web dev, education, mobile, stats, teaching, technical, finance, golang, engineer, recruiter, part time",2026-07-16T10:42:30+00:00,https://remoteOK.com/remote-jobs/remote-museum-specialist-smithsonian-institution-1134957
Date Posted,OptN Inc,"Frisco, ","exec, design, amazon, customer support, marketing, travel, speech, video, ads, content writing, ops, shopify, full time, digital nomad, salesforce, sys admin, infosec, microsoft, senior, bus dev, sales, medical, strategy, dev, copywriting, testing, web dev, education, mobile, stats, teaching, technical, finance, golang, engineer, recruiter",2026-07-16T10:09:50+00:00,https://remoteOK.com/remote-jobs/remote-date-posted-optn-inc-1134954
Virtual Assistant,Somewhere,"India, ","analyst, junior, virtual assistant, sys admin, customer support, microsoft, exec, senior, excel, legal, full time",2026-07-16T09:10:35+00:00,https://remoteOK.com/remote-jobs/remote-virtual-assistant-somewhere-1134914
Junior Power BI Analyst,StatusNeo,"India, ","analyst, junior",2026-07-16T09:03:16+00:00,https://remoteOK.com/remote-jobs/remote-junior-power-bi-analyst-statusneo-1134912
Zentix Software,SuperbCompanies,"Jaipur, ","quality assurance, sys admin, exec, sales, education, technical, customer support, engineer, dev, digital nomad",2026-07-16T05:47:21+00:00,https://remoteOK.com/remote-jobs/remote-zentix-software-superbcompanies-1134971
Supbot,SuperbCompanies,"Bengaluru, ","quality assurance, sys admin, exec, sales",2026-07-16T05:47:06+00:00,https://remoteOK.com/remote-jobs/remote-supbot-superbcompanies-1134969
HR Assistant,Sundayy,"United States, ","hr, education, customer support, marketing, exec, medical, virtual assistant",2026-07-16T05:02:12+00:00,https://remoteOK.com/remote-jobs/remote-hr-assistant-sundayy-1134900
Create Your Own Role,NewsletterJobs.io,"Pittsburgh, ","crypto, dev, cloud, engineer, digital nomad",2026-07-16T03:01:10+00:00,https://remoteOK.com/remote-jobs/remote-create-your-own-role-newsletterjobs-io-1134897
Publisher,NewsletterJobs.io,"Morristown, ","crypto, dev, cloud, engineer, digital nomad",2026-07-16T03:00:05+00:00,https://remoteOK.com/remote-jobs/remote-publisher-newsletterjobs-io-1134898
Asesor de Atención al Cliente Inmobiliario Call center Remoto,Los Portales,"Lima, Lima, Perú","c, microsoft",2026-07-16T01:07:43+00:00,https://remoteOK.com/remote-jobs/remote-asesor-de-atencion-al-cliente-inmobiliario-call-center-remoto-los-portales-1134942
Docente Tiempo Parcial Derecho de la Propiedad Intelectual Remoto,Universidad Privada del Norte,"Santiago de Surco, Santiago de Surco, Perú",,2026-07-16T01:04:45+00:00,https://remoteOK.com/remote-jobs/remote-docente-tiempo-parcial-derecho-de-la-propiedad-intelectual-remoto-universidad-privada-del-norte-1134997
Open Position — Dauphine,Uptown Theatre for Creative Arts,"Wideopen, ","design, digital nomad",2026-07-16T00:01:23+00:00,https://remoteOK.com/remote-jobs/remote-open-position-dauphine-uptown-theatre-for-creative-arts-1134894
Danny,Pinter,"Greater London, ",,2026-07-16T00:00:49+00:00,https://remoteOK.com/remote-jobs/remote-danny-pinter-1134892
COURIER,Doctors Hospital,"Nassau, ","react, customer support, math, medical, non tech",2026-07-16T00:00:00+00:00,https://remoteOK.com/remote-jobs/remote-courier-doctors-hospital-1134947
Associate Customer Engagement,The Coca-Cola Company,"Atlanta, ","exec, design, amazon, customer support, marketing, travel, speech, video, ads, content writing, ops, shopify, full time, digital nomad, salesforce, sys admin, infosec, microsoft, senior, bus dev, sales, medical, strategy, dev, copywriting, testing, web dev, education, mobile, stats, teaching, technical, finance, golang, engineer, recruiter",2026-07-15T22:55:09+00:00,https://remoteOK.com/remote-jobs/remote-associate-customer-engagement-the-coca-cola-company-1134955
Patient Scheduler II,Essentia Health,"Duluth, Duluth, Minnesota, United States","hr, education, customer support, marketing, exec, medical",2026-07-15T22:52:52+00:00,https://remoteOK.com/remote-jobs/remote-patient-scheduler-ii-essentia-health-1134899
Operations Administrator,Work Force Nexus,,"copywriting, non tech, product manager, exec, design, saas, embedded, customer support, marketing, content writing, senior, ops, recruiter, digital nomad, admin",2026-07-15T21:07:13+00:00,https://remoteOK.com/remote-jobs/remote-operations-administrator-work-force-nexus-1134885
Medical Support Technician Scheduler Outpatient,Yukon-Kuskokwim Health Corporation,"Alaska, ","design, marketing, exec, web dev, video, content writing, senior, photoshop, engineer, ecommerce, digital nomad, customer support, travel, education, finance, ops, legal, sales, golang, full time, part time, strategy, admin, full stack, technical, dev, social media, stats, medical",2026-07-15T20:05:42+00:00,https://remoteOK.com/remote-jobs/remote-medical-support-technician-scheduler-outpatient-yukon-kuskokwim-health-corporation-1134879
Purchase Order Administrator,Hirewell,"United States, ","design, marketing, exec, web dev, video, content writing, senior, photoshop, engineer, ecommerce, digital nomad, customer support, travel, education, finance, ops, legal, sales, golang, full time, part time, strategy, admin",2026-07-15T20:02:34+00:00,https://remoteOK.com/remote-jobs/remote-purchase-order-administrator-hirewell-1134876
Creative Strategist,DREAMLABS,,"design, marketing, exec, web dev, video, content writing, senior, photoshop, engineer, ecommerce, digital nomad, customer support, travel, education, finance, ops, legal, sales, golang, full time, part time, strategy",2026-07-15T20:02:12+00:00,https://remoteOK.com/remote-jobs/remote-creative-strategist-dreamlabs-1134875
National Account Manager,Future Beauty Brands (formerly PPI Beauty),New York City Metropolitan Area,"design, marketing, exec, web dev, video, content writing, senior, photoshop, engineer, ecommerce, digital nomad, customer support, travel, education, finance, ops, legal, sales, golang, full time, part time, strategy, admin, full stack, technical, dev, social media, stats, medical, microsoft, excel",2026-07-15T19:28:13+00:00,https://remoteOK.com/remote-jobs/remote-national-account-manager-future-beauty-brands-formerly-ppi-beauty-1134881
Virtual Executive Assistant,Zirtual,"Saskatoon, Saskatoon, Saskatchewan, Canada","virtual assistant, salesforce, infosec, technical, supervisor, customer support, travel, finance, microsoft, exec, ops, recruiter",2026-07-15T19:05:16+00:00,https://remoteOK.com/remote-jobs/remote-virtual-executive-assistant-zirtual-1134902
Project Coordinator,VeraSafe,"Kingston, Kingston, Jamaica","design, hadoop, python, digital nomad, c, game dev, speech, exec, ops, bus dev, recruiter, customer support, infosec, education, technical, testing, marketing, golang, medical, jira, hr, consulting, coordinator, travel, microsoft, legal",2026-07-15T16:18:47+00:00,https://remoteOK.com/remote-jobs/remote-project-coordinator-verasafe-1134911
Entry Level Crypto Market Specialist,APEX TRADE,,"other, finance",2026-07-15T15:39:53+00:00,https://remoteOK.com/remote-jobs/remote-entry-level-crypto-market-specialist-apex-trade-1134871
Associate Director of Athlete Engagement,Axe Sports Group,"Philadelphia, Philadelphia, Pennsylvania, United States","hr, education, customer support, marketing, exec, medical, virtual assistant, travel, finance, content writing, ops, golang, part time",2026-07-15T15:26:28+00:00,https://remoteOK.com/remote-jobs/remote-associate-director-of-athlete-engagement-axe-sports-group-1134901
Project Manager,Empire Life,,"speech, exec, content writing, sys admin, medical, recruiter, social media, game dev, designer, design, copywriting, marketing, video, education, finance, ads, digital nomad, virtual assistant, customer support, travel, ops, react, dev, front end, python, django, vfx, technical, javascript, postgres, typescript, mobile, senior, engineer, project manager",2026-07-15T15:07:31+00:00,https://remoteOK.com/remote-jobs/remote-project-manager-empire-life-1134867
Level Designer,Devoted Studios,"Canada, ","speech, exec, content writing, sys admin, medical, recruiter, social media, game dev, designer",2026-07-15T15:02:15+00:00,https://remoteOK.com/remote-jobs/remote-level-designer-devoted-studios-1134863
Field Marketing Manager,CELSIUS,"Orlando, Orlando, Florida, United States","design, marketing, exec, web dev, video, content writing, senior, photoshop, engineer, ecommerce, digital nomad, customer support, travel, education, finance, ops, legal, sales, golang, full time, part time",2026-07-15T14:30:30+00:00,https://remoteOK.com/remote-jobs/remote-field-marketing-manager-celsius-1134874
Australian English Multimedia Voice Artist Perth,OpsArmy Careers,"Perth, Perth, Western Australia, Australia","testing, quality assurance, junior, speech, technical, customer support, dev, content writing, digital nomad",2026-07-15T14:18:38+00:00,https://remoteOK.com/remote-jobs/remote-australian-english-multimedia-voice-artist-perth-opsarmy-careers-1134936
Product Director EdTech Digital Learning,peopleworth,"Manchester, Manchester, England, United Kingdom","copywriting, non tech, product manager, exec, design, saas, embedded, customer support, marketing, content writing, senior, ops, recruiter, digital nomad",2026-07-15T13:27:56+00:00,https://remoteOK.com/remote-jobs/remote-product-director-edtech-digital-learning-peopleworth-1134884
Auxiliar Administrativo Financeiro Remoto,Empresa Confidencial,"Todo Brasil, ",,2026-07-15T13:04:20+00:00,https://remoteOK.com/remote-jobs/remote-auxiliar-administrativo-financeiro-remoto-empresa-confidencial-1134859
Assistente Administrativo Comercial Remoto,Empresa Confidencial,"Todo Brasil, ",,2026-07-15T13:02:30+00:00,https://remoteOK.com/remote-jobs/remote-assistente-administrativo-comercial-remoto-empresa-confidencial-1134858
Secretaria Executiva ABLEMP,Grupo Protege,"Brasil, ",,2026-07-15T13:02:03+00:00,https://remoteOK.com/remote-jobs/remote-secretaria-executiva-ablemp-grupo-protege-1134857
Trabaja como canguro Ayuda con los deberes,TUS Media,"Málaga, Málaga, Andalucía, España","mobile, engineer, exec, dev, junior, digital nomad, analyst, customer support, marketing, ops, excel, stats, sales, python, consulting, defi, react, react.js, technical, web dev, speech, javascript, finance, content writing, bus dev, medical, full time, part time, designer, design, amazon, cloud, git, microsoft, ecommerce, shopify",2026-07-15T10:44:46+00:00,https://remoteOK.com/remote-jobs/remote-trabaja-como-canguro-ayuda-con-los-deberes-tus-media-1134927
Entrenador a de Fútbol Niños y Jóvenes,TUS Media,"Barcelona, Barcelona, Cataluña, España",,2026-07-15T10:33:09+00:00,https://remoteOK.com/remote-jobs/remote-entrenador-a-de-futbol-ninos-y-jovenes-tus-media-1134882
Copywriter Clases de Redacción Sin Experiencia,TUS Media,"Cádiz, Cádiz, Andalucía, España","copywriting, non tech",2026-07-15T10:32:05+00:00,https://remoteOK.com/remote-jobs/remote-copywriter-clases-de-redaccion-sin-experiencia-tus-media-1134883
Profesor a Particular de Fotografía Con sin Experiencia,TUS Media,"Madrid, Madrid, Comunidad de Madrid, España",c,2026-07-15T10:31:14+00:00,https://remoteOK.com/remote-jobs/remote-profesor-a-particular-de-fotografia-con-sin-experiencia-tus-media-1134975
Chief Operating Officer,Verity Search Limited,"London Area, London Area, United Kingdom","copywriting, non tech, product manager, exec, design, saas, embedded, customer support, marketing, content writing, senior, ops, recruiter, digital nomad, admin, education, technical, dev, finance, junior, engineer, architecture, designer, testing, medical",2026-07-15T10:14:05+00:00,https://remoteOK.com/remote-jobs/remote-chief-operating-officer-verity-search-limited-1134888
Technical Officer Major Projects,Power FM Bega Bay,"Moruya, ","technical, full time",2026-07-15T09:24:39+00:00,https://remoteOK.com/remote-jobs/remote-technical-officer-major-projects-power-fm-bega-bay-1134915
Servpro is Hiring,SERVPRO of Vacaville / Dixon,"Grand Rapids, ","education, non tech, ops, exec, full time, part time, customer support, marketing, travel, content writing, sys admin",2026-07-15T08:03:13+00:00,https://remoteOK.com/remote-jobs/remote-servpro-is-hiring-servpro-of-vacaville-dixon-1134854
Operador de Portaria Remota Recife PE Vagas Profissionais,BuscarVagas - Empregos Brasil,"Recife, Recife, Pernambuco, Brasil","exec, web dev, c",2026-07-15T07:39:31+00:00,https://remoteOK.com/remote-jobs/remote-operador-de-portaria-remota-recife-pe-vagas-profissionais-buscarvagas-empregos-brasil-1134861
Department Supervisor SAANICH,The Home Depot Canada,"Saanich, ","infosec, cloud, supervisor",2026-07-15T07:03:34+00:00,https://remoteOK.com/remote-jobs/remote-department-supervisor-saanich-the-home-depot-canada-1134992
TEMPLATER,"BC Stone, Inc","Columbia-Shuswap E, ","design, digital nomad",2026-07-15T06:42:16+00:00,https://remoteOK.com/remote-jobs/remote-templater-bc-stone-inc-1134891
Virtual Executive Assistant,Recruit Lytixs Hires,"Alberta, Alberta, Canada","speech, exec, content writing, sys admin, medical, recruiter, social media, game dev, designer, design, copywriting, marketing, video, education, finance, ads, digital nomad, virtual assistant, customer support, travel, ops",2026-07-15T06:05:11+00:00,https://remoteOK.com/remote-jobs/remote-virtual-executive-assistant-recruit-lytixs-hires-1134865
Entry Level Administrative Assistant,Recruit Lytixs Hires,"المدينة, المدينة المدينة السعودية","virtual assistant, education, customer support, marketing, video, microsoft, exec, ops, excel",2026-07-15T05:49:45+00:00,https://remoteOK.com/remote-jobs/remote-entry-level-administrative-assistant-recruit-lytixs-hires-1134855
Programa de Estágio Formação em Vendas SDR Remoto,Nibo,"Brasil, ","exec, front end, design, react, react.js, backend, javascript, c, git, digital nomad, dev",2026-07-15T02:11:35+00:00,https://remoteOK.com/remote-jobs/remote-programa-de-estagio-formacao-em-vendas-sdr-remoto-nibo-1134841
ASSISTENTE ADMINISTRATIVO CADASTRO CONTROLADORIA Remoto,Empresa Confidencial,"Rio de Janeiro, ",,2026-07-15T02:02:44+00:00,https://remoteOK.com/remote-jobs/remote-assistente-administrativo-cadastro-controladoria-remoto-empresa-confidencial-1134836
Medical Records and Health Information Manager,Backpack Healthcare,,"exec, design, customer support, ops, legal, medical, full time, digital nomad",2026-07-15T00:00:35+00:00,https://remoteOK.com/remote-jobs/remote-medical-records-and-health-information-manager-backpack-healthcare-1134824
Licensed Mental Health Therapist,Backpack Healthcare,Kentucky,"customer support, medical, part time, non tech",2026-07-15T00:00:18+00:00,https://remoteOK.com/remote-jobs/remote-licensed-mental-health-therapist-backpack-healthcare-1134823
Video Podcast Editor,Betches Media,"New York, New York, New York, United States","design, marketing, exec, web dev, video, content writing, senior, photoshop, engineer, ecommerce, digital nomad",2026-07-14T21:24:09+00:00,https://remoteOK.com/remote-jobs/remote-video-podcast-editor-betches-media-1134873
Chief Growth Officer,Original Peptide,"California, California, United States","design, marketing, exec, web dev, video, content writing, senior, photoshop, engineer, ecommerce, digital nomad, customer support, travel, education, finance, ops, legal, sales, golang, full time, part time, strategy, admin, full stack, technical, dev, social media, stats, medical",2026-07-14T20:44:20+00:00,https://remoteOK.com/remote-jobs/remote-chief-growth-officer-original-peptide-1134878
Chain Account Manager,CELSIUS,"Ohio, Ohio, United States","design, marketing, exec, web dev, video, content writing, senior, photoshop, engineer, ecommerce, digital nomad, customer support, travel, education, finance, ops, legal, sales, golang, full time, part time, strategy, admin, full stack, technical, dev, social media, stats, medical, microsoft, excel",2026-07-14T20:13:17+00:00,https://remoteOK.com/remote-jobs/remote-chain-account-manager-celsius-1134880
Business Development,Timo,São Paulo e Região,"design, hadoop, python, digital nomad, c, game dev, speech, exec, ops, bus dev, recruiter",2026-07-14T19:51:17+00:00,https://remoteOK.com/remote-jobs/remote-business-development-timo-1134909
Online Academic Tutor &amp; Flexible £20 £40 hr UK,FindTutors,"London, London, England, United Kingdom","c, exec, travel, finance, medical, virtual assistant, customer support, senior, ops, marketing, legal, scheme, testing, design, consulting, technical, dev, excel, digital nomad, hr, teaching, education",2026-07-14T19:37:53+00:00,https://remoteOK.com/remote-jobs/remote-online-academic-tutor-amp-flexible-20-40-hr-uk-findtutors-1134980
Underwriter,Coralisle Group Ltd.,"Bridgetown, ","education, marketing, finance, microsoft, exec, excel",2026-07-14T19:00:19+00:00,https://remoteOK.com/remote-jobs/remote-underwriter-coralisle-group-ltd-1134826
