Job Title,Company,Location,Tags,Date,Apply Link
VP Population Health,Covera Health,Remote,"system, support, growth, lead, operations, medical, health, healthcare, executive",2026-05-12T00:01:48+00:00,https://remoteOK.com/remote-jobs/remote-vp-population-health-covera-health-1131556
Freelance SEO AEO Strategist,Smartbug Media/Point Sucess/Globalia,"Remote, United States","technical, strategist, web, javascript, seo, leader, strategy, content, marketing, excel, analytics, sales",2026-05-12T00:01:21+00:00,https://remoteOK.com/remote-jobs/remote-freelance-seo-aeo-strategist-smartbug-media-point-sucess-globalia-1131555
Operations and Support Associate,Emora Health,,"system, support, growth, adult, operations, operational, medical, health",2026-05-12T00:01:15+00:00,https://remoteOK.com/remote-jobs/remote-operations-and-support-associate-emora-health-1131554
Performance Marketing Manager,GiddyUp,Remote,"manager, support, testing, test, growth, education, strategy, senior, marketer, marketing, analytics, sales, ecommerce, e-commerce",2026-05-12T00:01:08+00:00,https://remoteOK.com/remote-jobs/remote-performance-marketing-manager-giddyup-1131553
Manager Platform Engineering,Natera,US Remote,"manager, technical, support, developer, director, cloud, lead, reliability, engineering, digital nomad",2026-05-12T00:01:02+00:00,https://remoteOK.com/remote-jobs/remote-manager-platform-engineering-natera-1131552
Vice President DRG,EnableComp,,"training, support, growth, financial, education, management, lead, senior, operational, health, healthcare",2026-05-12T00:00:34+00:00,https://remoteOK.com/remote-jobs/remote-vice-president-drg-enablecomp-1131551
CUSTOMER SUCCESS MANAGER,Wishpond Technologies,Brazil,"manager, design, saas, training, support, growth, operational, sales, health, digital nomad",2026-05-12T00:00:27+00:00,https://remoteOK.com/remote-jobs/remote-customer-success-manager-wishpond-technologies-1131550
Academic Engagement Manager USA,Calyxo,Remote,"manager, training, director, education, healthcare, educational, non tech",2026-05-12T00:00:20+00:00,https://remoteOK.com/remote-jobs/remote-academic-engagement-manager-usa-calyxo-1131549
Project Manager French English Fluent,Brandtech+,Africa,manager,2026-05-11T16:02:38+00:00,https://remoteOK.com/remote-jobs/remote-project-manager-french-english-fluent-brandtech-1131548
Destination Coordinator,Careers In Travel | Destination Planners,"Atlanta, Georgia","travel, coordinator, support, non tech",2026-05-11T16:00:32+00:00,https://remoteOK.com/remote-jobs/remote-destination-coordinator-careers-in-travel-destination-planners-1131547
Travel Support Advisor,Careers In Travel | Destination Planners,Indiana,"travel, training, support, non tech",2026-05-11T16:00:25+00:00,https://remoteOK.com/remote-jobs/remote-travel-support-advisor-careers-in-travel-destination-planners-1131546
Travel Operations Coordinator,Careers In Travel | Destination Planners,"Detroit, Michigan","travel, training, coordinator, support, operations, operational, non tech",2026-05-11T16:00:19+00:00,https://remoteOK.com/remote-jobs/remote-travel-operations-coordinator-careers-in-travel-destination-planners-1131545
Travel Appointment Coordinator,Careers In Travel | Destination Planners,"Atlanta, Georgia","travel, coordinator, support, growth",2026-05-11T16:00:10+00:00,https://remoteOK.com/remote-jobs/remote-travel-appointment-coordinator-careers-in-travel-destination-planners-1131544
Itinerary Support Coordinator No Experience Needed,Careers In Travel | Destination Planners,Maryland,"travel, coordinator, support, non tech",2026-05-11T16:00:03+00:00,https://remoteOK.com/remote-jobs/remote-itinerary-support-coordinator-no-experience-needed-careers-in-travel-destination-planners-1131543
Crypto Trader,Maidel Group,,"other, analyst, mobile, finance, crypto",2026-05-11T13:00:52+00:00,https://remoteOK.com/remote-jobs/remote-crypto-trader-maidel-group-1131541
Tooling Engineer,Unikraft,,"golang, cloud, engineer",2026-05-11T09:00:01+00:00,https://remoteOK.com/remote-jobs/remote-tooling-engineer-unikraft-1131540
Meta Ads Manager + Creative Producer AI Native,singularads.com,,"marketing, ads, ai",2026-05-11T02:41:10+00:00,https://remoteOK.com/remote-jobs/remote-meta-ads-manager-creative-producer-ai-native-singularads-com-1131538
Senior Marketing Manager CRO Experience Required,Precision Medicine Group,Remote,"manager, design, embedded, support, leader, strategy, lead, content, senior, operations, operational, marketing, sales, digital nomad",2026-05-10T16:00:26+00:00,https://remoteOK.com/remote-jobs/remote-senior-marketing-manager-cro-experience-required-precision-medicine-group-1131536
Online Hospitality Services Coordinator Entry Level,Aisles &amp; Abroad,Illinois,"coordinator, support",2026-05-10T08:00:09+00:00,https://remoteOK.com/remote-jobs/remote-online-hospitality-services-coordinator-entry-level-aisles-amp-abroad-1131534
Account Executive Southeast,Apollo Information Systems,,"salesforce, security, technical, support, test, growth, manager, education, investment, senior, marketing, sales, executive",2026-05-10T08:00:03+00:00,https://remoteOK.com/remote-jobs/remote-account-executive-southeast-apollo-information-systems-1131533
CNC Machinist Milling,CX2,"El Segundo, CA","software, growth, assembly, operational, engineering",2026-05-09T16:00:33+00:00,https://remoteOK.com/remote-jobs/remote-cnc-machinist-milling-cx2-1131532
Staff Product Manager Enterprise,LiveKit,,"manager, technical, developer, growth, code, voice, strategy, sales, go, engineering, digital nomad",2026-05-09T16:00:24+00:00,https://remoteOK.com/remote-jobs/remote-staff-product-manager-enterprise-livekit-1131531
Customer Support Representative,Boom Entertainment,Remote,"gaming, consultant, support, operations",2026-05-09T16:00:18+00:00,https://remoteOK.com/remote-jobs/remote-customer-support-representative-boom-entertainment-1131530
Lead Software Engineer,CSC Generation,Remote - Canada,"software, design, python, django, technical, developer, growth, director, code, voice, manager, api, lead, senior, junior, recruiting, engineer, engineering, digital nomad",2026-05-09T08:00:10+00:00,https://remoteOK.com/remote-jobs/remote-lead-software-engineer-csc-generation-1131529
Marketing Copywriter,BIS Safety Software,"Toronto, Ontario","dev, copywriter, saas, system, training, technical, support, software, copywriting, growth, video, seo, strategy, management, lead, content, marketing, recruitment, digital nomad",2026-05-09T08:00:03+00:00,https://remoteOK.com/remote-jobs/remote-marketing-copywriter-bis-safety-software-1131528
Senior Software Engineer I,"Clariti Cloud, Inc.",Canada,"software, saas, salesforce, senior, engineer",2026-05-09T00:02:42+00:00,https://remoteOK.com/remote-jobs/remote-senior-software-engineer-i-clariti-cloud-inc-1131527
Manager Collections &amp; Recoveries,Forbright Bank,Remote,"manager, embedded, growth, financial, investment, banking, finance, bank, microsoft, strategy, management, operational, analytics, legal, go",2026-05-09T00:02:16+00:00,https://remoteOK.com/remote-jobs/remote-manager-collections-amp-recoveries-forbright-bank-1131526
Customer Success Manager,CipherHealth,Remote,"manager, system, consultant, technical, software, financial, lead, senior, operations, operational, health, healthcare, executive",2026-05-09T00:02:10+00:00,https://remoteOK.com/remote-jobs/remote-customer-success-manager-cipherhealth-1131525
1086 Digital Marketing Specialist,GoFasti,Remote,"marketing, part-time, non tech",2026-05-09T00:01:52+00:00,https://remoteOK.com/remote-jobs/remote-1086-digital-marketing-specialist-gofasti-1131524
Asset Administration Operations Specialist,Forge Global,Denver,"travel, financial, operations, non tech",2026-05-09T00:01:21+00:00,https://remoteOK.com/remote-jobs/remote-asset-administration-operations-specialist-forge-global-1131523
Patient Operations Coordinator,Rivia Mind - Mental Healthcare,Remote,"coordinator, management, operations, go, health, medical, non tech",2026-05-09T00:00:48+00:00,https://remoteOK.com/remote-jobs/remote-patient-operations-coordinator-rivia-mind-mental-healthcare-1131522
Fully Cruise &amp; Resort Booking Specialist,Careers In Travel | Destination Planners,Florida,"travel, training, support, non tech",2026-05-09T00:00:07+00:00,https://remoteOK.com/remote-jobs/remote-fully-cruise-amp-resort-booking-specialist-careers-in-travel-destination-planners-1131521
Engineering Manager AI Fleet Management &amp; Honk,Spotify,,"manager, design, system, architect, technical, developer, software, growth, management, lead, operational, engineering, backend, digital nomad",2026-05-08T16:01:13+00:00,https://remoteOK.com/remote-jobs/remote-engineering-manager-ai-fleet-management-amp-honk-spotify-1131520
Senior Manager Government & Industry Affairs Operations,VGW,Maryland,"manager, senior, operations",2026-05-08T08:00:48+00:00,https://remoteOK.com/remote-jobs/remote-senior-manager-government-industry-affairs-operations-vgw-1131518
People Operations Lead,Defense Unicorns,United States,"hr, architect, support, lead, operations, operational",2026-05-08T08:00:34+00:00,https://remoteOK.com/remote-jobs/remote-people-operations-lead-defense-unicorns-1131517
Web Development Specialist,Marketers in Demand,,"web dev, dev",2026-05-08T01:00:28+00:00,https://remoteOK.com/remote-jobs/remote-web-development-specialist-marketers-in-demand-1131516
Principal Marketing Analytics Manager,Greenhouse,Anywhere in the United States,"manager, architect, technical, growth, investment, marketing, excel, analytics, go",2026-05-08T00:06:04+00:00,https://remoteOK.com/remote-jobs/remote-principal-marketing-analytics-manager-greenhouse-1131515
Sales Development Representative,Kiavi,Remote,"security, fintech, sales",2026-05-08T00:05:13+00:00,https://remoteOK.com/remote-jobs/remote-sales-development-representative-kiavi-1131514
Talent Acquisition Pipeline Manager,Nava PBC,,"manager, design, consultancy, cloud, engineering, digital nomad",2026-05-08T00:03:22+00:00,https://remoteOK.com/remote-jobs/remote-talent-acquisition-pipeline-manager-nava-pbc-1131513
Analytics Engineer,Civitech,"Austin, TX or Remote","python, support, code, cloud, analytics, engineer, engineering, full-time",2026-05-08T00:01:48+00:00,https://remoteOK.com/remote-jobs/remote-analytics-engineer-civitech-1131512
Mental Health Counselor Therapist Social Worker New York,Rivia Mind - Mental Healthcare,New York,"management, go, health, medical, non tech",2026-05-08T00:01:14+00:00,https://remoteOK.com/remote-jobs/remote-mental-health-counselor-therapist-social-worker-new-york-rivia-mind-mental-healthcare-1131511
Drug & Alcohol Counselor,Pelago,Remote,"support, growth, c, health",2026-05-08T00:00:41+00:00,https://remoteOK.com/remote-jobs/remote-drug-alcohol-counselor-pelago-1131510
Tech Lead,Zensurance,"Toronto, ON","design, system, front-end, back-end, security, training, full-stack, docker, technical, support, software, testing, test, growth, code, web, scrum, devops, javascript, education, strategy, management, lead, senior, health, engineering, digital nomad",2026-05-08T00:00:03+00:00,https://remoteOK.com/remote-jobs/remote-tech-lead-zensurance-1131509
Senior Software Engineer,Cast AI,,"golang, software, senior, engineer",2026-05-07T12:00:02+00:00,https://remoteOK.com/remote-jobs/remote-senior-software-engineer-cast-ai-1131507
Clinical Provider,Intellect,Kraków,"support, growth, video, health",2026-05-07T08:00:09+00:00,https://remoteOK.com/remote-jobs/remote-clinical-provider-intellect-1131505
Senior Data Engineer,Valon Mortgage,,"design, saas, python, architect, technical, support, cloud, strategy, management, senior, operations, operational, analytics, reliability, go, engineer, engineering, digital nomad",2026-05-07T08:00:03+00:00,https://remoteOK.com/remote-jobs/remote-senior-data-engineer-valon-mortgage-1131504
Workday Payroll Consultant,Meridian Partners,Remote,"consultant, payroll, consulting",2026-05-07T00:02:33+00:00,https://remoteOK.com/remote-jobs/remote-workday-payroll-consultant-meridian-partners-1131503
Policy Intern,Hopelab,Remote,"support, growth, director, voice, financial, education, strategy, content, go, health, educational, internship, part-time",2026-05-07T00:01:51+00:00,https://remoteOK.com/remote-jobs/remote-policy-intern-hopelab-1131502
Solutions Engineering Post Sales,Geotab,Remote - US,"leader, operations, analytics, sales, engineering",2026-05-07T00:01:45+00:00,https://remoteOK.com/remote-jobs/remote-solutions-engineering-post-sales-geotab-1131501
Data Entry Coordinator,Profound Research,Remote,"system, training, coordinator, support, testing, growth, travel, education, microsoft, management, operations, health, healthcare",2026-05-07T00:01:09+00:00,https://remoteOK.com/remote-jobs/remote-data-entry-coordinator-profound-research-1131500
1079 Project Manager,GoFasti,Remote,"manager, management",2026-05-07T00:01:03+00:00,https://remoteOK.com/remote-jobs/remote-1079-project-manager-gofasti-1131499
Director of Legal Operations,Solutus Legal Search,United States,"director, salesforce, system, cloud, management, operations, operational, legal, sales",2026-05-07T00:00:24+00:00,https://remoteOK.com/remote-jobs/remote-director-of-legal-operations-solutus-legal-search-1131498
Tired of Your ome Being Capped Work from Home Opportunity,AO Garcia Agency,"El Paso, Texas","growth, financial, video, lead",2026-05-07T00:00:18+00:00,https://remoteOK.com/remote-jobs/remote-tired-of-your-ome-being-capped-work-from-home-opportunity-ao-garcia-agency-1131497
Customer Service Representative Hotel Reservations Entry Level,Aisles &amp; Abroad,Maryland,,2026-05-07T00:00:12+00:00,https://remoteOK.com/remote-jobs/remote-customer-service-representative-hotel-reservations-entry-level-aisles-amp-abroad-1131496
Work From Home Client Services Associate,Global Elite Empire Consultants,"Rock Springs, Wyoming","support, growth, video, lead, excel",2026-05-07T00:00:04+00:00,https://remoteOK.com/remote-jobs/remote-work-from-home-client-services-associate-global-elite-empire-consultants-1131495
Business Analyst Pleno,Stone,Remoto,analyst,2026-05-06T16:03:11+00:00,https://remoteOK.com/remote-jobs/remote-business-analyst-pleno-stone-1131493
Online Hotel Reservations Specialist Customer Support,Careers In Travel | Destination Planners,New York,"travel, training, support, non tech",2026-05-06T16:02:40+00:00,https://remoteOK.com/remote-jobs/remote-online-hotel-reservations-specialist-customer-support-careers-in-travel-destination-planners-1131492
Principal Data Engineer,Extend,Remote,"design, python, technical, financial, analytics, engineer, engineering, digital nomad",2026-05-06T16:02:33+00:00,https://remoteOK.com/remote-jobs/remote-principal-data-engineer-extend-1131491
Curriculum Developer Aerospace Technician,Correlation One,Remote,"developer, design, amazon, training, adult, content, operations, engineering, digital nomad",2026-05-06T16:01:52+00:00,https://remoteOK.com/remote-jobs/remote-curriculum-developer-aerospace-technician-correlation-one-1131490
Accounts Assistant,Prolific,"Remote, UK","assistant, hr, consult, support, finance, non tech",2026-05-06T16:01:22+00:00,https://remoteOK.com/remote-jobs/remote-accounts-assistant-prolific-1131489
Cloud Enablement Engineer US,Quanata,Remote-US,"security, technical, software, cloud, engineer, engineering",2026-05-06T16:00:29+00:00,https://remoteOK.com/remote-jobs/remote-cloud-enablement-engineer-us-quanata-1131488
Customer Success Representative,Subbly,,"customer support, ai",2026-05-06T13:26:22+00:00,https://remoteOK.com/remote-jobs/remote-customer-success-representative-subbly-1131487
Mid Senior AI Cinematic Video Editor,EverAI,,"ai, Video Editor, Long-form Video Content, Motion graphic design, Colour correction, ComfyUI, Stable Diffusion, AI Video Production",2026-05-06T11:27:14+00:00,https://remoteOK.com/remote-jobs/remote-mid-senior-ai-cinematic-video-editor-everai-1131485
Senior Veritas eDiscovery Platform Engineer,"Contact Government Services, LLC",,"system, technical, support, growth, manager, financial, cloud, senior, legal, engineer, engineering",2026-05-06T08:00:13+00:00,https://remoteOK.com/remote-jobs/remote-senior-veritas-ediscovery-platform-engineer-contact-government-services-llc-1131484
Marketing & Business Development Operator,Scale Virtually,,marketing,2026-05-06T08:00:06+00:00,https://remoteOK.com/remote-jobs/remote-marketing-business-development-operator-scale-virtually-1131483
Senior Software Engineer,Prove,United States,"software, security, senior, engineer, engineering",2026-05-06T00:02:04+00:00,https://remoteOK.com/remote-jobs/remote-senior-software-engineer-prove-1131482
Technical Writer & Product Engineer,Thermal Works,United States,"system, technical, writer, growth, engineer",2026-05-06T00:01:45+00:00,https://remoteOK.com/remote-jobs/remote-technical-writer-product-engineer-thermal-works-1131481
Lead Instructor Aerospace Technician,Correlation One,Remote,"instructor, amazon, training, technical, management, lead, operations",2026-05-06T00:01:29+00:00,https://remoteOK.com/remote-jobs/remote-lead-instructor-aerospace-technician-correlation-one-1131480
Senior Backend Engineer,Akuity,,"saas, developer, software, code, devops, senior, engineer, engineering, backend, digital nomad",2026-05-06T00:01:19+00:00,https://remoteOK.com/remote-jobs/remote-senior-backend-engineer-akuity-1131479
Marketing Manager Activation New York,Curaleaf,New York,"manager, support, marketer, marketing, sales, non tech",2026-05-06T00:01:07+00:00,https://remoteOK.com/remote-jobs/remote-marketing-manager-activation-new-york-curaleaf-1131478
Central Study Coordinator Retention,Care Access,USA Remote,"coordinator, education, mobile, health, non tech",2026-05-06T00:00:48+00:00,https://remoteOK.com/remote-jobs/remote-central-study-coordinator-retention-care-access-1131477
Therapy Support Specialist,Noctrix Health,,"salesforce, training, consultant, support, video, leader, management, content, biology, medical, health, non tech",2026-05-06T00:00:37+00:00,https://remoteOK.com/remote-jobs/remote-therapy-support-specialist-noctrix-health-1131476
Medical Affairs Solutions Manager UK,Sorcero,UK,"manager, growth, operations, biotech",2026-05-06T00:00:21+00:00,https://remoteOK.com/remote-jobs/remote-medical-affairs-solutions-manager-uk-sorcero-1131475
Bilingual Associate Mental Health Therapist Arizona,Ascend Healthcare,Arizona,"support, operational, health, medical, healthcare, non tech",2026-05-06T00:00:09+00:00,https://remoteOK.com/remote-jobs/remote-bilingual-associate-mental-health-therapist-arizona-ascend-healthcare-1131474
UI Developer,RainFocus,"Lehi, Utah","developer, ui, technical, software, lead, senior, junior, engineering, branding, digital nomad",2026-05-05T16:01:22+00:00,https://remoteOK.com/remote-jobs/remote-ui-developer-rainfocus-1131473
Software Development Engineer Backend,HighLevel,India,"software, saas, system, frontend, support, growth, ui, node.js, api, lead, operational, legal, reliability, go, engineer, engineering, backend",2026-05-05T16:01:11+00:00,https://remoteOK.com/remote-jobs/remote-software-development-engineer-backend-highlevel-1131472
Software Engineer II,Precision AQ,India,"software, technical, support, testing, management, operations, health, engineer",2026-05-05T16:00:36+00:00,https://remoteOK.com/remote-jobs/remote-software-engineer-ii-precision-aq-1131470
Staff Accountant,CyberSheath,United States,"accountant, security, accounting, financial, bank",2026-05-05T16:00:25+00:00,https://remoteOK.com/remote-jobs/remote-staff-accountant-cybersheath-1131469
Senior Platform Engineer,saas.group,"Remote, Europe","support, growth, web, travel, management, senior, engineer, engineering",2026-05-05T16:00:11+00:00,https://remoteOK.com/remote-jobs/remote-senior-platform-engineer-saas-group-1131468
Business Analyst,"Contact Government Services, LLC",,"analyst, design, jira, system, security, training, technical, support, growth, voice, financial, microsoft, content, senior, operations, executive, digital nomad",2026-05-05T08:00:25+00:00,https://remoteOK.com/remote-jobs/remote-business-analyst-contact-government-services-llc-1131467
Online Hotel Reservationist Fully,Careers In Travel | Destination Planners,Florida,"travel, growth",2026-05-05T08:00:18+00:00,https://remoteOK.com/remote-jobs/remote-online-hotel-reservationist-fully-careers-in-travel-destination-planners-1131466
Product Delivery Coordinator,New Era Technology,,"coordinator, manager, financial",2026-05-05T08:00:11+00:00,https://remoteOK.com/remote-jobs/remote-product-delivery-coordinator-new-era-technology-1131465
Child and Adolescent Intake Therapist,Blackbird Health,,"medical, health, non tech",2026-05-05T00:01:25+00:00,https://remoteOK.com/remote-jobs/remote-child-and-adolescent-intake-therapist-blackbird-health-1131464
Customer Success Manager,Avero,"Las Vegas, NV","manager, saas, sales, go, non tech",2026-05-05T00:01:13+00:00,https://remoteOK.com/remote-jobs/remote-customer-success-manager-avero-1131463
Recruiter,Airship,Remote - U.S.,"recruiter, test, growth, operations",2026-05-05T00:01:07+00:00,https://remoteOK.com/remote-jobs/remote-recruiter-airship-1131462
Lead AI Engineer & Technical Architect,Bold Business,"India, Latin America, Philippines","architect, technical, lead, engineer",2026-05-05T00:00:52+00:00,https://remoteOK.com/remote-jobs/remote-lead-ai-engineer-technical-architect-bold-business-1131461
Outside Sales Consultant Account Executive,"Follett Software, LLC",,"consultant, education, sales, executive",2026-05-05T00:00:41+00:00,https://remoteOK.com/remote-jobs/remote-outside-sales-consultant-account-executive-follett-software-llc-1131460
Manager Cost Accounting,MANSCAPED,United States,"manager, accounting, hr",2026-05-05T00:00:32+00:00,https://remoteOK.com/remote-jobs/remote-manager-cost-accounting-manscaped-1131459
Staff Accountant,UHP (Unlock Human Potential),United States,"accountant, support, accounting, financial, education, microsoft, management, excel, non tech",2026-05-05T00:00:22+00:00,https://remoteOK.com/remote-jobs/remote-staff-accountant-uhp-unlock-human-potential-1131458
Software Engineer Showroom,Higharc,Remote,"software, design, 3d, full-stack, support, ux, manager, api, engineer, engineering, backend, digital nomad",2026-05-05T00:00:16+00:00,https://remoteOK.com/remote-jobs/remote-software-engineer-showroom-higharc-1131457
3D Modeling & Python Specialist Freelance AI Trainer Project,Invisible Agency,,"python, 3d, trainer, training",2026-05-05T00:00:09+00:00,https://remoteOK.com/remote-jobs/remote-3d-modeling-python-specialist-freelance-ai-trainer-project-invisible-agency-1131456
Product Marketing Intern,Everlaw,Oakland,"technical, marketing, legal, sales",2026-05-04T16:01:27+00:00,https://remoteOK.com/remote-jobs/remote-product-marketing-intern-everlaw-1131454
AI Solutions Manager SMB,Arize AI,,"manager, software, engineering",2026-05-04T16:01:17+00:00,https://remoteOK.com/remote-jobs/remote-ai-solutions-manager-smb-arize-ai-1131453
Product Manager Data Feeds,YipitData,,"manager, technical, analyst, strategy, management, engineering",2026-05-04T16:01:07+00:00,https://remoteOK.com/remote-jobs/remote-product-manager-data-feeds-yipitdata-1131452
Senior Director Fulfillment Operations,"ShipBob, Inc.",United States,"director, senior, operations",2026-05-04T16:00:56+00:00,https://remoteOK.com/remote-jobs/remote-senior-director-fulfillment-operations-shipbob-inc-1131451
Account Executive SLED,Everpure,Sacramento,"design, system, security, architect, technical, education, lead, sales, educational, executive, digital nomad",2026-05-04T16:00:42+00:00,https://remoteOK.com/remote-jobs/remote-account-executive-sled-everpure-1131450
Travel Booking Specialist,Careers In Travel | Destination Planners,New York,"travel, training, support, non tech",2026-05-04T16:00:30+00:00,https://remoteOK.com/remote-jobs/remote-travel-booking-specialist-careers-in-travel-destination-planners-1131449
Travel Booking Specialist Hotels &amp; Resorts,Careers In Travel | Destination Planners,"Atlanta, Georgia","travel, training, support, non tech",2026-05-04T16:00:24+00:00,https://remoteOK.com/remote-jobs/remote-travel-booking-specialist-hotels-amp-resorts-careers-in-travel-destination-planners-1131448
