Job Title,Company,Location,Tags,Date,Apply Link
Australian English Voice Actor Adelaide,OpsArmy Careers,"Adelaide, Adelaide, South Australia, Australia","speech, game dev, dev, video, content writing, education, non tech, digital nomad",2026-07-10T02:20:45+00:00,https://remoteOK.com/remote-jobs/remote-australian-english-voice-actor-adelaide-opsarmy-careers-1134698
Support Technician Level 1 2,Magic Memories,"Orlando, ","design, hr, sys admin, infosec, teaching, technical, customer support, dev, testing, marketing, travel, video, cloud, exec, linux, digital nomad",2026-07-10T00:03:02+00:00,https://remoteOK.com/remote-jobs/remote-support-technician-level-1-2-magic-memories-1134650
Customer Success Manager,INNERGY,"Austin, Austin, Texas, United States","design, hr, sys admin, infosec, teaching, technical, customer support, dev, testing, marketing, travel, video, cloud, exec, linux, digital nomad, saas, salesforce, education, consulting, speech, finance, sales, medical, engineer, recruiter",2026-07-09T22:30:53+00:00,https://remoteOK.com/remote-jobs/remote-customer-success-manager-innergy-1134651
Warehouse Inventory Clerk,Caribbean Bottling Company (Bahamas) Ltd.,"Nassau, ","education, customer support, testing, video, ops, non tech, sys admin, exec, math, microsoft, excel",2026-07-09T21:58:53+00:00,https://remoteOK.com/remote-jobs/remote-warehouse-inventory-clerk-caribbean-bottling-company-bahamas-ltd-1134648
Diver,Amentum,"New Providence, ","education, customer support, testing, video, ops, non tech",2026-07-09T20:55:49+00:00,https://remoteOK.com/remote-jobs/remote-diver-amentum-1134647
Nanny,Jovie,"Fall City, ","react, teaching, education, customer support, exec, sys admin, part time",2026-07-09T19:42:11+00:00,https://remoteOK.com/remote-jobs/remote-nanny-jovie-1134660
Health Navigator I,Moda Health,"Portland, ","design, hr, sys admin, infosec, teaching, technical, customer support, dev, testing, marketing, travel, video, cloud, exec, linux, digital nomad, saas, salesforce, education, consulting, speech, finance, sales, medical, engineer, recruiter, supervisor, microsoft, content writing, ops",2026-07-09T19:13:35+00:00,https://remoteOK.com/remote-jobs/remote-health-navigator-i-moda-health-1134652
Caretaker City Buildings,City of Kalgoorlie-Boulder,"Kalgoorlie, ","education, customer support, medical, non tech",2026-07-09T15:04:15+00:00,https://remoteOK.com/remote-jobs/remote-caretaker-city-buildings-city-of-kalgoorlie-boulder-1134655
Mason,United Infrastructure Ltd,"Livingston, ","dev, engineer, digital nomad, design, customer support",2026-07-09T14:49:39+00:00,https://remoteOK.com/remote-jobs/remote-mason-united-infrastructure-ltd-1134639
Asesor de Atención al Cliente Remoto Sueldo Fijo,Partner Service,"Santa Anita, Santa Anita, Perú",,2026-07-09T13:04:36+00:00,https://remoteOK.com/remote-jobs/remote-asesor-de-atencion-al-cliente-remoto-sueldo-fijo-partner-service-1134688
Firefighter ARFF,Adani Airport Holdings Ltd,"Mangaluru, ","infosec, dev, photoshop, digital nomad, education, customer support, marketing, exec, finance, ops, medical, engineer",2026-07-09T11:14:42+00:00,https://remoteOK.com/remote-jobs/remote-firefighter-arff-adani-airport-holdings-ltd-1134670
Junior Ecommerce Specialist,Haystack,Greater Chicago Area,"design, hr, sys admin, infosec, teaching, technical, customer support, dev, testing, marketing, travel, video, cloud, exec, linux, digital nomad, saas, salesforce, education, consulting, speech, finance, sales, medical, engineer, recruiter, supervisor, microsoft, content writing, ops, web dev, mobile, junior, excel, stats, ecommerce",2026-07-09T10:30:04+00:00,https://remoteOK.com/remote-jobs/remote-junior-ecommerce-specialist-haystack-1134653
Operador de Portaria Remota Recife PE Seu Novo Emprego,BuscarVagas - Empregos Brasil,"Recife, Recife, Pernambuco, Brasil",,2026-07-09T07:40:19+00:00,https://remoteOK.com/remote-jobs/remote-operador-de-portaria-remota-recife-pe-seu-novo-emprego-buscarvagas-empregos-brasil-1134659
Houseperson,Accor,"Trevallyn, ","education, customer support, medical, non tech, infosec, golang",2026-07-09T07:37:26+00:00,https://remoteOK.com/remote-jobs/remote-houseperson-accor-1134656
Update Add Your Resume Any Position EOI Infrastructure Projects,Bellwether Group,"Brisbane, ","education, customer support, medical, non tech, infosec, golang, exec, ops, engineer, marketing",2026-07-09T02:27:51+00:00,https://remoteOK.com/remote-jobs/remote-update-add-your-resume-any-position-eoi-infrastructure-projects-bellwether-group-1134658
Coordinador de Medio Ambiente y Desarrollo Comunitario,Wisefind,"Ciudad de México, Ciudad de México, México",,2026-07-09T02:19:04+00:00,https://remoteOK.com/remote-jobs/remote-coordinador-de-medio-ambiente-y-desarrollo-comunitario-wisefind-1134642
Con o Sin Exp. ATC Remoto Turno Tarde Salario fijo+Variable Firma Contrato con Planilla Completa,Netcall Group,"Lima, Lima, Perú",hr,2026-07-09T01:07:33+00:00,https://remoteOK.com/remote-jobs/remote-con-o-sin-exp-atc-remoto-turno-tarde-salario-fijo-variable-firma-contrato-con-planilla-completa-netcall-group-1134689
Docente Tiempo Parcial Desarrollo de Psicomotricidad en Primera Infancia Remoto,Universidad Privada del Norte,"Santiago de Surco, Santiago de Surco, Perú","excel, non tech",2026-07-09T01:06:09+00:00,https://remoteOK.com/remote-jobs/remote-docente-tiempo-parcial-desarrollo-de-psicomotricidad-en-primera-infancia-remoto-universidad-privada-del-norte-1134611
Docente Tiempo Parcial Elaboración Materiales Educativos Nivel Primaria SJL,Universidad Privada del Norte,"Santiago de Surco, Santiago de Surco, Perú","excel, non tech, marketing, social media",2026-07-09T01:04:54+00:00,https://remoteOK.com/remote-jobs/remote-docente-tiempo-parcial-elaboracion-materiales-educativos-nivel-primaria-sjl-universidad-privada-del-norte-1134613
Docente Tiempo Parcial Elaboración Materiales Educativos Primera Infancia SJL,Universidad Privada del Norte,"Santiago de Surco, Santiago de Surco, Perú",,2026-07-09T01:04:44+00:00,https://remoteOK.com/remote-jobs/remote-docente-tiempo-parcial-elaboracion-materiales-educativos-primera-infancia-sjl-universidad-privada-del-norte-1134609
Dispatch Coordinator I,Belle,"Atlanta, Atlanta, Georgia, United States","infosec, coordinator, customer support, dev, mobile, exec, senior, ops, medical, digital nomad",2026-07-09T00:57:47+00:00,https://remoteOK.com/remote-jobs/remote-dispatch-coordinator-i-belle-1134617
Pesquisador em Teoria da Mudança,Instituto Cordial,"São Paulo, São Paulo, São Paulo, Brasil","excel, non tech",2026-07-09T00:51:09+00:00,https://remoteOK.com/remote-jobs/remote-pesquisador-em-teoria-da-mudanca-instituto-cordial-1134643
Non USA,New Relic,"Hyderabad, ","infosec, dev, photoshop, digital nomad, education, customer support, marketing, exec, finance, ops, medical, engineer, recruiter",2026-07-09T00:48:36+00:00,https://remoteOK.com/remote-jobs/remote-non-usa-new-relic-1134671
Founder's Office Finance Super App,Bjak ,Beijing,"exec, consulting, customer support, finance, admin, mobile, senior, ops, legal",2026-07-09T00:00:04+00:00,https://remoteOK.com/remote-jobs/remote-founders-office-finance-super-app-bjak-1134604
General Consideration,CertaSite,"Toledo, ","marketing, education, non tech",2026-07-09T00:00:00+00:00,https://remoteOK.com/remote-jobs/remote-general-consideration-certasite-1134683
Barista,Spark,"London, ","dev, engineer, digital nomad, design, customer support",2026-07-08T23:13:44+00:00,https://remoteOK.com/remote-jobs/remote-barista-spark-1134640
SLT HDFC BB Delhi,Aditya Birla Capital,"Delhi, ","teaching, customer support, marketing, finance, c, exec, sales",2026-07-08T21:32:49+00:00,https://remoteOK.com/remote-jobs/remote-slt-hdfc-bb-delhi-aditya-birla-capital-1134624
SLT HDFC BB Ludhiana,Aditya Birla Capital,"Punjab, ","teaching, customer support, marketing, finance, c, exec, sales",2026-07-08T21:32:49+00:00,https://remoteOK.com/remote-jobs/remote-slt-hdfc-bb-ludhiana-aditya-birla-capital-1134625
SLT HDFC BB Pondicherry,Aditya Birla Capital,"Tamil Nadu, ","teaching, customer support, marketing, finance, c, exec, sales",2026-07-08T21:32:49+00:00,https://remoteOK.com/remote-jobs/remote-slt-hdfc-bb-pondicherry-aditya-birla-capital-1134626
SLT HDFC BB Chennai,Aditya Birla Capital,"Tamil Nadu, ","teaching, customer support, marketing, finance, c, exec, sales",2026-07-08T21:32:49+00:00,https://remoteOK.com/remote-jobs/remote-slt-hdfc-bb-chennai-aditya-birla-capital-1134627
SLT HDFC BB Mumbai,Aditya Birla Capital,"Maharashtra, ","teaching, customer support, marketing, finance, c, exec, sales, virtual assistant, sys admin, dev, accounting, payroll, microsoft, ops, excel, digital nomad",2026-07-08T21:32:49+00:00,https://remoteOK.com/remote-jobs/remote-slt-hdfc-bb-mumbai-aditya-birla-capital-1134629
SLT HDFC BB Ahmedabad,Aditya Birla Capital,"Gujarat, ","teaching, customer support, marketing, finance, c, exec, sales, virtual assistant, sys admin, dev, accounting, payroll, microsoft, ops, excel, digital nomad",2026-07-08T21:32:49+00:00,https://remoteOK.com/remote-jobs/remote-slt-hdfc-bb-ahmedabad-aditya-birla-capital-1134630
SLT HDFC BB Bangalore,Aditya Birla Capital,"Karnataka, ","jira, hr, customer support, finance, cloud, admin, exec, ops, legal, recruiter, teaching, marketing, c, sales",2026-07-08T21:32:49+00:00,https://remoteOK.com/remote-jobs/remote-slt-hdfc-bb-bangalore-aditya-birla-capital-1134676
Accounts Assistant,CXC Upstream Ltd,"دبي, دبي الإمارات العربية المتحدة","teaching, customer support, marketing, finance, c, exec, sales, virtual assistant, sys admin, dev, accounting, payroll, microsoft, ops, excel, digital nomad",2026-07-08T20:56:52+00:00,https://remoteOK.com/remote-jobs/remote-accounts-assistant-cxc-upstream-ltd-1134628
Freelance Background Artist for YouTube Studio,Newscape Studios inc.,"Austin, Austin, Texas, United States","infosec, coordinator, customer support, dev, mobile, exec, senior, ops, medical, digital nomad, design, crypto, marketing, video, finance, content writing, education, legal, sales, golang, full time, photoshop, illustrator",2026-07-08T19:42:56+00:00,https://remoteOK.com/remote-jobs/remote-freelance-background-artist-for-youtube-studio-newscape-studios-inc-1134620
Territory Sales Manager,CELSIUS,"St. Petersburg, St. Petersburg, Florida, United States","infosec, coordinator, customer support, dev, mobile, exec, senior, ops, medical, digital nomad, design, crypto, marketing, video, finance, content writing, education, legal, sales, golang, full time",2026-07-08T19:06:22+00:00,https://remoteOK.com/remote-jobs/remote-territory-sales-manager-celsius-1134619
 SUPERVISEUR 31 94,The Home Depot Canada,"Woodstock, ",,2026-07-08T19:03:02+00:00,https://remoteOK.com/remote-jobs/remote-superviseur-31-94-the-home-depot-canada-1134603
Analista Marketing JR Social Media,Bradesco,"Osasco, ","excel, non tech, marketing, social media",2026-07-08T17:39:00+00:00,https://remoteOK.com/remote-jobs/remote-analista-marketing-jr-social-media-bradesco-1134612
Analista de Recrutamento e Seleção Comercial Júnior,Stone,"São Paulo e Região, ","excel, non tech",2026-07-08T17:20:38+00:00,https://remoteOK.com/remote-jobs/remote-analista-de-recrutamento-e-selecao-comercial-junior-stone-1134610
Project Coordinator,Franklin Fitch,"London Area, London Area, United Kingdom","customer support, marketing, travel, exec, content writing, sales, golang, controller, excel, teaching, testing, video, education, finance, ads, senior, recruiter, social media, full time, part time, jira, technical, coordinator, analyst, devops, cloud, microsoft, ops",2026-07-08T17:16:06+00:00,https://remoteOK.com/remote-jobs/remote-project-coordinator-franklin-fitch-1134634
Controller Financiero,Veolia,"San Fernando, ","customer support, marketing, travel, exec, content writing, sales, golang, controller, excel",2026-07-08T16:33:10+00:00,https://remoteOK.com/remote-jobs/remote-controller-financiero-veolia-1134632
Test 1 posting,Sonic Healthcare UK,"Chase, ","testing, education, customer support, travel, finance, scheme, ops, medical, non tech",2026-07-08T15:30:18+00:00,https://remoteOK.com/remote-jobs/remote-test-1-posting-sonic-healthcare-uk-1134608
Attractions Instructor,Royal Caribbean International,"Berry Islands, ","teaching, sys admin, infosec, education, supervisor, customer support, testing, exec, math, ops, sales, medical",2026-07-08T14:55:45+00:00,https://remoteOK.com/remote-jobs/remote-attractions-instructor-royal-caribbean-international-1134598
Joiner Multi,United Infrastructure Ltd,"Hertford Heath, ","dev, engineer, digital nomad, design, customer support",2026-07-08T14:49:48+00:00,https://remoteOK.com/remote-jobs/remote-joiner-multi-united-infrastructure-ltd-1134638
Events Manager,Lantern,"Dallas, Dallas, Texas, United States","infosec, coordinator, customer support, dev, mobile, exec, senior, ops, medical, digital nomad, design, crypto, marketing, video, finance, content writing, education, legal, sales, golang, full time, photoshop, illustrator, copywriting, ads, social media, salesforce, hr, travel",2026-07-08T13:51:13+00:00,https://remoteOK.com/remote-jobs/remote-events-manager-lantern-1134622
Influencer &amp; Community Marketing Executive,UBT,"Birmingham, Birmingham, England, United Kingdom","customer support, marketing, travel, exec, content writing, sales, golang",2026-07-08T13:46:28+00:00,https://remoteOK.com/remote-jobs/remote-influencer-amp-community-marketing-executive-ubt-1134631
Data center technician Dispatch,Sharp Brains,"Nassau, ","sys admin, infosec, education, technical, customer support, testing",2026-07-08T13:02:44+00:00,https://remoteOK.com/remote-jobs/remote-data-center-technician-dispatch-sharp-brains-1134595
Mali,Ghar,"Lucknow, ",,2026-07-08T11:10:49+00:00,https://remoteOK.com/remote-jobs/remote-mali-ghar-1134606
Vendor Partner Lead,LinkedIn,"Hyderabad, Hyderabad, Telangana, India","education, customer support, marketing, exec, content writing, ops, legal, sales",2026-07-08T09:17:27+00:00,https://remoteOK.com/remote-jobs/remote-vendor-partner-lead-linkedin-1134596
Test,Solvay,"Niagara Falls, Niagara Falls, Ontario, Canada","testing, non tech",2026-07-08T08:17:30+00:00,https://remoteOK.com/remote-jobs/remote-test-solvay-1134589
Social Content Lead,KAST,"New York, New York, New York, United States","infosec, coordinator, customer support, dev, mobile, exec, senior, ops, medical, digital nomad, design, crypto, marketing, video, finance, content writing",2026-07-08T07:25:40+00:00,https://remoteOK.com/remote-jobs/remote-social-content-lead-kast-1134618
RESTAURANT JOBS,Boudin Bakery Cafe,"Urban agglomeration of Montreal, ","testing, non tech",2026-07-08T07:11:58+00:00,https://remoteOK.com/remote-jobs/remote-restaurant-jobs-boudin-bakery-cafe-1134590
Social Media Manager,Digital,"Pennsylvania, Pennsylvania, United States","infosec, coordinator, customer support, dev, mobile, exec, senior, ops, medical, digital nomad, design, crypto, marketing, video, finance, content writing, education, legal, sales, golang, full time, photoshop, illustrator, copywriting, ads, social media",2026-07-08T05:11:20+00:00,https://remoteOK.com/remote-jobs/remote-social-media-manager-digital-1134621
Architectural Drafter Designer,OnlineJobs.PH,"Miami, ","exec, education, strategy, customer support, copywriting, marketing, travel, speech, video, mobile, content writing, senior, medical, social media, ecommerce, full time, data entry, dev, web dev, microsoft, ops, digital nomad, legal, design, technical, sales, recruiter, ads, art direction, saas, testing, engineer, hr, sys admin, coordinator, payroll, finance, excel, designer",2026-07-08T04:52:46+00:00,https://remoteOK.com/remote-jobs/remote-architectural-drafter-designer-onlinejobs-ph-1134584
Data Entry Specialist Assistant Administrator,ReLytics Hire,"Hong Kong, Hong Kong, Hong Kong SAR","web3, crypto, blockchain, analyst, infosec, customer support, marketing, finance, math, exec, content writing, ops, legal, recruiter, sys admin, education, technical, virtual assistant, design, vfx, part time, digital nomad, data entry, admin, microsoft, excel",2026-07-08T04:45:53+00:00,https://remoteOK.com/remote-jobs/remote-data-entry-specialist-assistant-administrator-relytics-hire-1134602
Virtual Executive Assistant,ReLytics Hire,"Friesland, Friesland, Nederland","virtual assistant, education, customer support, marketing, travel, exec, senior, ops",2026-07-08T04:43:41+00:00,https://remoteOK.com/remote-jobs/remote-virtual-executive-assistant-relytics-hire-1134588
Customer Support,ReLytics Hire,"المدينة, المدينة المدينة السعودية","web3, crypto, blockchain, analyst, infosec, customer support, marketing, finance, math, exec, content writing, ops, legal, recruiter, sys admin, education, technical",2026-07-08T04:20:43+00:00,https://remoteOK.com/remote-jobs/remote-customer-support-relytics-hire-1134600
Entry Level Administrative Assistant,ReLytics Hire,"المدينة, المدينة المدينة السعودية","education, customer support, marketing, exec, content writing, ops, legal, sales, virtual assistant, video, microsoft, excel",2026-07-08T04:20:26+00:00,https://remoteOK.com/remote-jobs/remote-entry-level-administrative-assistant-relytics-hire-1134597
Project Manager,Queensland Government,"Brisbane, ","project manager, exec, infosec, education, technical, medical",2026-07-08T03:40:10+00:00,https://remoteOK.com/remote-jobs/remote-project-manager-queensland-government-1134623
Data Entry Typist,"Argus Medical Management, LLC","California, California, United States","exec, education, strategy, customer support, copywriting, marketing, travel, speech, video, mobile, content writing, senior, medical, social media, ecommerce, full time, data entry, dev, web dev, microsoft, ops, digital nomad",2026-07-08T03:30:47+00:00,https://remoteOK.com/remote-jobs/remote-data-entry-typist-argus-medical-management-llc-1134579
RTW Driver,Parkland Corporation,"Nassau, ","education, supervisor, testing, non tech",2026-07-08T02:37:15+00:00,https://remoteOK.com/remote-jobs/remote-rtw-driver-parkland-corporation-1134587
Asset Management Specialist Water Wastewater Treatment,Woodard &amp; Curran,Virtual,"infosec, customer support, marketing, design, travel, exec, finance, math, content writing, ops, medical, engineer, recruiter, digital nomad",2026-07-08T00:00:05+00:00,https://remoteOK.com/remote-jobs/remote-asset-management-specialist-water-wastewater-treatment-woodard-amp-curran-1134569
12 jobs that pay well without a degree,Unigo,"Paying, ",,2026-07-07T22:20:28+00:00,https://remoteOK.com/remote-jobs/remote-12-jobs-that-pay-well-without-a-degree-unigo-1134605
Medical Writer Scientific Communications,Prime,"Toronto, Toronto, Ontario, Canada","writer, customer support, exec, finance, microsoft, content writing, excel, golang, medical",2026-07-07T22:19:33+00:00,https://remoteOK.com/remote-jobs/remote-medical-writer-scientific-communications-prime-1134662
Social Media Manager TikTok and Founder,Once Upon a Farm,Los Angeles Metropolitan Area,"exec, education, strategy, customer support, copywriting, marketing, travel, speech, video, mobile, content writing, senior, medical, social media, ecommerce, full time",2026-07-07T20:57:14+00:00,https://remoteOK.com/remote-jobs/remote-social-media-manager-tiktok-and-founder-once-upon-a-farm-1134578
Creative Strategist,Ramen Bae,"California, California, United States","exec, education, strategy, customer support, copywriting, marketing, travel, speech, video, mobile, content writing, senior, medical, social media, ecommerce, full time, data entry, dev, web dev, microsoft, ops, digital nomad, legal, design, technical, sales, recruiter, ads, art direction, saas, testing, engineer, hr, sys admin, coordinator, payroll, finance, excel, designer, golang",2026-07-07T20:14:56+00:00,https://remoteOK.com/remote-jobs/remote-creative-strategist-ramen-bae-1134585
Assistente Financeiro,Sicoob,"Brasília, Brasília, Distrito Federal, Brasil","dev, digital nomad",2026-07-07T20:02:48+00:00,https://remoteOK.com/remote-jobs/remote-assistente-financeiro-sicoob-1134592
Lead Paralegal,Finch,"New York, New York, New York, United States","exec, education, strategy, customer support, copywriting, marketing, travel, speech, video, mobile, content writing, senior, medical, social media, ecommerce, full time, data entry, dev, web dev, microsoft, ops, digital nomad, legal",2026-07-07T20:01:04+00:00,https://remoteOK.com/remote-jobs/remote-lead-paralegal-finch-1134580
Director Educational Partnerships,Sonic Automotive,"Charlotte, Charlotte, North Carolina, United States","exec, education, strategy, customer support, copywriting, marketing, travel, speech, video, mobile, content writing, senior, medical, social media, ecommerce, full time, data entry, dev, web dev, microsoft, ops, digital nomad, legal, design, technical, sales, recruiter, ads",2026-07-07T19:32:02+00:00,https://remoteOK.com/remote-jobs/remote-director-educational-partnerships-sonic-automotive-1134581
 SUPERVISEUR 26 27,The Home Depot Canada,"Barrie, ",,2026-07-07T19:03:57+00:00,https://remoteOK.com/remote-jobs/remote-superviseur-26-27-the-home-depot-canada-1134570
 SUPERVISEUR 25,The Home Depot Canada,"Guelph, ",,2026-07-07T19:03:57+00:00,https://remoteOK.com/remote-jobs/remote-superviseur-25-the-home-depot-canada-1134571
Compliance Market Surveillance Analyst,Crypto.com,"دبي, دبي دبي الإمارات العربية المتحدة","web3, crypto, blockchain, analyst, infosec, customer support, marketing, finance, math, exec, content writing, ops, legal, recruiter",2026-07-07T17:19:04+00:00,https://remoteOK.com/remote-jobs/remote-compliance-market-surveillance-analyst-crypto-com-1134599
Human Resources Administrative Coordinator,Enstar Group,"Florida, Florida, United States","exec, education, strategy, customer support, copywriting, marketing, travel, speech, video, mobile, content writing, senior, medical, social media, ecommerce, full time, data entry, dev, web dev, microsoft, ops, digital nomad, legal, design, technical, sales, recruiter, ads, art direction, saas, testing, engineer, hr, sys admin, coordinator, payroll, finance, excel",2026-07-07T15:12:05+00:00,https://remoteOK.com/remote-jobs/remote-human-resources-administrative-coordinator-enstar-group-1134583
Freelance Técnico Audiovisual Sevilla,OpenWebinars,"Sevilla, Sevilla, Andalucía, España","marketing, linguistics, education, content writing, non tech, video, illustrator",2026-07-07T13:23:32+00:00,https://remoteOK.com/remote-jobs/remote-freelance-tecnico-audiovisual-sevilla-openwebinars-1134563
CAD Assistant,RecruitGo Careers,"Quezon City, Quezon City, National Capital Region, Philippines","web3, crypto, blockchain, analyst, infosec, customer support, marketing, finance, math, exec, content writing, ops, legal, recruiter, sys admin, education, technical, virtual assistant, design, vfx, part time, digital nomad",2026-07-07T13:23:31+00:00,https://remoteOK.com/remote-jobs/remote-cad-assistant-recruitgo-careers-1134601
Creative Director YouTube,Flick,"San Francisco, San Francisco, California, United States","exec, education, strategy, customer support, copywriting, marketing, travel, speech, video, mobile, content writing, senior, medical, social media, ecommerce, full time, data entry, dev, web dev, microsoft, ops, digital nomad, legal, design, technical, sales, recruiter, ads, art direction, saas, testing, engineer",2026-07-07T13:11:18+00:00,https://remoteOK.com/remote-jobs/remote-creative-director-youtube-flick-1134582
Regional Training Supervisor,Guild Garage Group,"Orlando, Orlando, Florida, United States","exec, education, strategy, customer support, copywriting, marketing, travel, speech, video, mobile, content writing, senior, medical, social media, ecommerce, full time, data entry, dev, web dev, microsoft, ops, digital nomad, legal, design, technical, sales, recruiter, ads, art direction, saas, testing, engineer, hr, sys admin, coordinator, payroll, finance, excel, designer, golang, game dev, supervisor, adult, stats",2026-07-07T12:51:48+00:00,https://remoteOK.com/remote-jobs/remote-regional-training-supervisor-guild-garage-group-1134586
Senior Vice President &amp; General Manager Senior Living,PointClickCare,"Mississauga, Mississauga, Ontario, Canada","customer support, exec, saas, dev, content writing, marketing, excel, legal, medical, ecommerce, shopify, full time, digital nomad, consulting, design, vfx, designer, web dev, ads, infosec, education, recruiter, travel, speech, finance, c, cloud, senior, ops, sales, golang, engineer",2026-07-07T12:12:57+00:00,https://remoteOK.com/remote-jobs/remote-senior-vice-president-amp-general-manager-senior-living-pointclickcare-1134686
Replacement for Joe test,Infinity Group,"Melbourne, ","testing, non tech",2026-07-07T10:38:07+00:00,https://remoteOK.com/remote-jobs/remote-replacement-for-joe-test-infinity-group-1134556
Associate Data Analyst,Arabian Private Holdings,"Manchester, Manchester, England, United Kingdom","marketing, linguistics, education, content writing, non tech, video, illustrator, finance, c, designer, analyst, consulting, customer support, exec, data science, ops",2026-07-07T10:04:48+00:00,https://remoteOK.com/remote-jobs/remote-associate-data-analyst-arabian-private-holdings-1134566
Speculative Applications,ITDev,"Southampton, ","dev, engineer, digital nomad",2026-07-07T09:36:41+00:00,https://remoteOK.com/remote-jobs/remote-speculative-applications-itdev-1134637
Junior Business Analyst,Arabian Private Holdings,"London, London, England, United Kingdom","project manager, exec, coordinator, customer support, admin, junior, ops, marketing, medical, analyst, education, consulting, finance, senior",2026-07-07T09:06:35+00:00,https://remoteOK.com/remote-jobs/remote-junior-business-analyst-arabian-private-holdings-1134577
