Job Title,Company,Location,Tags,Date,Apply Link
Freelance Video Editor,Forbes Advisor,"Wilmington, Wilmington, England, United Kingdom","design, education, technical, writer, customer support, dev, speech, adult, video, exec, content writing, ops, excel, sales, recruiter, digital nomad, hr, teaching, medical, designer, marketing, web dev, junior, internship, embedded, python, game dev, virtual assistant, cloud, git, api, engineer, full time, testing, travel, finance, seo",2026-06-04T22:51:14+00:00,https://remoteOK.com/remote-jobs/remote-freelance-video-editor-forbes-advisor-1132850
Asst Depot Manager,Unilever,"Gurgaon, Gurgaon, Haryana, India","exec, sys admin, customer support, ops",2026-06-04T21:44:16+00:00,https://remoteOK.com/remote-jobs/remote-asst-depot-manager-unilever-1132870
Executive Assistant,Cyara,"San Francisco, San Francisco, California, United States","customer support, exec, hr, design, defi, crypto, bitcoin, marketing, finance, ruby, api, mobile, senior, stats, digital nomad, virtual assistant, testing, travel, speech, c, microsoft, ops, excel, recruiter",2026-06-04T20:56:43+00:00,https://remoteOK.com/remote-jobs/remote-executive-assistant-cyara-1132853
Merchandising Representative,CELSIUS,"Orlando, Orlando, Florida, United States","customer support, exec, hr, design, defi, crypto, bitcoin, marketing, finance, ruby, api, mobile, senior, stats, digital nomad, virtual assistant, testing, travel, speech, c, microsoft, ops, excel, recruiter, sales, medical, sys admin, education, adult, content writing, internship, technical, dev, video, coordinator, web3, ethereum, legal, golang",2026-06-04T19:43:16+00:00,https://remoteOK.com/remote-jobs/remote-merchandising-representative-celsius-1132860
Paralegal,Injective,"New York, ","customer support, exec, hr, design, defi, crypto, bitcoin, marketing, finance, ruby, api, mobile, senior, stats, digital nomad, virtual assistant, testing, travel, speech, c, microsoft, ops, excel, recruiter, sales, medical, sys admin, education, adult, content writing, internship, technical, dev, video, coordinator, web3, ethereum, legal",2026-06-04T19:33:24+00:00,https://remoteOK.com/remote-jobs/remote-paralegal-injective-1132859
Chief Executive Officer The Dollar Foundation,Coinme,"Miami, Miami, Florida, United States","customer support, exec, hr, design, defi, crypto, bitcoin, marketing, finance, ruby, api, mobile, senior, stats, digital nomad",2026-06-04T18:59:57+00:00,https://remoteOK.com/remote-jobs/remote-chief-executive-officer-the-dollar-foundation-coinme-1132852
Test Account,BOT Consulting,"Jaipur, ","infosec, education, customer support, marketing, exec, finance, ops, medical, engineer, testing, coordinator, sys admin, travel, consulting",2026-06-04T18:30:00+00:00,https://remoteOK.com/remote-jobs/remote-test-account-bot-consulting-1132911
Junior Digital Designer,The Big Table Group,"London, London, England, United Kingdom","design, education, technical, writer, customer support, dev, speech, adult, video, exec, content writing, ops, excel, sales, recruiter, digital nomad, hr, teaching, medical, designer, marketing, web dev, junior, internship",2026-06-04T17:50:09+00:00,https://remoteOK.com/remote-jobs/remote-junior-digital-designer-the-big-table-group-1132848
National Manager A&amp;D &amp; Commercial Sales,Caesarstone Ltd. - Corporate,"Charlotte, Charlotte, North Carolina, United States","customer support, exec, hr, design, defi, crypto, bitcoin, marketing, finance, ruby, api, mobile, senior, stats, digital nomad, virtual assistant, testing, travel, speech, c, microsoft, ops, excel, recruiter, sales, medical",2026-06-04T17:49:44+00:00,https://remoteOK.com/remote-jobs/remote-national-manager-aampd-amp-commercial-sales-caesarstone-ltd-corporate-1132854
