Job Title,Company,Location,Tags,Date,Apply Link
Job 27573 Mid Data Developer Brasil,CI&amp;T,Brazil,"developer, cloud, digital nomad",2026-02-19T00:06:05+00:00,https://remoteOK.com/remote-jobs/remote-job-27573-mid-data-developer-brasil-ciampt-1130435
Job 27611 MidSenior Data Developer Brasil,CI&amp;T,Brazil,"developer, design, unity, digital nomad",2026-02-19T00:05:51+00:00,https://remoteOK.com/remote-jobs/remote-job-27611-midsenior-data-developer-brasil-ciampt-1130434
Job 27602 Mid level Developer NodeJS Brazil,CI&amp;T,Brazil,"developer, javascript, nodejs, cloud, api, digital nomad",2026-02-19T00:05:44+00:00,https://remoteOK.com/remote-jobs/remote-job-27602-mid-level-developer-nodejs-brazil-ciampt-1130433
Spécialiste en acquisition de talents Pipeline & Sourcing,Workleap,Canada,"microsoft, leader",2026-02-19T00:05:37+00:00,https://remoteOK.com/remote-jobs/remote-specialiste-en-acquisition-de-talents-pipeline-sourcing-workleap-1130432
Social Commerce Strategist,Power Digital,Canada,"consulting, strategist, growth, investment, content, marketing",2026-02-19T00:05:28+00:00,https://remoteOK.com/remote-jobs/remote-social-commerce-strategist-power-digital-1130431
Mid Level DevOps Engineer CI CD Optimization,Ubiminds,Remote,"design, hr, system, security, docker, recruiter, support, developer, software, growth, code, devops, management, reliability, engineer, engineering, full-time, digital nomad",2026-02-19T00:05:19+00:00,https://remoteOK.com/remote-jobs/remote-mid-level-devops-engineer-ci-cd-optimization-ubiminds-1130430
Director Asset Protection NAM Retail,ARC&#39;TERYX,"North Vancouver, BC (Corporate)","director, security, training, support, growth, financial, investment, leader, lead, operations, health, ecommerce",2026-02-19T00:05:03+00:00,https://remoteOK.com/remote-jobs/remote-director-asset-protection-nam-retail-arc39teryx-1130429
HR Project Coordinator,Xsolla,Serbia,"hr, game, coordinator, support, financial, video, operational, recruitment, non tech",2026-02-19T00:04:55+00:00,https://remoteOK.com/remote-jobs/remote-hr-project-coordinator-xsolla-1130428
Senior Account Executive Western Europe,,Germany,"saas, game, finance, senior, sales, executive",2026-02-19T00:04:49+00:00,https://remoteOK.com/remote-jobs/remote-senior-account-executive-western-europe-1130427
Engineering Manager Delivery,Mechanical Orchard,United Kingdom (Remote),"manager, system, technical, support, software, growth, travel, operational, engineer, engineering",2026-02-19T00:04:40+00:00,https://remoteOK.com/remote-jobs/remote-engineering-manager-delivery-mechanical-orchard-1130426
Senior Marketing Science Strategist,Power Digital,Brazil,"consulting, strategist, testing, growth, investment, content, senior, marketing",2026-02-19T00:04:34+00:00,https://remoteOK.com/remote-jobs/remote-senior-marketing-science-strategist-power-digital-1130425
Director Global Consulting & System Integrator Partnerships,Ada,,"system, consulting, director, growth, management, lead",2026-02-19T00:04:25+00:00,https://remoteOK.com/remote-jobs/remote-director-global-consulting-system-integrator-partnerships-ada-1130424
Security Specialist,Workwize,,"security, saas",2026-02-19T00:04:17+00:00,https://remoteOK.com/remote-jobs/remote-security-specialist-workwize-1130423
Backend Engineer,dv01,,"saas, financial, investment, api, analytics, engineer, backend",2026-02-19T00:04:08+00:00,https://remoteOK.com/remote-jobs/remote-backend-engineer-dv01-1130422
QA Document Control Specialist,Apogee Therapeutics,Remote,"qa, engineering",2026-02-19T00:03:58+00:00,https://remoteOK.com/remote-jobs/remote-qa-document-control-specialist-apogee-therapeutics-1130421
Workday Enterprise Project Manager,CompassX Group,PST timezone,"manager, hr, system, consulting, technical, testing, financial, strategy, management, lead, executive",2026-02-19T00:03:50+00:00,https://remoteOK.com/remote-jobs/remote-workday-enterprise-project-manager-compassx-group-1130420
Coupa Pay Customer Success Manager 11184,"Coupa Software, Inc.","Los Angeles, California, United States","manager, consulting, technical, software, growth, financial, investment, finance, bank, strategy, management, lead, sales, recruitment",2026-02-19T00:03:43+00:00,https://remoteOK.com/remote-jobs/remote-coupa-pay-customer-success-manager-11184-coupa-software-inc-1130419
Research Data Scientist,Swayable,Remote,"python, growth, director, strategy, content, executive",2026-02-19T00:03:35+00:00,https://remoteOK.com/remote-jobs/remote-research-data-scientist-swayable-1130418
Project Coordinator,Caylent,BRAZIL,"amazon, security, technical, coordinator, web, scrum, cloud, management, senior, engineering, recruitment",2026-02-19T00:03:25+00:00,https://remoteOK.com/remote-jobs/remote-project-coordinator-caylent-1130417
Regional Account Executive,Oasis Security,,"infosec, system, security, management, sales, executive",2026-02-19T00:03:17+00:00,https://remoteOK.com/remote-jobs/remote-regional-account-executive-oasis-security-1130416
Senior Software Engineer Data Observability,DataHub,Palo Alto,"software, design, saas, system, architect, technical, cloud, lead, senior, operational, reliability, engineer, engineering, digital nomad",2026-02-19T00:03:08+00:00,https://remoteOK.com/remote-jobs/remote-senior-software-engineer-data-observability-datahub-1130415
US Client Accounting Advisor,Cloud Accountant Staffing,,"accounting, training, support, bookkeeping, financial, cloud, microsoft, operational, full-time, part-time",2026-02-19T00:03:00+00:00,https://remoteOK.com/remote-jobs/remote-us-client-accounting-advisor-cloud-accountant-staffing-1130414
Marketing Specialist,Vitable Health,Remote,"content, operational, marketing, sales, medical, health, healthcare, non tech",2026-02-19T00:02:53+00:00,https://remoteOK.com/remote-jobs/remote-marketing-specialist-vitable-health-1130413
Enterprise Customer Success Manager,ZipRecruiter,,"manager, ios, support, mobile, strategy, sales, recruiting, recruitment, non tech",2026-02-19T00:02:45+00:00,https://remoteOK.com/remote-jobs/remote-enterprise-customer-success-manager-ziprecruiter-1130412
Portfolio Manager,Engineers Gate,,"manager, support, test, code, financial, investment, strategy, operational, engineering",2026-02-19T00:02:36+00:00,https://remoteOK.com/remote-jobs/remote-portfolio-manager-engineers-gate-1130411
Associate Strategy Analyst,Blytheco,Remote U.S.A.,"analyst, ceo, software, leader, strategy",2026-02-19T00:02:27+00:00,https://remoteOK.com/remote-jobs/remote-associate-strategy-analyst-blytheco-1130410
Business Development Representative,CrowdRiff,Remote,"saas, teach, consult, support, software, travel, marketing, sales, recruitment",2026-02-19T00:02:18+00:00,https://remoteOK.com/remote-jobs/remote-business-development-representative-crowdriff-1130409
Senior Technical Consultant Charles River Everywhere,FormativGroup,,"consultant, system, technical, support, management, senior, operations, operational",2026-02-19T00:02:11+00:00,https://remoteOK.com/remote-jobs/remote-senior-technical-consultant-charles-river-everywhere-formativgroup-1130408
Talent Acquisition Specialist Early Pipeline & Sourcing,Workleap,Canada,"hr, microsoft, recruitment",2026-02-19T00:02:02+00:00,https://remoteOK.com/remote-jobs/remote-talent-acquisition-specialist-early-pipeline-sourcing-workleap-1130407
Sales Development Representative,Unlimit,,"crypto, support, financial, fintech, sales, go, recruiting",2026-02-19T00:01:53+00:00,https://remoteOK.com/remote-jobs/remote-sales-development-representative-unlimit-1130406
KIP Summer 2026 Research Assistant Finance Insurance &amp; Trade Policy R Street Institute,Stand Together,"Washington, DC","assistant, training, support, financial, finance, excel, internship, full-time, part-time, non tech",2026-02-19T00:01:46+00:00,https://remoteOK.com/remote-jobs/remote-kip-summer-2026-research-assistant-finance-insurance-amp-trade-policy-r-street-institute-stand-together-1130405
Senior Content Program Strategist,Pulley,Remote,"system, strategist, management, content, senior, marketing",2026-02-19T00:01:39+00:00,https://remoteOK.com/remote-jobs/remote-senior-content-program-strategist-pulley-1130404
Software Engineer,itD Tech,Arizona,"software, design, python, training, support, engineer, digital nomad",2026-02-19T00:01:29+00:00,https://remoteOK.com/remote-jobs/remote-software-engineer-itd-tech-1130403
Senior Manager Digital Strategy,Monks,,"manager, strategy, senior",2026-02-19T00:01:22+00:00,https://remoteOK.com/remote-jobs/remote-senior-manager-digital-strategy-monks-1130402
Payroll Specialist Lead Germany,Remote - Referral Board,,"payroll, hr, software, management, lead, operations, excel",2026-02-19T00:01:13+00:00,https://remoteOK.com/remote-jobs/remote-payroll-specialist-lead-germany-remote-referral-board-1130401
Data Entry Clerk,Sensor Tower,Seoul,"manager, video, bank, operations, excel, recruitment, non tech",2026-02-18T23:00:01+00:00,https://remoteOK.com/remote-jobs/remote-data-entry-clerk-sensor-tower-1130400
Product & Application Security Engineer,Veeam Software,United States,"security, dev, leader, senior, go, engineer, digital nomad",2026-02-18T22:00:04+00:00,https://remoteOK.com/remote-jobs/remote-product-application-security-engineer-veeam-software-1130399
Personality & Behavior Tutor,xAI,"Palo Alto, CA","tutor, training, technical, support, software, excel, engineering",2026-02-18T21:00:04+00:00,https://remoteOK.com/remote-jobs/remote-personality-behavior-tutor-xai-1130398
Senior Data Engineer,Exadel,"Brazil, Bulgaria, Colombia, Georgia, Lithuania, Poland, Romania","jira, salesforce, code, web, education, mobile, management, senior, operations, analytics, health, engineer, engineering",2026-02-18T16:01:33+00:00,https://remoteOK.com/remote-jobs/remote-senior-data-engineer-exadel-1130396
Automation Sales Manager,Formic,"San Francisco || Sacramento, CA","manager, support, growth, operational, sales, engineering",2026-02-18T16:01:21+00:00,https://remoteOK.com/remote-jobs/remote-automation-sales-manager-formic-1130395
Bilingual Legal Assistant,Distro,Buenos Aires,"assistant, legal, non tech",2026-02-18T16:01:10+00:00,https://remoteOK.com/remote-jobs/remote-bilingual-legal-assistant-distro-1130394
Robotics Field Service Engineer,Formic,"Boston, MA","technical, support, robotics, operations, operational, engineer, engineering",2026-02-18T16:01:03+00:00,https://remoteOK.com/remote-jobs/remote-robotics-field-service-engineer-formic-1130393
Senior Lead Product Designer Operations,Monzo,Cardiff London or  UK,"design, designer, financial, education, bank, lead, senior, operations, engineering, digital nomad",2026-02-18T16:00:45+00:00,https://remoteOK.com/remote-jobs/remote-senior-lead-product-designer-operations-monzo-1130392
Data Analyst,Valtech,Brazil,"analyst, growth",2026-02-18T16:00:34+00:00,https://remoteOK.com/remote-jobs/remote-data-analyst-valtech-1130391
QA Engineer,Mex Digital FZE ,Dubai,"cryptocurrency, technical, developer, testing, test, growth, qa, financial, fintech, api, reliability, engineer, digital nomad",2026-02-18T16:00:18+00:00,https://remoteOK.com/remote-jobs/remote-qa-engineer-mex-digital-fze-1130390
Specialist Business Development and Projects,Stranger Soccer,,"support, travel, mobile, sales, executive",2026-02-18T08:01:18+00:00,https://remoteOK.com/remote-jobs/remote-specialist-business-development-and-projects-stranger-soccer-1130389
Field Marketing Manager,Cogent Security,All,"infosec, manager, security, exec, leader, strategy, management, marketing, sales, executive",2026-02-18T08:01:13+00:00,https://remoteOK.com/remote-jobs/remote-field-marketing-manager-cogent-security-1130388
Manager Paid Social and Digital Acquisition,Cogent Security,All,"infosec, manager, saas, security, testing, test, marketing",2026-02-18T08:01:07+00:00,https://remoteOK.com/remote-jobs/remote-manager-paid-social-and-digital-acquisition-cogent-security-1130387
Regional Lead Civil Engineer Bridge & Structures,BKF Engineers,,"design, consultant, consulting, technical, recruiter, support, code, travel, financial, lead, engineer, engineering, digital nomad",2026-02-18T08:01:00+00:00,https://remoteOK.com/remote-jobs/remote-regional-lead-civil-engineer-bridge-structures-bkf-engineers-1130386
Senior Manager Payroll,Compass Surgical Partners,,"manager, payroll, hr, system, training, recruiter, support, testing, growth, education, management, lead, senior, operations, operational, excel, legal, health, healthcare",2026-02-18T08:00:54+00:00,https://remoteOK.com/remote-jobs/remote-senior-manager-payroll-compass-surgical-partners-1130385
Director of Product Marketing,Cogent Security,All,"infosec, director, security, technical, web, content, marketing, sales",2026-02-18T08:00:48+00:00,https://remoteOK.com/remote-jobs/remote-director-of-product-marketing-cogent-security-1130384
Team Lead,32Co,India,"design, designer, support, testing, growth, management, lead, operations, operational, health, healthcare, digital nomad",2026-02-18T08:00:43+00:00,https://remoteOK.com/remote-jobs/remote-team-lead-32co-1130383
Revenue Operations Manager,EasyLlama,,"manager, saas, hr, training, ceo, support, lead, operations, operational, sales, health, non tech",2026-02-18T08:00:34+00:00,https://remoteOK.com/remote-jobs/remote-revenue-operations-manager-easyllama-1130382
Senior Manager Site Reliability Engineer,Ping Identity,USA,"manager, saas, devops, cloud, senior, operations, operational, reliability, engineer",2026-02-18T00:03:36+00:00,https://remoteOK.com/remote-jobs/remote-senior-manager-site-reliability-engineer-ping-identity-1130380
Manager Tax Controversy,Aprio,,"manager, consulting, technical, support, growth, management, lead, full-time",2026-02-18T00:03:26+00:00,https://remoteOK.com/remote-jobs/remote-manager-tax-controversy-aprio-1130379
Content Manager,NMI,"Remote, US","manager, embedded, technical, writer, support, fintech, strategy, lead, content, senior, marketing",2026-02-18T00:03:19+00:00,https://remoteOK.com/remote-jobs/remote-content-manager-nmi-1130378
Associate Director Program Management,"Adverum Biotechnologies, Inc.","Redwood City, CA","director, design, support, qa, strategy, management, operations, operational, digital nomad",2026-02-18T00:03:10+00:00,https://remoteOK.com/remote-jobs/remote-associate-director-program-management-adverum-biotechnologies-inc-1130377
Senior Site Reliability Engineer,Ping Identity,USA,"design, software, devops, cloud, senior, operations, reliability, engineer, digital nomad",2026-02-18T00:03:04+00:00,https://remoteOK.com/remote-jobs/remote-senior-site-reliability-engineer-ping-identity-1130376
Regional Sales Manager,Halter,Victoria,"manager, support, growth, leader, management, junior, operations, sales, health",2026-02-18T00:02:53+00:00,https://remoteOK.com/remote-jobs/remote-regional-sales-manager-halter-1130375
Associate Director Adobe Target,Bounteous,Canada,"director, design, security, training, consulting, consultancy, technical, support, testing, test, code, education, management, marketing, analytics, health, ecommerce, digital nomad",2026-02-18T00:02:46+00:00,https://remoteOK.com/remote-jobs/remote-associate-director-adobe-target-bounteous-1130374
Enterprise Account Executive Pacific NW,FireMon,"USA, Remote","hr, system, security, technical, support, software, growth, banking, strategy, management, sales, executive",2026-02-18T00:02:39+00:00,https://remoteOK.com/remote-jobs/remote-enterprise-account-executive-pacific-nw-firemon-1130373
Full Stack Software Engineer,Cala Health,SF Bay Area,"software, frontend, full-stack, medical, engineer, engineering, backend, full-time",2026-02-18T00:02:33+00:00,https://remoteOK.com/remote-jobs/remote-full-stack-software-engineer-cala-health-1130372
Director of Field and Partner Marketing,MinIO,,"director, design, architect, web, leader, strategy, lead, marketing, sales, digital nomad",2026-02-18T00:02:23+00:00,https://remoteOK.com/remote-jobs/remote-director-of-field-and-partner-marketing-minio-1130371
Director PBM Product Strategy and Delivery,"AffirmedRx, PBC",,"director, strategy, health, non tech",2026-02-18T00:02:14+00:00,https://remoteOK.com/remote-jobs/remote-director-pbm-product-strategy-and-delivery-affirmedrx-pbc-1130370
Senior Sales Manager,Diversified Automation,"Louisville, KY","manager, software, growth, travel, microsoft, senior, sales",2026-02-18T00:02:05+00:00,https://remoteOK.com/remote-jobs/remote-senior-sales-manager-diversified-automation-1130369
Customer Success Technician,Teleo,Texas,"technical, test, travel, robotics, senior, operations, engineering",2026-02-18T00:01:57+00:00,https://remoteOK.com/remote-jobs/remote-customer-success-technician-teleo-1130368
Senior Sales Engineer,Ping Identity,San Francisco,"technical, cloud, management, senior, sales, engineer",2026-02-18T00:01:49+00:00,https://remoteOK.com/remote-jobs/remote-senior-sales-engineer-ping-identity-1130367
Senior Software Engineer Angular .net,3Pillar,Canada,"software, design, salesforce, architect, technical, growth, code, web, cloud, angular, api, management, lead, senior, junior, health, engineer, engineering, backend, digital nomad",2026-02-18T00:01:39+00:00,https://remoteOK.com/remote-jobs/remote-senior-software-engineer-angular-net-3pillar-1130366
Senior Sales Engineer,Ping Identity,San Francisco,"technical, cloud, management, senior, sales, engineer",2026-02-18T00:01:23+00:00,https://remoteOK.com/remote-jobs/remote-senior-sales-engineer-ping-identity-1130365
Real Estate Counsel,Unison Infrastructure,United States,"support, education, investment, management, senior, operations, telecom, health, non tech",2026-02-18T00:01:13+00:00,https://remoteOK.com/remote-jobs/remote-real-estate-counsel-unison-infrastructure-1130364
Director CMC Program Management,Kyverna Therapeutics,Remote,"director, technical, support, finance, management, lead, senior, junior, operations",2026-02-18T00:01:02+00:00,https://remoteOK.com/remote-jobs/remote-director-cmc-program-management-kyverna-therapeutics-1130363
Senior Recruiter,Gravie,,"recruiter, senior, health, healthcare, recruiting, non tech",2026-02-18T00:00:54+00:00,https://remoteOK.com/remote-jobs/remote-senior-recruiter-gravie-1130362
Senior Program Manager,HSP Group,United States,"manager, hr, consulting, support, management, lead, senior, operations, marketing, legal, sales, go",2026-02-18T00:00:44+00:00,https://remoteOK.com/remote-jobs/remote-senior-program-manager-hsp-group-1130361
AI Engineer,fastino.ai,,"docker, ceo, developer, api, operational, reliability, engineer, engineering, digital nomad",2026-02-18T00:00:33+00:00,https://remoteOK.com/remote-jobs/remote-ai-engineer-fastino-ai-1130360
Senior Marketing Manager Website Experience,Zensurance,"Toronto, ON","manager, design, wordpress, front-end, consultant, technical, support, developer, testing, growth, ux, education, seo, leader, strategy, content, senior, marketing, sales, health, digital nomad",2026-02-18T00:00:26+00:00,https://remoteOK.com/remote-jobs/remote-senior-marketing-manager-website-experience-zensurance-1130359
ServiceNow Solution Architect,Accenture Federal Services,"Washington, DC","architect, design, system, training, technical, support, developer, cloud, administrator, lead, operational, health, digital nomad",2026-02-17T21:00:06+00:00,https://remoteOK.com/remote-jobs/remote-servicenow-solution-architect-accenture-federal-services-1130358
Technical Project Manager,BlastPoint,Remote - US,"manager, technical, growth, financial, analytics",2026-02-17T20:00:04+00:00,https://remoteOK.com/remote-jobs/remote-technical-project-manager-blastpoint-1130357
VP of Drayage & Intermodal,"ITS Logistics, LLC",Fort Worth,"support, leader, strategy, lead, senior, operational, go",2026-02-17T17:00:14+00:00,https://remoteOK.com/remote-jobs/remote-vp-of-drayage-intermodal-its-logistics-llc-1130356
Customer Service Booking Hotels Online,Destination Knot,"Los Angeles, California","training, support, travel, sales, non tech",2026-02-17T16:01:45+00:00,https://remoteOK.com/remote-jobs/remote-customer-service-booking-hotels-online-destination-knot-1130355
Inbound Business Development Representative Mountain Central,Bloomerang,,"support, marketing, sales",2026-02-17T16:01:38+00:00,https://remoteOK.com/remote-jobs/remote-inbound-business-development-representative-mountain-central-bloomerang-1130354
HR Analyst,SurveyMonkey,Canada,"hr, analyst, system, training, technical, support, payroll, operations, health",2026-02-17T16:01:29+00:00,https://remoteOK.com/remote-jobs/remote-hr-analyst-surveymonkey-1130353
Recruiting Partner,Code.org,"Seattle, WA","students, education, recruiting, non tech",2026-02-17T16:01:19+00:00,https://remoteOK.com/remote-jobs/remote-recruiting-partner-code-org-1130352
Software Developer,Mind Friend PRO,,"developer, software, full-stack, senior, engineer, digital nomad",2026-02-17T16:01:11+00:00,https://remoteOK.com/remote-jobs/remote-software-developer-mind-friend-pro-1130351
Marketing Campaign Operations Associate,Huntress,,"saas, security, game, operations, marketing, go, non tech",2026-02-17T16:00:59+00:00,https://remoteOK.com/remote-jobs/remote-marketing-campaign-operations-associate-huntress-1130350
Financial Associate,Ethena Labs,Globally Remote,"web3, crypto, back-end, support, software, growth, manager, accounting, financial, finance, bank, strategy",2026-02-17T16:00:49+00:00,https://remoteOK.com/remote-jobs/remote-financial-associate-ethena-labs-1130349
Inside Sales Representative Retention,Aura,Remote USA,"saas, security, consult, support, sales, full-time, non tech",2026-02-17T16:00:40+00:00,https://remoteOK.com/remote-jobs/remote-inside-sales-representative-retention-aura-1130348
Sales Specialist Upsell,Aura,Remote USA,"consult, sales, non tech",2026-02-17T16:00:31+00:00,https://remoteOK.com/remote-jobs/remote-sales-specialist-upsell-aura-1130347
Senior Software Engineer,FeverUp,Spain,"software, senior, engineer",2026-02-17T16:00:03+00:00,https://remoteOK.com/remote-jobs/remote-senior-software-engineer-feverup-1130346
Growth Marketing Manager,InfStones,Texas,"growth, manager, web3, node, mobile, management, marketing, analytics, sales, full-time",2026-02-17T12:00:02+00:00,https://remoteOK.com/remote-jobs/remote-growth-marketing-manager-infstones-1130345
Social Content Creator,HeyGen,Remote,"strategy, content, marketing, non tech",2026-02-17T06:00:03+00:00,https://remoteOK.com/remote-jobs/remote-social-content-creator-heygen-1130344
Software Engineer I,Bloomreach,India,"software, design, system, growth, financial, lead, content, engineer, backend, ecommerce, digital nomad",2026-02-17T04:00:12+00:00,https://remoteOK.com/remote-jobs/remote-software-engineer-i-bloomreach-1130343
Concepteur.trice produits UX UI,Go RH,Province du Québec,"ui, ux, design, tester, golang, digital nomad",2026-02-17T00:02:06+00:00,https://remoteOK.com/remote-jobs/remote-concepteur-trice-produits-ux-ui-go-rh-1130342
Senior Consultant Oracle Implementation,CrossCountry Consulting,United States,"consultant, consulting, design, technical, support, travel, financial, management, senior, operational, analytics, executive, digital nomad",2026-02-17T00:01:52+00:00,https://remoteOK.com/remote-jobs/remote-senior-consultant-oracle-implementation-crosscountry-consulting-1130341
Senior Software Engineer Developer Experience,Coinme,Remote - US/LATAM/CAN,"developer, software, defi, crypto, cryptocurrency, architect, growth, financial, finance, node.js, mobile, lead, senior, engineer, fullstack, digital nomad",2026-02-17T00:01:45+00:00,https://remoteOK.com/remote-jobs/remote-senior-software-engineer-developer-experience-coinme-1130340
Talent Operations Associate,OneImaging,Mexico,"support, video, operations, healthcare, recruiting, recruitment, non tech",2026-02-17T00:01:36+00:00,https://remoteOK.com/remote-jobs/remote-talent-operations-associate-oneimaging-1130339
Principal Proposal Solutions Consultant United States,AutogenAI,United States,"consultant, leader, content",2026-02-17T00:01:23+00:00,https://remoteOK.com/remote-jobs/remote-principal-proposal-solutions-consultant-united-states-autogenai-1130338
Director of Business Development,Smartbug Media,"Remote, United States","director, architect, technical, growth, web, financial, leader, strategy, management, lead, marketing, excel, analytics, legal, sales",2026-02-17T00:01:13+00:00,https://remoteOK.com/remote-jobs/remote-director-of-business-development-smartbug-media-1130337
Senior Manager Payroll,Compass Surgical Partners,,"manager, payroll, hr, system, training, recruiter, support, testing, growth, education, management, lead, senior, operations, operational, excel, legal, health, healthcare",2026-02-17T00:00:58+00:00,https://remoteOK.com/remote-jobs/remote-senior-manager-payroll-compass-surgical-partners-1130336
Quality Assurance Specialist,SanMar Employee Board,,"training, support",2026-02-17T00:00:52+00:00,https://remoteOK.com/remote-jobs/remote-quality-assurance-specialist-sanmar-employee-board-1130335
Product Owner Medical Cost Containment & JIRA Expertise,Reliant,United States,"jira, support, c, health, healthcare, non tech",2026-02-17T00:00:43+00:00,https://remoteOK.com/remote-jobs/remote-product-owner-medical-cost-containment-jira-expertise-reliant-1130334
