Job Title,Company,Location,Tags,Date,Apply Link
Graphic Narrator,"Resilient Solutions Plus, LLC","Baltimore, ","hr, customer support, testing, finance, education, math, robotics, exec, ops, excel, engineer, recruiter, sys admin, accounting, medical, design, dev, video, content writing, marketing, photoshop, illustrator, digital nomad",2026-06-07T03:33:42+00:00,https://remoteOK.com/remote-jobs/remote-graphic-narrator-resilient-solutions-plus-llc-1132981
Chief of Staff,Malama Health,Redwood City,"design, hr, exec, customer support, testing, marketing, ops, controller, accounting, payroll, finance, legal, golang, medical, digital nomad",2026-06-07T00:00:17+00:00,https://remoteOK.com/remote-jobs/remote-chief-of-staff-malama-health-1132965
Applied AI Engineer,Bjak ,Zurich,"design, sys admin, python, education, technical, dev, virtual assistant, engineer, digital nomad",2026-06-07T00:00:11+00:00,https://remoteOK.com/remote-jobs/remote-applied-ai-engineer-bjak-1132964
Senior ML Engineer,Clutch,,"design, saas, sys admin, python, education, docker, technical, customer support, dev, testing, analyst, speech, exec, finance, serverless, typescript, api, senior, golang, engineer, digital nomad",2026-06-07T00:00:04+00:00,https://remoteOK.com/remote-jobs/remote-senior-ml-engineer-clutch-1132963
Data Annotator,CodeGeniusRecruit,,data annotation,2026-06-06T22:02:32+00:00,https://remoteOK.com/remote-jobs/remote-data-annotator-codegeniusrecruit-1132962
Multi Grade Geographically Position,School District No. 27,"Anahim Lake, ","teaching, education, customer support, travel, finance, c, mobile, recruiter, non tech",2026-06-06T19:39:52+00:00,https://remoteOK.com/remote-jobs/remote-multi-grade-geographically-position-school-district-no-27-1132973
Administrative Support,Vish Consulting IT,"Colorado, ","consulting, salesforce, customer support, dev, transcribing, exec, math, microsoft, ops, excel, digital nomad",2026-06-06T19:23:50+00:00,https://remoteOK.com/remote-jobs/remote-administrative-support-vish-consulting-it-1132970
Inpatient Claims Processor I,Moda Health,"Portland, ","hr, customer support, testing, finance, education, math, robotics, exec, ops, excel, engineer, recruiter, sys admin, accounting, medical",2026-06-06T19:19:45+00:00,https://remoteOK.com/remote-jobs/remote-inpatient-claims-processor-i-moda-health-1132979
Administrative Coordinator US,Amgen,,coordinator,2026-06-06T17:03:53+00:00,https://remoteOK.com/remote-jobs/remote-administrative-coordinator-us-amgen-1132956
Coach Psicologo Online,Serenis,"Italia, ",,2026-06-06T16:01:54+00:00,https://remoteOK.com/remote-jobs/remote-coach-psicologo-online-serenis-1132955
Atención al cliente,Singularu,"Valencia/València, Valencia/València, Comunidad Valenciana / Comunitat Valenciana, España","salesforce, ecommerce",2026-06-06T13:22:24+00:00,https://remoteOK.com/remote-jobs/remote-atencion-al-cliente-singularu-1132966
Social Media Content Creator,FuseGlobal,"United States, ","finance, exec, design, hr, consulting, technical, customer support, travel, part time, digital nomad, coordinator, mobile, medical, content writing, social media",2026-06-06T13:10:57+00:00,https://remoteOK.com/remote-jobs/remote-social-media-content-creator-fuseglobal-1132948
Behavioral Health Care Coordinator Scheduler,Ennoble Care,"United States, ","finance, exec, design, hr, consulting, technical, customer support, travel, part time, digital nomad, coordinator, mobile, medical",2026-06-06T13:08:32+00:00,https://remoteOK.com/remote-jobs/remote-behavioral-health-care-coordinator-scheduler-ennoble-care-1132947
Chief Financial Officer,ThisWay Global,"United States, ","finance, exec",2026-06-06T13:02:55+00:00,https://remoteOK.com/remote-jobs/remote-chief-financial-officer-thisway-global-1132945
Operations staff,Blue Dart,"Guwahati, ",ops,2026-06-06T10:28:59+00:00,https://remoteOK.com/remote-jobs/remote-operations-staff-blue-dart-1132949
Chief Operating Officer,"Rose, Klein &amp; Marias","Sacramento, Sacramento, California, United States","salesforce, hr, sys admin, teaching, education, customer support, dev, marketing, exec, ops, travel, payroll, finance, c, senior, excel, legal, medical, full time, digital nomad",2026-06-06T07:51:58+00:00,https://remoteOK.com/remote-jobs/remote-chief-operating-officer-rose-klein-amp-marias-1132941
Don’t See a Perfect Role Apply Anyway,Reducto,"San Francisco, ","marketing, finance, content writing, medical, engineer",2026-06-06T01:57:26+00:00,https://remoteOK.com/remote-jobs/remote-dont-see-a-perfect-role-apply-anyway-reducto-1132975
FT PT Nanny,Jovie,"Los Gatos, ","marketing, finance, content writing, medical, engineer, react, teaching, education, customer support, math, exec, legal, sys admin, part time",2026-06-06T01:41:58+00:00,https://remoteOK.com/remote-jobs/remote-ft-pt-nanny-jovie-1132976
Trabaja Remoto con Horario fijo de L a S Con o sin Exp. Planilla Completa+Comisiones+Convenios,Netcall Group,"Lima, Lima, Perú",,2026-06-06T01:04:12+00:00,https://remoteOK.com/remote-jobs/remote-trabaja-remoto-con-horario-fijo-de-l-a-s-con-o-sin-exp-planilla-completa-comisiones-convenios-netcall-group-1133004
Sourcing Specialist,Theoria Medical,Remote,"sys admin, recruiter, medical, non tech",2026-06-06T00:01:13+00:00,https://remoteOK.com/remote-jobs/remote-sourcing-specialist-theoria-medical-1132920
Head of Banking Operations,DoorDash USA,Remote,"sys admin, customer support, finance, ruby, exec, senior, ops, medical",2026-06-06T00:01:01+00:00,https://remoteOK.com/remote-jobs/remote-head-of-banking-operations-doordash-usa-1132919
Territory Business Development Manager USMC,Shield AI,Remote,"product manager, exec, technical, customer support, dev, marketing, travel, senior, ops, bus dev, sales, golang, medical, engineer, full time, part time, digital nomad",2026-06-06T00:00:46+00:00,https://remoteOK.com/remote-jobs/remote-territory-business-development-manager-usmc-shield-ai-1132918
Customer Service Rep I,SanMar-Internal,Remote,"salesforce, sys admin, education, supervisor, exec, math",2026-06-06T00:00:39+00:00,https://remoteOK.com/remote-jobs/remote-customer-service-rep-i-sanmar-internal-1132917
Senior Director Global Delivery Services,Elite Technology,United Kingdom,"exec, saas, embedded, sys admin, customer support, marketing, finance, cloud, senior, ops, stats",2026-06-06T00:00:14+00:00,https://remoteOK.com/remote-jobs/remote-senior-director-global-delivery-services-elite-technology-1132916
Patient Intake Specialist,Aveanna Healthcare,"Atlanta, ","sys admin, education, customer support, accounting, medical, recruiter, non tech, hr, marketing, exec",2026-06-05T23:36:48+00:00,https://remoteOK.com/remote-jobs/remote-patient-intake-specialist-aveanna-healthcare-1132996
Chief Executive Officer,Magdalena Biosciences,"California, California, United States","sys admin, education, customer support, accounting, medical, recruiter, non tech, hr, marketing, exec, technical, ops, travel, adult, finance, senior, biotech",2026-06-05T23:36:27+00:00,https://remoteOK.com/remote-jobs/remote-chief-executive-officer-magdalena-biosciences-1132997
Vice President People,KIPP Foundation,"New York, ","coordinator, design, embedded, hr, sys admin, infosec, teaching, customer support, testing, marketing, exec, travel, education, finance, senior, ops, legal, medical, recruiter, full time, digital nomad",2026-06-05T22:29:38+00:00,https://remoteOK.com/remote-jobs/remote-vice-president-people-kipp-foundation-1132957
Associate Delivery Manager,Nymbus,"Jacksonville, Jacksonville, Florida, United States","exec, jira, saas, customer support, dev, marketing, travel, scrum, finance, video, cloud, ops, excel, golang, medical, digital nomad",2026-06-05T22:05:01+00:00,https://remoteOK.com/remote-jobs/remote-associate-delivery-manager-nymbus-1132993
Executive Assistant,AWISEE,"United States, ","virtual assistant, exec",2026-06-05T22:01:25+00:00,https://remoteOK.com/remote-jobs/remote-executive-assistant-awisee-1132902
Data Analyst,Stio®,"Denver, Denver, Colorado, United States","virtual assistant, exec, analyst, sys admin, python, full stack, technical, dev, testing, finance, cloud, git, microsoft, data science, ops, marketing, excel, stats, engineer, shopify, digital nomad",2026-06-05T20:36:46+00:00,https://remoteOK.com/remote-jobs/remote-data-analyst-stior-1132903
Builder Chief,Consultran,,dev,2026-06-05T20:03:15+00:00,https://remoteOK.com/remote-jobs/remote-builder-chief-consultran-1132898
Manager People Operations,KIPP Foundation,"New York, New York, United States","salesforce, hr, sys admin, teaching, education, customer support, dev, marketing, exec, ops, travel, payroll, finance, c, senior, excel, legal, medical, full time, digital nomad, infosec, coordinator, accounting, admin, stats",2026-06-05T20:00:17+00:00,https://remoteOK.com/remote-jobs/remote-manager-people-operations-kipp-foundation-1132942
Marketing Coordinator,Rocky Talkie,"Colorado, Colorado, United States","virtual assistant, exec, analyst, sys admin, python, full stack, technical, dev, testing, finance, cloud, git, microsoft, data science, ops, marketing, excel, stats, engineer, shopify, digital nomad, saas, golang, medical, design, amazon, coordinator, customer support, education, ads, content writing, sales, ecommerce",2026-06-05T19:59:34+00:00,https://remoteOK.com/remote-jobs/remote-marketing-coordinator-rocky-talkie-1132905
General Production,Dana Incorporated,"Mount Forest, ","education, content writing, non tech",2026-06-05T19:52:40+00:00,https://remoteOK.com/remote-jobs/remote-general-production-dana-incorporated-1132953
General Production,Dana Incorporated,"Mount Forest, ","education, content writing, non tech",2026-06-05T19:52:40+00:00,https://remoteOK.com/remote-jobs/remote-general-production-dana-incorporated-1132958
CAN_GENERAL PRODUCTION,Dana Incorporated,"Mount Forest, ","education, content writing, non tech, travel, finance, sys admin, medical, customer support",2026-06-05T19:52:40+00:00,https://remoteOK.com/remote-jobs/remote-can-general-production-dana-incorporated-1132961
Support Engineer,Level,,"customer support, technical",2026-06-05T18:33:48+00:00,https://remoteOK.com/remote-jobs/remote-support-engineer-level-1132895
Implementation Specialist,Dossier - Digital Competency Management,"Nashville, Nashville, Tennessee, United States","virtual assistant, exec, analyst, sys admin, python, full stack, technical, dev, testing, finance, cloud, git, microsoft, data science, ops, marketing, excel, stats, engineer, shopify, digital nomad, saas, golang, medical",2026-06-05T18:00:16+00:00,https://remoteOK.com/remote-jobs/remote-implementation-specialist-dossier-digital-competency-management-1132904
Site Labourer,Igne,"Hamilton, ",,2026-06-05T17:49:28+00:00,https://remoteOK.com/remote-jobs/remote-site-labourer-igne-1132952
Profesor A Ele — Enseñanza De Español Horario Flexible,Apprentus,"Córdoba, ","education, customer support, dev, sales, non tech, digital nomad",2026-06-05T17:41:42+00:00,https://remoteOK.com/remote-jobs/remote-profesor-a-ele-ensenanza-de-espanol-horario-flexible-apprentus-1132929
Buffer,"ESS – Defence, Energy and Government Services","Portsmouth, ","customer support, ops, golang, recruiter, full time, non tech",2026-06-05T17:30:51+00:00,https://remoteOK.com/remote-jobs/remote-buffer-ess-defence-energy-and-government-services-1132940
Sydney Trains Full Time and Part Time Train Cleaning Attendant Newcastle Region,Sydney Trains,"Newcastle, ","technical, customer support, ops, infosec, admin, full time, sys admin, education, recruiter, part time",2026-06-05T16:46:25+00:00,https://remoteOK.com/remote-jobs/remote-sydney-trains-full-time-and-part-time-train-cleaning-attendant-newcastle-region-sydney-trains-1132934
Freelance Designer,PowerLines,"Washington, Washington, District of Columbia, United States","exec, teaching, marketing, education, senior, excel, sales, golang, design, sys admin, designer, customer support, web dev, speech, finance, video, photoshop, illustrator, part time, digital nomad",2026-06-05T16:23:20+00:00,https://remoteOK.com/remote-jobs/remote-freelance-designer-powerlines-1132899
Executive Director K12 Academic Partnerships,Dreamscape Learn,"Chicago, Chicago, Illinois, United States","exec, teaching, marketing, education, senior, excel, sales, golang",2026-06-05T16:02:46+00:00,https://remoteOK.com/remote-jobs/remote-executive-director-k12-academic-partnerships-dreamscape-learn-1132896
Executive Director K12 Academic Partnerships,Dreamscape Learn,"Phoenix, Phoenix, Arizona, United States","exec, teaching, marketing, education, senior, excel, sales, golang",2026-06-05T16:02:43+00:00,https://remoteOK.com/remote-jobs/remote-executive-director-k12-academic-partnerships-dreamscape-learn-1132897
Customer Service Specialist,albo,"Ciudad de México, Ciudad de México, México","finance, excel, non tech",2026-06-05T15:06:15+00:00,https://remoteOK.com/remote-jobs/remote-customer-service-specialist-albo-1132881
Freelance Introducer,Bonkk.,"Romford, Romford, England, United Kingdom","education, customer support, dev, sales, non tech, digital nomad",2026-06-05T14:22:32+00:00,https://remoteOK.com/remote-jobs/remote-freelance-introducer-bonkk-1132923
Freelance Introducer,Bonkk.,"Luton, Luton, England, United Kingdom","education, customer support, dev, sales, non tech, digital nomad",2026-06-05T14:22:32+00:00,https://remoteOK.com/remote-jobs/remote-freelance-introducer-bonkk-1132926
Freelance Introducer,Bonkk.,"Edinburgh, Edinburgh, Scotland, United Kingdom","education, customer support, dev, sales, non tech, digital nomad",2026-06-05T14:22:32+00:00,https://remoteOK.com/remote-jobs/remote-freelance-introducer-bonkk-1132927
Freelance Introducer,Bonkk.,"Crawley, Crawley, England, United Kingdom","education, customer support, dev, sales, non tech, digital nomad",2026-06-05T14:22:32+00:00,https://remoteOK.com/remote-jobs/remote-freelance-introducer-bonkk-1132928
Freelance Introducer,Bonkk.,"Bristol, Bristol, England, United Kingdom","salesforce, ecommerce, education, customer support, dev, sales, non tech, digital nomad",2026-06-05T14:22:32+00:00,https://remoteOK.com/remote-jobs/remote-freelance-introducer-bonkk-1132968
Freelance Introducer,Bonkk.,"Southampton, Southampton, England, United Kingdom","salesforce, ecommerce, education, customer support, dev, sales, non tech, digital nomad",2026-06-05T14:22:32+00:00,https://remoteOK.com/remote-jobs/remote-freelance-introducer-bonkk-1132969
Freelance Introducer,Bonkk.,"Liverpool, Liverpool, England, United Kingdom","education, customer support, dev, sales, non tech, digital nomad",2026-06-05T14:22:32+00:00,https://remoteOK.com/remote-jobs/remote-freelance-introducer-bonkk-1133006
Freelance Introducer,Bonkk.,"Newcastle Upon Tyne, Newcastle Upon Tyne, England, United Kingdom","education, customer support, dev, sales, non tech, digital nomad",2026-06-05T14:22:32+00:00,https://remoteOK.com/remote-jobs/remote-freelance-introducer-bonkk-1133007
Freelance Introducer,Bonkk.,"London, London, England, United Kingdom","education, customer support, dev, sales, non tech, digital nomad",2026-06-05T14:21:45+00:00,https://remoteOK.com/remote-jobs/remote-freelance-introducer-bonkk-1132924
Freelance Introducer,Bonkk.,"Leeds, Leeds, England, United Kingdom","education, customer support, dev, sales, non tech, digital nomad",2026-06-05T14:21:45+00:00,https://remoteOK.com/remote-jobs/remote-freelance-introducer-bonkk-1132985
Freelance Introducer,Bonkk.,"Hounslow, Hounslow, England, United Kingdom","education, customer support, dev, sales, non tech, digital nomad",2026-06-05T14:21:12+00:00,https://remoteOK.com/remote-jobs/remote-freelance-introducer-bonkk-1132922
Freelance Introducer,Bonkk.,"Manchester, Manchester, England, United Kingdom","education, customer support, dev, sales, non tech, digital nomad",2026-06-05T14:21:12+00:00,https://remoteOK.com/remote-jobs/remote-freelance-introducer-bonkk-1132925
Freelance Introducer,Bonkk.,"Birmingham, Birmingham, England, United Kingdom","salesforce, ecommerce, education, customer support, dev, sales, non tech, digital nomad",2026-06-05T14:21:12+00:00,https://remoteOK.com/remote-jobs/remote-freelance-introducer-bonkk-1132967
Kitchen Steward,Accor,"Hamilton, ","education, customer support, virtual assistant, medical, exec",2026-06-05T13:37:11+00:00,https://remoteOK.com/remote-jobs/remote-kitchen-steward-accor-1132974
Coordinador de Relaciones Institucionales Educación Superior,EADIC,"Ciudad de México, Ciudad de México, México","finance, excel, non tech",2026-06-05T13:23:45+00:00,https://remoteOK.com/remote-jobs/remote-coordinador-de-relaciones-institucionales-educacion-superior-eadic-1132882
Handy Person,Hawaiian,"Cable Beach, ","technical, customer support, ops, infosec, admin, full time",2026-06-05T13:00:41+00:00,https://remoteOK.com/remote-jobs/remote-handy-person-hawaiian-1132933
TEAM MEMBER COLD END,Saint-Gobain Group in India,"Bhiwadi, ","infosec, education, customer support, marketing, exec, finance, ops, medical, engineer, testing, coordinator, sys admin, travel",2026-06-05T12:37:02+00:00,https://remoteOK.com/remote-jobs/remote-team-member-cold-end-saint-gobain-group-in-india-1132910
Team Member Special Assignment,Reliance Industries Limited,"Jamnagar, ","education, non tech",2026-06-05T10:53:33+00:00,https://remoteOK.com/remote-jobs/remote-team-member-special-assignment-reliance-industries-limited-1132936
Administrative Coordinator,UppalCorp,"دبي, دبي الإمارات العربية المتحدة","accounting, excel, medical, non tech, consulting, coordinator, customer support, dev, marketing, travel, finance, microsoft, exec, ops, full time, digital nomad",2026-06-05T09:50:39+00:00,https://remoteOK.com/remote-jobs/remote-administrative-coordinator-uppalcorp-1132901
Freelance UGC Creators Wanted,re:act,"London, London, England, United Kingdom","video, content writing, non tech",2026-06-05T08:38:34+00:00,https://remoteOK.com/remote-jobs/remote-freelance-ugc-creators-wanted-react-1132875
General Practitioner Telehealth Case Conferencing Clinic,Proactive Health,,"hr, sys admin, customer support, exec, medical, internship, full time",2026-06-05T08:00:09+00:00,https://remoteOK.com/remote-jobs/remote-general-practitioner-telehealth-case-conferencing-clinic-proactive-health-1132867
Vendedor Externo Ipojuca Vagas em Aberto,DTEL TELECOM,"Ipojuca, Ipojuca, Pernambuco, Brasil","excel, ecommerce, non tech, telecom",2026-06-05T07:51:58+00:00,https://remoteOK.com/remote-jobs/remote-vendedor-externo-ipojuca-vagas-em-aberto-dtel-telecom-1132992
Assistente de Logística Saquarema Rj Saquarema Quadro de Vagas,PARCEIRO SPOT,"Saquarema, Saquarema, Rio de Janeiro, Brasil","excel, ecommerce, non tech",2026-06-05T07:46:00+00:00,https://remoteOK.com/remote-jobs/remote-assistente-de-logistica-saquarema-rj-saquarema-quadro-de-vagas-parceiro-spot-1132991
Test,JAKSON Group,"Noida, ","infosec, education, customer support, marketing, exec, finance, ops, medical, engineer, testing",2026-06-05T06:24:17+00:00,https://remoteOK.com/remote-jobs/remote-test-jakson-group-1132907
Customer Support Advocate,Tithe.ly,"Remote, ","customer support, non tech",2026-06-05T06:08:20+00:00,https://remoteOK.com/remote-jobs/remote-customer-support-advocate-tithe-ly-1132863
Data Entry Specialist,Bendigo Advertiser,"Bar Beach, ","data entry, infosec, education, customer support, ops, excel, full time, part time",2026-06-05T05:53:10+00:00,https://remoteOK.com/remote-jobs/remote-data-entry-specialist-bendigo-advertiser-1132931
Data Entry Specialist — Entry Level,Bendigo Advertiser,"Bar Beach, ","data entry, infosec, education, customer support, ops, excel, full time, part time",2026-06-05T05:53:03+00:00,https://remoteOK.com/remote-jobs/remote-data-entry-specialist-entry-level-bendigo-advertiser-1132971
Admin Assistant Entry Level Flexible Hours,Bendigo Advertiser,"Bar Beach, ","data entry, infosec, education, customer support, ops, excel, full time, part time, virtual assistant, admin",2026-06-05T05:53:01+00:00,https://remoteOK.com/remote-jobs/remote-admin-assistant-entry-level-flexible-hours-bendigo-advertiser-1132972
Data Entry Specialist,Bendigo Advertiser,"Bar Beach, ","data entry, education, non tech",2026-06-05T05:52:57+00:00,https://remoteOK.com/remote-jobs/remote-data-entry-specialist-bendigo-advertiser-1132876
Onboarding Specialist,ezCater,"United States, ","customer support, exec, hr, design, defi, crypto, bitcoin, marketing, finance, ruby, api, mobile, senior, stats, digital nomad, virtual assistant, testing, travel, speech, c, microsoft, ops, excel, recruiter, sales, medical",2026-06-05T05:06:32+00:00,https://remoteOK.com/remote-jobs/remote-onboarding-specialist-ezcater-1132855
Customer Success Manager,Gifted,"United States, ","customer support, exec, hr",2026-06-05T05:03:11+00:00,https://remoteOK.com/remote-jobs/remote-customer-success-manager-gifted-1132851
Data Entry Specialist Assistant Administrator,RecruitLytic Hires,"المدينة, المدينة المدينة السعودية","hr, data entry, exec, mobile, content writing, part time, customer support, sys admin, education, technical, marketing, ops, sales, analyst, game dev, golang, virtual assistant, admin, microsoft, excel",2026-06-05T04:58:50+00:00,https://remoteOK.com/remote-jobs/remote-data-entry-specialist-assistant-administrator-recruitlytic-hires-1132888
File Clerk,RecruitLytic Hires,"أبو ظبي, أبو ظبي أبو ظبي الإمارات العربية المتحدة","hr, data entry, exec, mobile, content writing, part time, customer support, sys admin, education, technical, marketing, ops, sales, analyst, game dev, golang, virtual assistant, admin, microsoft, excel, video, dev, accounting, finance, digital nomad, jira, cloud, legal, recruiter",2026-06-05T04:55:53+00:00,https://remoteOK.com/remote-jobs/remote-file-clerk-recruitlytic-hires-1132892
Customer Support,RecruitLytic Hires,"أبو ظبي, أبو ظبي أبو ظبي الإمارات العربية المتحدة","hr, data entry, exec, mobile, content writing, part time, customer support, sys admin, education, technical, marketing",2026-06-05T04:54:12+00:00,https://remoteOK.com/remote-jobs/remote-customer-support-recruitlytic-hires-1132885
Freelance Video Editor,Forbes Advisor,"London, London, England, United Kingdom","education, customer support, dev, sales, non tech, digital nomad, hr, testing, travel, video, finance, seo, exec, content writing, marketing, medical, recruiter",2026-06-05T04:51:06+00:00,https://remoteOK.com/remote-jobs/remote-freelance-video-editor-forbes-advisor-1132930
Entry Level Administrative Assistant,RecruitLytic Hires,"المدينة, المدينة المدينة السعودية","hr, data entry, exec, mobile, content writing, part time, customer support, sys admin, education, technical, marketing, ops, sales, analyst, game dev, golang, virtual assistant, admin, microsoft, excel, video",2026-06-05T04:29:28+00:00,https://remoteOK.com/remote-jobs/remote-entry-level-administrative-assistant-recruitlytic-hires-1132889
Forecast Analyst,REI,"Seattle, Seattle, Washington, United States","customer support, exec, hr, design, defi, crypto, bitcoin, marketing, finance, ruby, api, mobile, senior, stats, digital nomad, virtual assistant, testing, travel, speech, c, microsoft, ops, excel, recruiter, sales, medical, sys admin, education, adult, content writing, internship, technical, dev, video, coordinator, web3, ethereum, legal, golang, analyst, math",2026-06-05T04:22:17+00:00,https://remoteOK.com/remote-jobs/remote-forecast-analyst-rei-1132861
Associate,Buyers Blueprint,"Greater Adelaide Area, ",ops,2026-06-05T04:01:17+00:00,https://remoteOK.com/remote-jobs/remote-associate-buyers-blueprint-1132872
Care Coordinator,SonderMind,"Dallas, Dallas, Texas, United States","customer support, exec, hr, design, defi, crypto, bitcoin, marketing, finance, ruby, api, mobile, senior, stats, digital nomad, virtual assistant, testing, travel, speech, c, microsoft, ops, excel, recruiter, sales, medical, sys admin, education, adult, content writing, internship, technical, dev, video, coordinator",2026-06-05T02:00:11+00:00,https://remoteOK.com/remote-jobs/remote-care-coordinator-sondermind-1132858
Docentes de licenciatura online UANE,Lottus Education,"Saltillo, Saltillo, Coahuila de Zaragoza, México","education, c, non tech",2026-06-05T01:04:07+00:00,https://remoteOK.com/remote-jobs/remote-docentes-de-licenciatura-online-uane-lottus-education-1132865
Architectural Drafter,Archinect,"Saratoga Springs, ","finance, exec, design, hr, consulting, technical, customer support, travel, part time, digital nomad",2026-06-05T00:00:00+00:00,https://remoteOK.com/remote-jobs/remote-architectural-drafter-archinect-1132946
Data Entry,Ryz Labs,"Arkansas, Arkansas, United States","customer support, non tech, data entry, virtual assistant, exec, ops",2026-06-04T23:39:50+00:00,https://remoteOK.com/remote-jobs/remote-data-entry-ryz-labs-1132864
Learning &amp; Development Specialist,Nestlé Health Science,"Brooklyn, ","customer support, exec, hr, design, defi, crypto, bitcoin, marketing, finance, ruby, api, mobile, senior, stats, digital nomad, virtual assistant, testing, travel, speech, c, microsoft, ops, excel, recruiter, sales, medical, sys admin, education, adult, content writing, internship",2026-06-04T23:29:01+00:00,https://remoteOK.com/remote-jobs/remote-learning-amp-development-specialist-nestle-health-science-1132856
Influencer Marketing Coordinator,Newhouse,"Ciudad de México, Ciudad de México, México","coordinator, dev, finance, exec, content writing, marketing, education, digital nomad",2026-06-04T23:09:46+00:00,https://remoteOK.com/remote-jobs/remote-influencer-marketing-coordinator-newhouse-1132840
