Job Title,Company,Location,Tags,Date,Apply Link
Online Bidder,Digitex Technologies,"Greater Kolkata Area, ","hr, web dev, mobile, marketing, non tech",2026-07-07T07:38:19+00:00,https://remoteOK.com/remote-jobs/remote-online-bidder-digitex-technologies-1134567
Designer,Archisearch,"Athens, ","marketing, linguistics, education, content writing, non tech, video, illustrator, finance, c, designer",2026-07-07T07:10:44+00:00,https://remoteOK.com/remote-jobs/remote-designer-archisearch-1134565
Paid Media Specialist Meta & Google Ads,Noventra Group,,"Marketing, Paid Media, Meta Ads, Facebook Ads, Google Ads, PPC, Performance Marketing, Ecommerce, SEM, Google Analytics, Google Tag Manager, Meta Pixel, Shopify",2026-07-07T05:08:56+00:00,https://remoteOK.com/remote-jobs/remote-paid-media-specialist-meta-google-ads-noventra-group-1134552
Custodian,Hospitality Newfoundland and Labrador,"St John’s, ","customer support, c, exec, full time",2026-07-07T04:29:41+00:00,https://remoteOK.com/remote-jobs/remote-custodian-hospitality-newfoundland-and-labrador-1134554
Lifeguard,Accor,"Bardez, ","education, customer support, exec",2026-07-07T01:38:08+00:00,https://remoteOK.com/remote-jobs/remote-lifeguard-accor-1134547
Docente Tiempo Parcial Derecho Tributario Remoto,Universidad Privada del Norte,"Santiago de Surco, Santiago de Surco, Perú","excel, non tech, marketing, social media",2026-07-07T01:06:47+00:00,https://remoteOK.com/remote-jobs/remote-docente-tiempo-parcial-derecho-tributario-remoto-universidad-privada-del-norte-1134616
Docente Tiempo Parcial Derecho Penal Remoto,Universidad Privada del Norte,"Santiago de Surco, Santiago de Surco, Perú","excel, non tech, marketing, social media",2026-07-07T01:05:42+00:00,https://remoteOK.com/remote-jobs/remote-docente-tiempo-parcial-derecho-penal-remoto-universidad-privada-del-norte-1134614
Dutch Speaking Customer Service Agent For Imperial Work from Home Greece,Mercier Consultancy,,"consulting, work from home, customer support, c, medical, full time, non tech",2026-07-07T00:00:08+00:00,https://remoteOK.com/remote-jobs/remote-dutch-speaking-customer-service-agent-for-imperial-work-from-home-greece-mercier-consultancy-1134545
eLearning Developer,The Learning Network,"London, London, Ontario, Canada","writer, customer support, exec, finance, microsoft, content writing, excel, golang, medical, virtual assistant, education, marketing, video, ops, travel, data entry, jira, hr, cloud, admin, legal, sys admin, dev, design, technical, testing, adult, photoshop, illustrator, digital nomad",2026-07-07T00:00:00+00:00,https://remoteOK.com/remote-jobs/remote-elearning-developer-the-learning-network-1134666
Multi Trader,B&amp;R HOME,"London, ","recruiter, non tech",2026-07-06T23:13:15+00:00,https://remoteOK.com/remote-jobs/remote-multi-trader-bampr-home-1134574
Testing Testing Test,Gold Standard,"Gold Coast, ","testing, finance, exec, part time",2026-07-06T22:58:27+00:00,https://remoteOK.com/remote-jobs/remote-testing-testing-test-gold-standard-1134544
Tutor Virtual Matemáticas,Universidad del Valle de Guatemala,"Guatemala, ","dev, digital nomad, teaching",2026-07-06T22:29:30+00:00,https://remoteOK.com/remote-jobs/remote-tutor-virtual-matematicas-universidad-del-valle-de-guatemala-1134593
Customer Success Manager,CWILL,"Toronto, Toronto, Ontario, Canada","customer support, exec, saas, dev, content writing, marketing, excel, legal, medical, ecommerce, shopify, full time, digital nomad",2026-07-06T22:18:49+00:00,https://remoteOK.com/remote-jobs/remote-customer-success-manager-cwill-1134684
Operations Supervisor Healthcare South Georgia,Belle,"Fairburn, Fairburn, Georgia, United States","hr, education, supervisor, customer support, marketing, travel, exec, ops, medical, recruiter",2026-07-06T20:44:27+00:00,https://remoteOK.com/remote-jobs/remote-operations-supervisor-healthcare-south-georgia-belle-1134553
Construction Inspector,AECOM,"Christ Church, ","design, education, consulting, technical, customer support, testing, marketing, travel, finance, exec, medical, engineer, recruiter, digital nomad",2026-07-06T20:15:34+00:00,https://remoteOK.com/remote-jobs/remote-construction-inspector-aecom-1134555
Attaché Juridique F H,AFE (Audit Finance Expert),"Castelnau-le-lez, ","marketing, linguistics, education, content writing, non tech, video, illustrator, finance, c",2026-07-06T19:33:59+00:00,https://remoteOK.com/remote-jobs/remote-attache-juridique-f-h-afe-audit-finance-expert-1134564
Operator Red days,Princes Group,"Wisbech, ",ops,2026-07-06T16:39:21+00:00,https://remoteOK.com/remote-jobs/remote-operator-red-days-princes-group-1134538
Skilled Operator blue shift days,Princes Group,"Wisbech, ","recruiter, non tech, ops",2026-07-06T16:39:21+00:00,https://remoteOK.com/remote-jobs/remote-skilled-operator-blue-shift-days-princes-group-1134575
