Job Title,Company,Location,Tags,Date,Apply Link
Sales Development Representative,UpGuard,,"saas, security, support, software, management, marketing, sales",2026-04-08T00:00:28+00:00,https://remoteOK.com/remote-jobs/remote-sales-development-representative-upguard-1131026
Alumni Relationship Manager Casablanca,ALX Africa,Casablanca,"manager, students, training, software",2026-04-08T00:00:21+00:00,https://remoteOK.com/remote-jobs/remote-alumni-relationship-manager-casablanca-alx-africa-1131025
Benefits Manager,"Instructure, Inc.",,"manager, system, support, testing, education, strategy, lead, senior, operations, excel, legal, go, health, full-time",2026-04-08T00:00:11+00:00,https://remoteOK.com/remote-jobs/remote-benefits-manager-instructure-inc-1131024
Staff Software Engineer CRM LATAM,Luxury Presence,Latin America,"software, design, saas, system, founder, ceo, technical, growth, code, web, c, seo, leader, lead, senior, marketing, engineer, engineering, executive, digital nomad",2026-04-08T00:00:04+00:00,https://remoteOK.com/remote-jobs/remote-staff-software-engineer-crm-latam-luxury-presence-1131023
Payroll Operations and Systems Manager,Arbor Education,,"manager, payroll, design, system, security, technical, support, software, financial, education, strategy, management, lead, operations, operational, sales, reliability, digital nomad",2026-04-07T16:00:12+00:00,https://remoteOK.com/remote-jobs/remote-payroll-operations-and-systems-manager-arbor-education-1131021
User Acquisition Specialist,Hyperlab,,"game, gaming, technical, growth, mobile, management, marketing, health, recruitment",2026-04-07T16:00:04+00:00,https://remoteOK.com/remote-jobs/remote-user-acquisition-specialist-hyperlab-1131020
Senior front end developer,Expatfile.tax,,front end,2026-04-07T15:52:16+00:00,https://remoteOK.com/remote-jobs/remote-senior-front-end-developer-expatfile-tax-1131019
Crypto Trader,Fox GLobal Assets,,"other, crypto, finance, education, blockchain, defi, web3, part time, ops, junior, legal, stats",2026-04-07T07:17:02+00:00,https://remoteOK.com/remote-jobs/remote-crypto-trader-fox-global-assets-1131018
Product Manager Data Management &amp; Platform,HHAeXchange,United States,"manager, training, technical, supervisor, support, financial, management, operations, analytics, health, healthcare, engineering",2026-04-07T00:01:19+00:00,https://remoteOK.com/remote-jobs/remote-product-manager-data-management-amp-platform-hhaexchange-1131017
Client Support Specialist,TrueML,Remote in USA,"support, software, financial, microsoft, operational",2026-04-07T00:01:12+00:00,https://remoteOK.com/remote-jobs/remote-client-support-specialist-trueml-1131016
English Contract Attorney,"Contact Government Services, LLC",,"support, analyst, legal, non tech",2026-04-07T00:00:54+00:00,https://remoteOK.com/remote-jobs/remote-english-contract-attorney-contact-government-services-llc-1131014
Sales Development Representative,Pushpay,,sales,2026-04-07T00:00:38+00:00,https://remoteOK.com/remote-jobs/remote-sales-development-representative-pushpay-1131013
Fraud Waste and Abuse Data Analyst,HHAeXchange,United States,"analyst, design, embedded, technical, supervisor, support, coder, operations, operational, analytics, health, healthcare, engineering, digital nomad",2026-04-07T00:00:27+00:00,https://remoteOK.com/remote-jobs/remote-fraud-waste-and-abuse-data-analyst-hhaexchange-1131012
Regional Manager,Clearway Energy,,"manager, support, management, senior, operational, reliability",2026-04-07T00:00:19+00:00,https://remoteOK.com/remote-jobs/remote-regional-manager-clearway-energy-1131011
RevOps AI Analyst Intern,Actian Corporation,US-Remote,"analyst, design, salesforce, technical, support, testing, travel, strategy, management, lead, junior, operations, analytics, sales, reliability, executive, internship, digital nomad",2026-04-06T00:00:10+00:00,https://remoteOK.com/remote-jobs/remote-revops-ai-analyst-intern-actian-corporation-1130997
Associate Forward Deployed Engineer,Symmetry Systems,Remote,"saas, security, training, technical, code, cloud, management, lead, operations, operational, excel, sales, go, engineer, executive",2026-04-05T00:00:05+00:00,https://remoteOK.com/remote-jobs/remote-associate-forward-deployed-engineer-symmetry-systems-1130994
Senior Site Civil Engineer Land Development,"ms consultants, inc.",,"design, 3d, consulting, support, software, management, senior, health, engineer, engineering, full-time, digital nomad",2026-04-04T16:00:06+00:00,https://remoteOK.com/remote-jobs/remote-senior-site-civil-engineer-land-development-ms-consultants-inc-1130993
Senior UX UI designer,GoMining,,"ui, ux, design, designer, support, developer, web, mobile, senior, marketing, digital nomad",2026-04-03T16:00:12+00:00,https://remoteOK.com/remote-jobs/remote-senior-ux-ui-designer-gomining-1130992
Legal Counsel AI Trainer Freelance 8 20 hrs week,10x Team,Bucharest,"trainer, consulting, test, legal, non tech",2026-04-03T16:00:04+00:00,https://remoteOK.com/remote-jobs/remote-legal-counsel-ai-trainer-freelance-8-20-hrs-week-10x-team-1130991
Senior Sales Development Representative,Huzzle,,"saas, system, support, testing, lead, senior, sales, engineering, full-time",2026-04-03T00:00:03+00:00,https://remoteOK.com/remote-jobs/remote-senior-sales-development-representative-huzzle-1130989
Website Maintenance,CrewBloom,,"system, technical, support, seo, recruiting",2026-04-02T16:01:26+00:00,https://remoteOK.com/remote-jobs/remote-website-maintenance-crewbloom-1130987
Lead Consultant Public Sector,Celonis,Washington DC,"consultant, saas, consulting, technical, support, leader, lead",2026-04-02T16:01:20+00:00,https://remoteOK.com/remote-jobs/remote-lead-consultant-public-sector-celonis-1130986
Product Manager Energy Storage Controls & Telemetry,Verse,"San Francisco, CA","manager, software, travel, cloud, operations, operational",2026-04-02T16:01:10+00:00,https://remoteOK.com/remote-jobs/remote-product-manager-energy-storage-controls-telemetry-verse-1130985
Sales Development Representative,Huzzle,,"salesforce, training, growth, lead, marketing, sales",2026-04-02T16:00:55+00:00,https://remoteOK.com/remote-jobs/remote-sales-development-representative-huzzle-1130984
Senior Strategist Future of Work & AI Readiness,American Institutes for Research,,"design, system, strategist, support, senior, digital nomad",2026-04-02T16:00:39+00:00,https://remoteOK.com/remote-jobs/remote-senior-strategist-future-of-work-ai-readiness-american-institutes-for-research-1130983
Customs Compliance Consultant,Reachdesk Ltd,London,"consultant, saas, hr, support",2026-04-02T16:00:29+00:00,https://remoteOK.com/remote-jobs/remote-customs-compliance-consultant-reachdesk-ltd-1130982
Senior Backend Engineer HyperDX,ClickHouse,United States,"developer, cloud, senior, engineer, backend, digital nomad",2026-04-02T16:00:18+00:00,https://remoteOK.com/remote-jobs/remote-senior-backend-engineer-hyperdx-clickhouse-1130981
Strategic Core Account Executive CPG Databricks,Databricks,Ohio,executive,2026-04-02T16:00:06+00:00,https://remoteOK.com/remote-jobs/remote-strategic-core-account-executive-cpg-databricks-databricks-1130980
Intermediate Full Stack Engineer,Runn,,"technical, engineer, dev, full time, saas, web dev, front end",2026-04-02T08:36:10+00:00,https://remoteOK.com/remote-jobs/remote-intermediate-full-stack-engineer-runn-1130979
Senior Full Stack Engineer,Runn,,"technical, engineer, senior, dev, full time, saas, web dev, front end",2026-04-02T08:23:38+00:00,https://remoteOK.com/remote-jobs/remote-senior-full-stack-engineer-runn-1130978
Banner Consultant Student Accounts Receivable,Strata Information Group,Remote,"consultant, embedded, technical, leader, operational",2026-04-02T00:01:17+00:00,https://remoteOK.com/remote-jobs/remote-banner-consultant-student-accounts-receivable-strata-information-group-1130974
Accounting Intern,SpecterOps,,"accounting, students, internship",2026-04-02T00:00:55+00:00,https://remoteOK.com/remote-jobs/remote-accounting-intern-specterops-1130972
Senior Engagement Manager,Medallion,Remote,"manager, salesforce, management, senior, operations, healthcare",2026-04-02T00:00:46+00:00,https://remoteOK.com/remote-jobs/remote-senior-engagement-manager-medallion-1130971
Forward deployed Engineer LatAm,Clara,Latin America,"technical, support, software, travel, financial, operations, operational, engineer, engineering",2026-04-02T00:00:35+00:00,https://remoteOK.com/remote-jobs/remote-forward-deployed-engineer-latam-clara-1130970
Internship Marketing Summer 2026,Concentric,Seattle,"embedded, security, training, consultancy, management, marketing, executive, internship, non tech",2026-04-02T00:00:13+00:00,https://remoteOK.com/remote-jobs/remote-internship-marketing-summer-2026-concentric-1130969
Senior Software Engineer,Sysdig,Bangalore,"software, design, security, support, testing, code, cloud, lead, senior, operational, go, health, engineer, engineering, backend, digital nomad",2026-04-01T16:00:22+00:00,https://remoteOK.com/remote-jobs/remote-senior-software-engineer-sysdig-1130967
Lithuanian Localization QA Tester Proofreader,Welo Global,,"tester, training, technical, testing, test, qa, mobile, content",2026-04-01T16:00:13+00:00,https://remoteOK.com/remote-jobs/remote-lithuanian-localization-qa-tester-proofreader-welo-global-1130966
Call Centre Manager,Huzzle,,"manager, technical, support, qa, microsoft, management, lead, operations, operational, excel, sales, full-time",2026-04-01T16:00:03+00:00,https://remoteOK.com/remote-jobs/remote-call-centre-manager-huzzle-1130965
Junior Crypto Analyst & Trader,WhiteBridge-Ltd,,"finance, crypto, education, junior, analyst, web3, blockchain, defi, ethereum, bitcoin, other, virtual assistant, exec",2026-04-01T14:24:13+00:00,https://remoteOK.com/remote-jobs/remote-junior-crypto-analyst-trader-whitebridge-ltd-1130961
Trading Technology Engineer,BitMEX,Asia,"crypto, cryptocurrency, security, engineer",2026-04-01T08:00:44+00:00,https://remoteOK.com/remote-jobs/remote-trading-technology-engineer-bitmex-1130960
Manager Deal Desk &amp; Order Management,Doxel,Remote,"manager, design, system, support, software, growth, accounting, financial, finance, management, operational, legal, sales, health, executive, digital nomad",2026-04-01T08:00:34+00:00,https://remoteOK.com/remote-jobs/remote-manager-deal-desk-amp-order-management-doxel-1130959
Associate Payroll & Billing Specialist,G-P,India,"payroll, growth, management",2026-04-01T08:00:24+00:00,https://remoteOK.com/remote-jobs/remote-associate-payroll-billing-specialist-g-p-1130958
Senior Software Engineer,PlayOn,,"software, senior, engineer",2026-04-01T08:00:14+00:00,https://remoteOK.com/remote-jobs/remote-senior-software-engineer-playon-1130957
Payments &amp; Billing Operations Analyst,Automatiq,Remote,"analyst, salesforce, system, training, technical, support, software, growth, manager, finance, management, operations, operational",2026-04-01T08:00:06+00:00,https://remoteOK.com/remote-jobs/remote-payments-amp-billing-operations-analyst-automatiq-1130956
Software Engineer,Prove,Dublin,"software, security, engineer",2026-04-01T00:01:22+00:00,https://remoteOK.com/remote-jobs/remote-software-engineer-prove-1130955
Sales Operations Project Manager,Xsolla,,"manager, design, training, game, gaming, support, financial, video, fintech, management, operations, operational, sales, educational, executive, digital nomad",2026-04-01T00:01:09+00:00,https://remoteOK.com/remote-jobs/remote-sales-operations-project-manager-xsolla-1130954
Biology AI Training Expert,Anyone AI,Amsterdam ,"training, python, technical, biology",2026-04-01T00:01:02+00:00,https://remoteOK.com/remote-jobs/remote-biology-ai-training-expert-anyone-ai-1130953
Data Analyst,World Golf Tour (WGT),San Francisco,"analyst, security, python, game, technical, support, software, leader, excel, analytics",2026-04-01T00:00:56+00:00,https://remoteOK.com/remote-jobs/remote-data-analyst-world-golf-tour-wgt-1130952
Manager Site Contracts Management,Precision Medicine Group,Serbia,"manager, support, finance, management, non tech",2026-04-01T00:00:50+00:00,https://remoteOK.com/remote-jobs/remote-manager-site-contracts-management-precision-medicine-group-1130951
Bilingual Customer Success Manager,Acuity Insights,,"manager, saas, salesforce, embedded, recruiter, support, test, growth, travel, video, education, leader, go, health, engineering",2026-04-01T00:00:41+00:00,https://remoteOK.com/remote-jobs/remote-bilingual-customer-success-manager-acuity-insights-1130950
People Operations Manager,CharterUP,"Austin, TX","manager, system, growth, operations",2026-04-01T00:00:34+00:00,https://remoteOK.com/remote-jobs/remote-people-operations-manager-charterup-1130949
Director of Product Marketing,Medallion,,"director, salesforce, strategy, lead, operations, marketing, healthcare, non tech",2026-04-01T00:00:25+00:00,https://remoteOK.com/remote-jobs/remote-director-of-product-marketing-medallion-1130948
Operations Project Manager,Xsolla,,"manager, training, game, gaming, support, financial, video, fintech, management, operations, operational, educational, non tech",2026-04-01T00:00:15+00:00,https://remoteOK.com/remote-jobs/remote-operations-project-manager-xsolla-1130947
WordPress Developer,Data Group,,dev,2026-03-31T23:34:15+00:00,https://remoteOK.com/remote-jobs/remote-wordpress-developer-data-group-1130946
Sales Development Representative,RTB House,Germany,"leader, strategy, sales",2026-03-31T16:00:41+00:00,https://remoteOK.com/remote-jobs/remote-sales-development-representative-rtb-house-1130945
Account Executive Enterprise,Glia,,"saas, growth, voice, financial, leader, strategy, sales, executive",2026-03-31T16:00:30+00:00,https://remoteOK.com/remote-jobs/remote-account-executive-enterprise-glia-1130944
Platform Administrator,SharkNinja,,"design, amazon, system, support, growth, devops, cloud, administrator, digital nomad",2026-03-31T16:00:24+00:00,https://remoteOK.com/remote-jobs/remote-platform-administrator-sharkninja-1130943
Full Cycle Recruiter Sourcing Specialist,Huzzle,,"technical, recruiter, management, recruitment",2026-03-31T16:00:13+00:00,https://remoteOK.com/remote-jobs/remote-full-cycle-recruiter-sourcing-specialist-huzzle-1130942
Project Coordinator Pharmacy Benefit Management Procurements,Pharmaceutical Strategies Group LLC,,"coordinator, support, growth, manager, microsoft, management",2026-03-31T16:00:07+00:00,https://remoteOK.com/remote-jobs/remote-project-coordinator-pharmacy-benefit-management-procurements-pharmaceutical-strategies-group-llc-1130941
Senior Associate Finance,Pearl,India,"support, testing, accounting, financial, finance, bank, senior, excel, executive, non tech",2026-03-31T08:00:32+00:00,https://remoteOK.com/remote-jobs/remote-senior-associate-finance-pearl-1130940
Program Manager Major Deployments,Skydio,,"manager, design, technical, support, software, travel, financial, leader, management, lead, senior, operational, analytics, health, engineering, full-time, digital nomad",2026-03-31T08:00:22+00:00,https://remoteOK.com/remote-jobs/remote-program-manager-major-deployments-skydio-1130939
Senior Manager of Revenue Cycle Management,AnswersNow Inc,,"manager, financial, finance, management, lead, senior, operations, operational, healthcare, executive, non tech",2026-03-31T08:00:11+00:00,https://remoteOK.com/remote-jobs/remote-senior-manager-of-revenue-cycle-management-answersnow-inc-1130938
Principal Technologist Office of the CTO,Clover Health,USA,"cto, ceo, technical, voice, operations, operational, medical",2026-03-31T08:00:05+00:00,https://remoteOK.com/remote-jobs/remote-principal-technologist-office-of-the-cto-clover-health-1130937
Account Director,MERGE,Remote,"director, leader, management, lead, senior, marketing, health, healthcare, non tech",2026-03-31T00:00:51+00:00,https://remoteOK.com/remote-jobs/remote-account-director-merge-1130936
Customer Program Manager,Nexxa.AI,Sunnyvale,"manager, jira, training, consulting, cto, technical, qa, management, operations, operational, engineering",2026-03-31T00:00:41+00:00,https://remoteOK.com/remote-jobs/remote-customer-program-manager-nexxa-ai-1130935
Data Scientist Claim Experience Analytics,Extend,"Remote, US","operational, analytics, engineering",2026-03-31T00:00:35+00:00,https://remoteOK.com/remote-jobs/remote-data-scientist-claim-experience-analytics-extend-1130934
Senior Software Engineer Full Stack,Grow Therapy,"New York, NY","software, system, technical, senior, healthcare, engineer, engineering",2026-03-31T00:00:24+00:00,https://remoteOK.com/remote-jobs/remote-senior-software-engineer-full-stack-grow-therapy-1130933
Software Engineer,Clover Health,USA,"software, design, financial, cloud, management, operational, medical, health, healthcare, engineer, digital nomad",2026-03-31T00:00:15+00:00,https://remoteOK.com/remote-jobs/remote-software-engineer-clover-health-1130932
Sales Executive Telecoms & Networking,WebProps.org,,"sales, executive",2026-03-29T16:00:09+00:00,https://remoteOK.com/remote-jobs/remote-sales-executive-telecoms-networking-webprops-org-1130931
Biomedical Clinical Engineer Senior,Ibility,Washington DC,"design, system, security, technical, management, senior, health, healthcare, engineer, engineering, digital nomad",2026-03-29T08:00:15+00:00,https://remoteOK.com/remote-jobs/remote-biomedical-clinical-engineer-senior-ibility-1130930
Clinical Psychologist,LifeStance Health,"Crofton, MD","adult, lead, medical, health, healthcare, non tech",2026-03-28T16:01:20+00:00,https://remoteOK.com/remote-jobs/remote-clinical-psychologist-lifestance-health-1130929
Head of Finance North America,Adyen,San Francisco,"technical, support, growth, financial, finance, microsoft, lead, senior",2026-03-28T16:01:13+00:00,https://remoteOK.com/remote-jobs/remote-head-of-finance-north-america-adyen-1130928
Manager of Revenue Operations,LatamCent,,"manager, design, technical, support, growth, management, lead, operations, operational, marketing, sales, digital nomad",2026-03-28T16:00:59+00:00,https://remoteOK.com/remote-jobs/remote-manager-of-revenue-operations-latamcent-1130927
Product Security Manager,MoonPay,United States (East Coast Time Zone) - Remote,"security, manager, design, web3, crypto, system, training, technical, support, software, testing, code, voice, financial, serverless, cloud, leader, management, lead, operations, healthcare, engineering, digital nomad",2026-03-28T16:00:52+00:00,https://remoteOK.com/remote-jobs/remote-product-security-manager-moonpay-1130926
Applied Computational Nutrition Scientist,WISEcode,United States,"system, support, test, code, math, lead",2026-03-28T16:00:39+00:00,https://remoteOK.com/remote-jobs/remote-applied-computational-nutrition-scientist-wisecode-1130925
Staff Machine Learning Engineer,Fullscript,,"design, system, python, technical, support, code, senior, go, health, healthcare, engineer, engineering, backend, digital nomad",2026-03-28T16:00:32+00:00,https://remoteOK.com/remote-jobs/remote-staff-machine-learning-engineer-fullscript-1130924
Cloud Security Engineer,MoonPay,,"security, crypto, system, swift, training, technical, support, code, voice, financial, cloud, management, lead, healthcare, engineer, engineering",2026-03-28T16:00:25+00:00,https://remoteOK.com/remote-jobs/remote-cloud-security-engineer-moonpay-1130923
Senior Security Engineer Automation,MoonPay,,"security, crypto, system, swift, training, technical, support, software, voice, financial, cloud, api, strategy, management, senior, operational, excel, healthcare, engineer, engineering, backend",2026-03-28T16:00:06+00:00,https://remoteOK.com/remote-jobs/remote-senior-security-engineer-automation-moonpay-1130921
Clinician Experience Specialist,Nabla,New York City,"support, software, travel, assistant, financial, video, senior, operations, excel, health, healthcare, engineering, recruitment, educational",2026-03-28T00:00:33+00:00,https://remoteOK.com/remote-jobs/remote-clinician-experience-specialist-nabla-1130917
Content &amp; Training Manager,Fi,"New York, NY","training, manager, support, education, management, content, senior, full-time, non tech",2026-03-28T00:00:26+00:00,https://remoteOK.com/remote-jobs/remote-content-amp-training-manager-fi-1130916
Staff Software Engineer Platform,SmithRx,,"software, design, system, test, management, healthcare, engineer, engineering, digital nomad",2026-03-28T00:00:19+00:00,https://remoteOK.com/remote-jobs/remote-staff-software-engineer-platform-smithrx-1130915
Senior Staff Data Engineer,SmithRx,Remote,"system, management, senior, analytics, healthcare, engineer, engineering",2026-03-28T00:00:09+00:00,https://remoteOK.com/remote-jobs/remote-senior-staff-data-engineer-smithrx-1130914
AI Data Specialist,micro1,,"senior, marketing, saas, finance, legal, medical, other, stats, exec",2026-03-27T20:24:05+00:00,https://remoteOK.com/remote-jobs/remote-ai-data-specialist-micro1-1130913
Engenharia Software Engineer III Golang Elixir,Stone,Remoto,"software, golang, engineer",2026-03-27T16:01:21+00:00,https://remoteOK.com/remote-jobs/remote-engenharia-software-engineer-iii-golang-elixir-stone-1130912
Salesforce Technical Consultant,Hunt St,,"salesforce, consultant, jira, system, technical, support, developer, web, financial, administrator, management, legal, digital nomad",2026-03-27T16:01:10+00:00,https://remoteOK.com/remote-jobs/remote-salesforce-technical-consultant-hunt-st-1130911
Nurse Practitioner Weekdays 9 00am 6 00pm PST Telehealth Primary Care,Curai,Remote,"video, education, health, healthcare, non tech",2026-03-27T16:01:03+00:00,https://remoteOK.com/remote-jobs/remote-nurse-practitioner-weekdays-9-00am-6-00pm-pst-telehealth-primary-care-curai-1130910
Senior Software Engineer C++ Windows SDK WIN32 API,Ivanti,Hyderabad,"software, design, saas, security, technical, support, c++, cloud, api, microsoft, management, lead, senior, reliability, engineer, engineering, digital nomad",2026-03-27T16:00:54+00:00,https://remoteOK.com/remote-jobs/remote-senior-software-engineer-c-windows-sdk-win32-api-ivanti-1130909
Senior Backend Engineer Integrations,Arbiter AI,New York City,"design, system, python, technical, support, financial, cloud, api, senior, operational, health, healthcare, engineer, engineering, backend, digital nomad",2026-03-27T16:00:44+00:00,https://remoteOK.com/remote-jobs/remote-senior-backend-engineer-integrations-arbiter-ai-1130908
Product Marketing Manager Ecommerce,GetResponse,,"manager, design, saas, recruiter, support, test, growth, video, strategy, content, marketing, sales, health, recruitment, educational, ecommerce, digital nomad",2026-03-27T16:00:37+00:00,https://remoteOK.com/remote-jobs/remote-product-marketing-manager-ecommerce-getresponse-1130907
Brand & Growth Designer,Fluxon,Portugal,"growth, design, designer, support, senior, marketing, sales, engineering, branding, digital nomad",2026-03-27T16:00:31+00:00,https://remoteOK.com/remote-jobs/remote-brand-growth-designer-fluxon-1130906
Scientific Director Medical Affairs,Iovance Biotherapeutics,,"director, system, support, education, leader",2026-03-27T16:00:21+00:00,https://remoteOK.com/remote-jobs/remote-scientific-director-medical-affairs-iovance-biotherapeutics-1130905
VP Data Engineering,Consumer Edge,New York,"technical, financial, investment, cloud, management, lead, engineering",2026-03-27T16:00:07+00:00,https://remoteOK.com/remote-jobs/remote-vp-data-engineering-consumer-edge-1130904
Senior Payroll Associate Indian Payroll India,Deel,,"payroll, hr, technical, support, software, cloud, microsoft, leader, management, lead, senior, junior, healthcare",2026-03-27T08:00:53+00:00,https://remoteOK.com/remote-jobs/remote-senior-payroll-associate-indian-payroll-india-deel-1130900
Associate Director CMC,Allucent,,"director, training, consulting, technical, support, growth, manager, management, lead, content, operations, health, recruitment",2026-03-27T08:00:47+00:00,https://remoteOK.com/remote-jobs/remote-associate-director-cmc-allucent-1130899
Talent Partner,Cloudbeds,Peru,"support, strategy, operations, recruiting, recruitment",2026-03-27T08:00:41+00:00,https://remoteOK.com/remote-jobs/remote-talent-partner-cloudbeds-1130898
Spanish Speaking Customer Service Agent For Electronics Company Work Greece,Mercier Consultancy Group,,"consulting, system, swift, consultancy, support, software",2026-03-27T08:00:31+00:00,https://remoteOK.com/remote-jobs/remote-spanish-speaking-customer-service-agent-for-electronics-company-work-greece-mercier-consultancy-group-1130897
