Job Title,Company,Location,Tags,Date,Apply Link
Self Pay &amp; Customer Service Specialist,Clinical Health Network For Transformation,Remote,"support, software, financial, microsoft, management, medical, health, healthcare",2026-04-29T00:01:16+00:00,https://remoteOK.com/remote-jobs/remote-self-pay-amp-customer-service-specialist-clinical-health-network-for-transformation-1131377
Director Global Account Management,Loadsmart,Chicago / Remote,"director, growth, travel, voice, management, lead, senior, marketing, analytics, sales, executive, full-time",2026-04-29T00:01:10+00:00,https://remoteOK.com/remote-jobs/remote-director-global-account-management-loadsmart-1131376
Senior Site Reliability Engineer AI Infrastructure,Andromeda Cluster,San Francisco,"design, training, technical, software, code, manager, financial, cloud, management, lead, senior, operations, reliability, go, health, engineer, engineering, linux, digital nomad",2026-04-29T00:01:03+00:00,https://remoteOK.com/remote-jobs/remote-senior-site-reliability-engineer-ai-infrastructure-andromeda-cluster-1131375
Senior Financial Analyst Digital Assets,Exodus Movement Inc.,,"analyst, cryptocurrency, support, financial, investment, finance, senior, non tech",2026-04-29T00:00:57+00:00,https://remoteOK.com/remote-jobs/remote-senior-financial-analyst-digital-assets-exodus-movement-inc-1131374
Product Expert PLM and ERP,Altana,"Brooklyn, NY; Washington, DC",,2026-04-29T00:00:48+00:00,https://remoteOK.com/remote-jobs/remote-product-expert-plm-and-erp-altana-1131373
Senior Cost Manager Estimator,"OCMI, Inc.","San Diego, CA","manager, recruiter, support, management, lead, senior, healthcare, non tech",2026-04-29T00:00:39+00:00,https://remoteOK.com/remote-jobs/remote-senior-cost-manager-estimator-ocmi-inc-1131372
Lead Commercial Counsel,SpecterOps,"Remote, United States","travel, lead, legal, non tech",2026-04-29T00:00:29+00:00,https://remoteOK.com/remote-jobs/remote-lead-commercial-counsel-specterops-1131371
Front End Full Stack Developer,Honor Foods,"Philadelphia, PA","developer, front-end, ui, code, web, operational, backend, digital nomad",2026-04-29T00:00:19+00:00,https://remoteOK.com/remote-jobs/remote-front-end-full-stack-developer-honor-foods-1131370
Senior Recruiter & People Operations Lead,Wellist,"Boston, MA","hr, recruiter, support, lead, senior, operations, recruiting, non tech",2026-04-29T00:00:08+00:00,https://remoteOK.com/remote-jobs/remote-senior-recruiter-people-operations-lead-wellist-1131369
HIGH TICKET OUTBOUND SALES WANTED,FSE,,sales,2026-04-28T20:18:22+00:00,https://remoteOK.com/remote-jobs/remote-high-ticket-outbound-sales-wanted-fse-1131368
Automation Engineer,Syner-G,Pittsburgh,"consulting, support, growth, financial, video, management, engineer",2026-04-28T16:00:30+00:00,https://remoteOK.com/remote-jobs/remote-automation-engineer-syner-g-1131367
Pharmacy Liaison,Shields Health Solutions,Lakeland,"support, financial, management, medical",2026-04-28T16:00:16+00:00,https://remoteOK.com/remote-jobs/remote-pharmacy-liaison-shields-health-solutions-1131366
Data Governance Engineer,"Chime Financial, Inc",San Francisco,"python, technical, developer, code, leader, management, reliability, engineer, engineering, digital nomad",2026-04-28T16:00:06+00:00,https://remoteOK.com/remote-jobs/remote-data-governance-engineer-chime-financial-inc-1131365
UX Designer II,Renaissance Learning North America,,"ux, design, students, designer, education, leader, management, engineering, educational, digital nomad",2026-04-28T08:00:24+00:00,https://remoteOK.com/remote-jobs/remote-ux-designer-ii-renaissance-learning-north-america-1131362
Account Executive Emerging Accounts,Fictiv,"Schaumburg, IL","sales, executive",2026-04-28T08:00:16+00:00,https://remoteOK.com/remote-jobs/remote-account-executive-emerging-accounts-fictiv-1131361
Senior Associate Business Development & Strategy,Habitat Health,San Francisco,"support, strategy, senior, medical, health, healthcare",2026-04-28T00:01:31+00:00,https://remoteOK.com/remote-jobs/remote-senior-associate-business-development-strategy-habitat-health-1131356
Regional Sales Manager,Open Farm,Metro Atlanta,"manager, training, support, growth, operational, sales",2026-04-28T00:01:17+00:00,https://remoteOK.com/remote-jobs/remote-regional-sales-manager-open-farm-1131355
Senior Transportation Specialist,"ShipBob, Inc.",Australia,senior,2026-04-28T00:01:08+00:00,https://remoteOK.com/remote-jobs/remote-senior-transportation-specialist-shipbob-inc-1131354
Senior Client Services Specialist,DentalXChange,Remote USA,"support, senior, operational",2026-04-28T00:00:55+00:00,https://remoteOK.com/remote-jobs/remote-senior-client-services-specialist-dentalxchange-1131353
Regional Human Resources Business Partner West,Rowan,California,"hr, training, support, growth, microsoft, management, operational, legal, health, recruiting, executive",2026-04-28T00:00:41+00:00,https://remoteOK.com/remote-jobs/remote-regional-human-resources-business-partner-west-rowan-1131352
Associate Copywriter,Golden Pet Brands,El Segundo,copywriter,2026-04-28T00:00:35+00:00,https://remoteOK.com/remote-jobs/remote-associate-copywriter-golden-pet-brands-1131351
Senior Publications Manager,Oruka Therapeutics,,"manager, lead, senior",2026-04-28T00:00:25+00:00,https://remoteOK.com/remote-jobs/remote-senior-publications-manager-oruka-therapeutics-1131350
Senior Scientific Communications Manager,Oruka Therapeutics,,"manager, senior, biotech",2026-04-28T00:00:14+00:00,https://remoteOK.com/remote-jobs/remote-senior-scientific-communications-manager-oruka-therapeutics-1131349
Senior Product Marketing Manager US,Smile Digital Health,Remote US,"manager, support, growth, voice, education, investment, management, senior, marketing, medical, health, healthcare, recruitment",2026-04-28T00:00:03+00:00,https://remoteOK.com/remote-jobs/remote-senior-product-marketing-manager-us-smile-digital-health-1131348
Senior Enablement Manager,Brandtech+,Mumbai,"manager, senior",2026-04-27T16:01:04+00:00,https://remoteOK.com/remote-jobs/remote-senior-enablement-manager-brandtech-1131346
Engineer Software,Calabrio,,"software, design, c#, saas, react, frontend, security, full-stack, docker, technical, support, developer, testing, growth, ui, ux, code, scrum, qa, devops, js, java, nosql, git, api, junior, operational, analytics, health, engineer, engineering, backend, digital nomad",2026-04-27T16:00:55+00:00,https://remoteOK.com/remote-jobs/remote-engineer-software-calabrio-1131345
Outpatient Facility Coder,UASI,Remote,"coder, software, code, video",2026-04-27T16:00:44+00:00,https://remoteOK.com/remote-jobs/remote-outpatient-facility-coder-uasi-1131344
Business Analyst,Toastmasters International,"Englewood, CO","analyst, system, consult, technical, testing, management, operations, operational, go",2026-04-27T16:00:30+00:00,https://remoteOK.com/remote-jobs/remote-business-analyst-toastmasters-international-1131343
Sr Account Executive Commercial Accounts,Veeam Software,"Dallas, TX","dev, security, leader, go, executive, digital nomad",2026-04-27T16:00:05+00:00,https://remoteOK.com/remote-jobs/remote-sr-account-executive-commercial-accounts-veeam-software-1131341
Senior Full stack React Developer,Lemon.io,,"javascript, react, node, python, golang, full time, full stack, dev, engineer, senior",2026-04-27T09:46:26+00:00,https://remoteOK.com/remote-jobs/remote-senior-full-stack-react-developer-lemon-io-1131339
Virtual Real Estate Sales Representative,aurelian sovereign,,"sales, customer support, exec, sys admin",2026-04-27T07:30:05+00:00,https://remoteOK.com/remote-jobs/remote-virtual-real-estate-sales-representative-aurelian-sovereign-1131338
Network Engineer Factory Systems and Operational Technology,Anduril Industries,Costa Mesa,"design, system, security, 3d, support, operational, engineer, digital nomad",2026-04-27T00:00:17+00:00,https://remoteOK.com/remote-jobs/remote-network-engineer-factory-systems-and-operational-technology-anduril-industries-1131334
Bookkeeping Specialist,Velora,USA and Canada,"bookkeeping, financial",2026-04-27T00:00:06+00:00,https://remoteOK.com/remote-jobs/remote-bookkeeping-specialist-velora-1131333
Operations Associate,Adventus,Manila,operations,2026-04-26T00:00:28+00:00,https://remoteOK.com/remote-jobs/remote-operations-associate-adventus-1131330
ML Engineer,"Trunk Tools, Inc.",,"design, system, software, growth, code, voice, operational, go, engineer, engineering, digital nomad",2026-04-26T00:00:12+00:00,https://remoteOK.com/remote-jobs/remote-ml-engineer-trunk-tools-inc-1131329
Software Engineer,Finalis,,"software, design, system, security, technical, code, accounting, financial, investment, cloud, api, senior, junior, engineer, engineering, backend, digital nomad",2026-04-26T00:00:05+00:00,https://remoteOK.com/remote-jobs/remote-software-engineer-finalis-1131328
Managing Director New England,IntraFi,,"director, support, growth, travel, financial, management, senior, sales",2026-04-25T16:00:04+00:00,https://remoteOK.com/remote-jobs/remote-managing-director-new-england-intrafi-1131327
Tax AI Expert,Weekday,India,"technical, support, growth, payroll, financial, finance, analytics",2026-04-25T08:00:26+00:00,https://remoteOK.com/remote-jobs/remote-tax-ai-expert-weekday-1131326
Director of Revenue Operations,Practice Better,Canada,"director, financial, banking, management, operations, health, recruitment, non tech",2026-04-25T08:00:19+00:00,https://remoteOK.com/remote-jobs/remote-director-of-revenue-operations-practice-better-1131325
Regional Sales Executive,Pivotal Health,,"system, financial, finance, senior, operational, sales, medical, health, healthcare, executive",2026-04-25T08:00:08+00:00,https://remoteOK.com/remote-jobs/remote-regional-sales-executive-pivotal-health-1131324
Territory Account Manager,TENEX.AI,,"manager, saas, security, technical, growth, travel, devops, cloud, sales, engineering, executive",2026-04-25T00:00:55+00:00,https://remoteOK.com/remote-jobs/remote-territory-account-manager-tenex-ai-1131323
HQ AI Enablement Lead,Everfield,,"saas, teaching, training, consulting, consult, technical, support, software, code, travel, financial, strategy, management, lead, operational",2026-04-25T00:00:49+00:00,https://remoteOK.com/remote-jobs/remote-hq-ai-enablement-lead-everfield-1131322
Medical Director for Health Plan,Evry Health,Remote,"director, training, management, lead, medical, health, healthcare, full-time, non tech",2026-04-25T00:00:42+00:00,https://remoteOK.com/remote-jobs/remote-medical-director-for-health-plan-evry-health-1131321
Vice President of Marketing,Pine Services Group,Remote,"consulting, ceo, software, growth, voice, investment, leader, strategy, lead, content, senior, operations, marketing, sales, executive",2026-04-25T00:00:35+00:00,https://remoteOK.com/remote-jobs/remote-vice-president-of-marketing-pine-services-group-1131320
Technical Account Manager,Clariti Cloud Inc.,,"manager, technical, cloud, lead",2026-04-25T00:00:28+00:00,https://remoteOK.com/remote-jobs/remote-technical-account-manager-clariti-cloud-inc-1131319
Implementation Specialist,Submittable,"Remote, U.S.","training, support, software, director, health, full-time",2026-04-25T00:00:16+00:00,https://remoteOK.com/remote-jobs/remote-implementation-specialist-submittable-1131318
Proposal Manager @Advizex,Advizex,,"manager, strategy, management, content, operations, executive",2026-04-25T00:00:07+00:00,https://remoteOK.com/remote-jobs/remote-proposal-manager-advizex-advizex-1131317
B2B Marketing Manager,Montu UK,Germany,"manager, support, web, video, strategy, lead, content, marketer, marketing, sales, health, healthcare, non tech",2026-04-24T16:00:51+00:00,https://remoteOK.com/remote-jobs/remote-b2b-marketing-manager-montu-uk-1131316
Senior Tech Lead Mobile Developer Risora,SKELAR,Kyiv,"developer, swift, full-stack, cto, code, postgresql, node, node.js, api, mobile, lead, senior, digital nomad",2026-04-24T16:00:44+00:00,https://remoteOK.com/remote-jobs/remote-senior-tech-lead-mobile-developer-risora-skelar-1131315
Full Stack Product Engineer,Pivotal Health,Los Angeles ,"react, system, frontend, technical, software, ui, web, cloud, operations, operational, medical, health, healthcare, engineer, engineering, backend",2026-04-24T16:00:36+00:00,https://remoteOK.com/remote-jobs/remote-full-stack-product-engineer-pivotal-health-1131314
WorkWave Senior Data Analytics Engineer,WorkWave,,"technical, senior, analytics, engineer, engineering",2026-04-24T16:00:29+00:00,https://remoteOK.com/remote-jobs/remote-workwave-senior-data-analytics-engineer-workwave-1131313
Paid Media Manager,Terra,,"manager, strategist, strategy",2026-04-24T16:00:16+00:00,https://remoteOK.com/remote-jobs/remote-paid-media-manager-terra-1131312
Registered Clinical Social Work Intern Spanish Speaking,Brave Health,,"recruiter, support, growth, video, education, senior, medical, health, healthcare",2026-04-24T16:00:08+00:00,https://remoteOK.com/remote-jobs/remote-registered-clinical-social-work-intern-spanish-speaking-brave-health-1131311
Saint Gobain Application Sales Director,GML A/S,,"director, ceo, management, lead, sales, non tech",2026-04-24T08:00:29+00:00,https://remoteOK.com/remote-jobs/remote-saint-gobain-application-sales-director-gml-a-s-1131307
Trainer EMEA,360Learning,"Paris, Remote","trainer, teaching, training, technical, support, admin, strategy, executive",2026-04-24T08:00:22+00:00,https://remoteOK.com/remote-jobs/remote-trainer-emea-360learning-1131306
Data Engineer,Pivotal Health,Los Angeles ,"design, salesforce, python, technical, support, software, analyst, devops, cloud, postgresql, analytics, medical, health, healthcare, engineer, engineering, digital nomad",2026-04-24T08:00:16+00:00,https://remoteOK.com/remote-jobs/remote-data-engineer-pivotal-health-1131305
Overnight Neuroradiologist Partner Track 10p 7a MST 7 on 14 off,Diversified Radiology,Remote,"system, teaching, assistant, fellowship, full-time",2026-04-24T00:01:04+00:00,https://remoteOK.com/remote-jobs/remote-overnight-neuroradiologist-partner-track-10p-7a-mst-7-on-14-off-diversified-radiology-1131304
Full Stack Developer,Envision Horizons LLC,Remote,"developer, c#, amazon, react, system, front-end, technical, support, software, growth, code, web, voice, financial, css, strategy, senior, reliability, health, recruiting, engineering, recruitment, backend, ecommerce, e-commerce, digital nomad",2026-04-24T00:00:58+00:00,https://remoteOK.com/remote-jobs/remote-full-stack-developer-envision-horizons-llc-1131303
TEST JOB,Fleetio,"Remote - USA, CAN, MEX","test, software, rails",2026-04-24T00:00:52+00:00,https://remoteOK.com/remote-jobs/remote-test-job-fleetio-1131302
Bilingual Legal Personal Injury,Distro,Bogotá,"system, web, management, legal",2026-04-24T00:00:42+00:00,https://remoteOK.com/remote-jobs/remote-bilingual-legal-personal-injury-distro-1131301
Controller,MissionWired,"Washington, DC - Remote Flexibility","controller, saas, system, support, software, testing, travel, manager, accounting, financial, finance, management, lead, operations, excel, sales, health",2026-04-24T00:00:35+00:00,https://remoteOK.com/remote-jobs/remote-controller-missionwired-1131300
Neurologist TX Licensed BC PT FT Fully Virtual,TeleMed2U,Remote,"management, health, healthcare, neurology, non tech",2026-04-24T00:00:28+00:00,https://remoteOK.com/remote-jobs/remote-neurologist-tx-licensed-bc-pt-ft-fully-virtual-telemed2u-1131299
Senior Account Executive Publishers,Zeta Global,,"system, cloud, senior, marketing, sales, go, executive, ecommerce",2026-04-24T00:00:13+00:00,https://remoteOK.com/remote-jobs/remote-senior-account-executive-publishers-zeta-global-1131298
Strategy & Operations,TLDR,,"design, software, growth, strategy, management, operations, operational, go, engineering, digital nomad",2026-04-24T00:00:03+00:00,https://remoteOK.com/remote-jobs/remote-strategy-operations-tldr-1131297
Applied AI Engineer Europe,Amigo,Amsterdam,"system, python, technical, support, software, testing, code, investment, git, api, leader, operational, reliability, go, health, healthcare, engineer, engineering",2026-04-23T16:00:17+00:00,https://remoteOK.com/remote-jobs/remote-applied-ai-engineer-europe-amigo-1131296
UX UI Designer — AI Application,0g Labs,,"ui, ux, design, system, designer, technical, web, speech, strategy, health, digital nomad",2026-04-23T16:00:11+00:00,https://remoteOK.com/remote-jobs/remote-ux-ui-designer-ai-application-0g-labs-1131295
Corporate Counsel,May Mobility,,"system, support, operations, marketing, legal, go",2026-04-23T16:00:04+00:00,https://remoteOK.com/remote-jobs/remote-corporate-counsel-may-mobility-1131294
Senior Backend Engineer Build AI Agents,Salesforge,,"golang, senior, sales, engineer, backend",2026-04-23T16:00:01+00:00,https://remoteOK.com/remote-jobs/remote-senior-backend-engineer-build-ai-agents-salesforge-1131292
Bookkeeper,Vidinext,,"other, accounting, finance",2026-04-23T12:04:19+00:00,https://remoteOK.com/remote-jobs/remote-bookkeeper-vidinext-1131290
Mid Senior AI Video Artist,EverAI,,"marketing, video, ai",2026-04-23T08:11:46+00:00,https://remoteOK.com/remote-jobs/remote-mid-senior-ai-video-artist-everai-1131288
Account Executive III,Sumo Logic,Melbourne,"saas, salesforce, security, technical, web, devops, cloud, management, lead, analytics, sales, executive",2026-04-23T08:00:17+00:00,https://remoteOK.com/remote-jobs/remote-account-executive-iii-sumo-logic-1131287
Senior Director Sales and Operations Planning,OLLY,,"director, leader, senior, operations, sales, non tech",2026-04-23T08:00:07+00:00,https://remoteOK.com/remote-jobs/remote-senior-director-sales-and-operations-planning-olly-1131286
VP Creative Director,Noodle,"Remote, United States","director, design, support, web, travel, video, education, leader, strategy, management, lead, content, senior, operational, marketing, analytics, sales, digital nomad",2026-04-23T00:01:28+00:00,https://remoteOK.com/remote-jobs/remote-vp-creative-director-noodle-1131284
Associate Director Solutions,YipitData (Alternative),US Remote,"director, technical, investment, analytics",2026-04-23T00:01:22+00:00,https://remoteOK.com/remote-jobs/remote-associate-director-solutions-yipitdata-alternative-1131283
Technical Program Manager — Platform Migration,Cayuse,Remote,"manager, technical, support, test, growth, strategy, lead, senior, operational, health, engineering",2026-04-23T00:01:11+00:00,https://remoteOK.com/remote-jobs/remote-technical-program-manager-platform-migration-cayuse-1131282
Principal Customer Solutions Architect,Caylent,CANADA,"architect, design, amazon, security, technical, web, cloud, lead, sales, executive, digital nomad",2026-04-23T00:00:57+00:00,https://remoteOK.com/remote-jobs/remote-principal-customer-solutions-architect-caylent-1131281
Senior Security Engineer,Bridgewater Associates,Remote,"security, technical, recruiter, developer, software, test, code, investment, cloud, management, senior, engineer, engineering, full-time, digital nomad",2026-04-23T00:00:46+00:00,https://remoteOK.com/remote-jobs/remote-senior-security-engineer-bridgewater-associates-1131280
Business Development Director,Connections Health Solutions,,"director, medical, health",2026-04-23T00:00:34+00:00,https://remoteOK.com/remote-jobs/remote-business-development-director-connections-health-solutions-1131279
Insurance Verifications Specialist,Cranial Technologies,,full-time,2026-04-23T00:00:25+00:00,https://remoteOK.com/remote-jobs/remote-insurance-verifications-specialist-cranial-technologies-1131278
Frontend Engineer,CareerVillage.org,"Remote, United States","frontend, technical, software, code, web, engineer, backend, full-time",2026-04-23T00:00:16+00:00,https://remoteOK.com/remote-jobs/remote-frontend-engineer-careervillage-org-1131277
Senior Account Executive,,,"senior, executive",2026-04-23T00:00:05+00:00,https://remoteOK.com/remote-jobs/remote-senior-account-executive-1131276
Healthcare Account Executive,Vonage,,"software, growth, cloud, api, leader, management, lead, sales, healthcare, executive",2026-04-22T16:00:59+00:00,https://remoteOK.com/remote-jobs/remote-healthcare-account-executive-vonage-1131272
Senior CAD Backend Engineer Mechanical CAD Automation,Foundation EGI,,"design, python, 3d, senior, engineer, engineering, backend, digital nomad",2026-04-22T16:00:50+00:00,https://remoteOK.com/remote-jobs/remote-senior-cad-backend-engineer-mechanical-cad-automation-foundation-egi-1131271
Solution Engineer I,"Onit, Inc.","Pune, Maharashtra","support, software, growth, code, css, microsoft, management, lead, operations, legal, engineer",2026-04-22T16:00:43+00:00,https://remoteOK.com/remote-jobs/remote-solution-engineer-i-onit-inc-1131270
Senior Data Engineer,Capnexus,,"amazon, system, software, cloud, api, lead, senior, engineer, engineering",2026-04-22T16:00:36+00:00,https://remoteOK.com/remote-jobs/remote-senior-data-engineer-capnexus-1131269
Senior App &amp; Frontend Developer AS233,Smart Working Solutions,,"frontend, developer, embedded, architect, technical, testing, growth, cloud, management, senior, junior, marketing, analytics, engineering, apache, digital nomad",2026-04-22T16:00:26+00:00,https://remoteOK.com/remote-jobs/remote-senior-app-amp-frontend-developer-as233-smart-working-solutions-1131268
Provider Services Analyst I,Trend Health Partners,Remote,"analyst, support, software, financial, microsoft, leader, legal, medical, health, healthcare",2026-04-22T16:00:18+00:00,https://remoteOK.com/remote-jobs/remote-provider-services-analyst-i-trend-health-partners-1131267
PPC & Amazon Strategist,Trivium,,"amazon, strategist, growth, video, ads, strategy, lead, senior, marketing, analytics, sales, full-time",2026-04-22T16:00:08+00:00,https://remoteOK.com/remote-jobs/remote-ppc-amazon-strategist-trivium-1131266
Data Scientist,Junction,,"python, technical, cloud, management, lead, analytics, health, healthcare, engineering",2026-04-22T16:00:02+00:00,https://remoteOK.com/remote-jobs/remote-data-scientist-junction-1131265
Shift Lead Downtown,DoorDash USA,"Dallas, TX","support, management, lead, operations, go",2026-04-22T08:00:27+00:00,https://remoteOK.com/remote-jobs/remote-shift-lead-downtown-doordash-usa-1131264
Senior Site Reliability Engineer,Pave Bank,Kuala Lumpur,"crypto, system, security, technical, support, code, financial, fintech, banking, finance, bank, cloud, senior, operations, operational, reliability, engineer",2026-04-22T08:00:17+00:00,https://remoteOK.com/remote-jobs/remote-senior-site-reliability-engineer-pave-bank-1131263
Principal Product Manager,Oportun,,"manager, growth, financial, management, lead, marketing",2026-04-22T08:00:10+00:00,https://remoteOK.com/remote-jobs/remote-principal-product-manager-oportun-1131262
High Paying Hourly Enrollment Specialist,VP Education Group,,customer support,2026-04-22T06:46:22+00:00,https://remoteOK.com/remote-jobs/remote-high-paying-hourly-enrollment-specialist-vp-education-group-1131261
Search Engine Evaluation Specialist Freelance AI Trainer Project,Invisible Agency,United States of America,"trainer, design, training, digital nomad",2026-04-22T00:01:28+00:00,https://remoteOK.com/remote-jobs/remote-search-engine-evaluation-specialist-freelance-ai-trainer-project-invisible-agency-1131259
Senior Security Engineer Vulnerability & Exposure Management,Bridgewater Associates Referrals,,"security, investment, management, senior, engineer",2026-04-22T00:01:19+00:00,https://remoteOK.com/remote-jobs/remote-senior-security-engineer-vulnerability-exposure-management-bridgewater-associates-referrals-1131258
Partner Sales Manager,Prophecy,San Francisco,"manager, design, cloud, operational, marketing, sales, digital nomad",2026-04-22T00:01:10+00:00,https://remoteOK.com/remote-jobs/remote-partner-sales-manager-prophecy-1131257
Associate Product Manager,Automox,"Austin, TX","manager, security, support, ux, director, management, senior, engineering",2026-04-22T00:01:00+00:00,https://remoteOK.com/remote-jobs/remote-associate-product-manager-automox-1131256
