Job Title,Company,Location,Tags,Date,Apply Link
Executive Assistant,Adolescent Wellness Academy,"Davie, Davie, Florida, United States","hr, consulting, virtual assistant, exec, design, embedded, architecture, customer support, marketing, speech, microsoft, content writing, golang, engineer, digital nomad, social media, salesforce, travel, legal, sales, medical, sys admin, dev, finance, ops, excel, full time",2026-06-10T16:33:08+00:00,https://remoteOK.com/remote-jobs/remote-executive-assistant-adolescent-wellness-academy-1133178
Environmental Health and Safety officer,The Lunch Bag,"Roorkee, ","virtual assistant, infosec, education, customer support, marketing, exec, finance, ops, medical, engineer, amazon, web dev, ecommerce",2026-06-10T16:23:56+00:00,https://remoteOK.com/remote-jobs/remote-environmental-health-and-safety-officer-the-lunch-bag-1133188
Category Manager Sneakers,StockX,"Detroit, Detroit, Michigan, United States","hr, consulting, virtual assistant, exec, design, embedded, architecture, customer support, marketing, speech, microsoft, content writing, golang, engineer, digital nomad",2026-06-10T16:12:22+00:00,https://remoteOK.com/remote-jobs/remote-category-manager-sneakers-stockx-1133175
Pharmaceutical & Clinical Research Expert,CuraSenseAI,"Remote, ",,2026-06-10T16:05:59+00:00,https://remoteOK.com/remote-jobs/remote-pharmaceutical-clinical-research-expert-curasenseai-1133164
Senior SDET,NDEAVOUR CONSULTING,,"consulting, design, sys admin, education, game dev, customer support, dev, testing, java, cloud, typescript, api, mobile, exec, senior, medical, digital nomad",2026-06-10T16:00:53+00:00,https://remoteOK.com/remote-jobs/remote-senior-sdet-ndeavour-consulting-1133163
Senior Manager Workforce Management,Dutchie,,"exec, customer support, marketing, dev, senior, ops, engineer, digital nomad",2026-06-10T16:00:46+00:00,https://remoteOK.com/remote-jobs/remote-senior-manager-workforce-management-dutchie-1133162
Senior Data Engineering Manager,YipitData,US Remote,"exec, customer support, dev, marketing, finance, cloud, content writing, senior, stats, engineer, ecommerce, digital nomad",2026-06-10T16:00:30+00:00,https://remoteOK.com/remote-jobs/remote-senior-data-engineering-manager-yipitdata-1133161
Senior Manager Strategic Customer Success,Superhuman,,"customer support, exec, design, embedded, sys admin, recruiter, testing, marketing, travel, speech, virtual assistant, senior, sales, golang, medical, engineer, education, digital nomad",2026-06-10T16:00:13+00:00,https://remoteOK.com/remote-jobs/remote-senior-manager-strategic-customer-success-superhuman-1133160
French Speaking iRobot Support Specialist Work Bulgaria,Mercier Consultancy Group,,"consulting, education, technical, customer support, dev, robotics, exec, medical, digital nomad",2026-06-10T16:00:05+00:00,https://remoteOK.com/remote-jobs/remote-french-speaking-irobot-support-specialist-work-bulgaria-mercier-consultancy-group-1133159
Underwriter Motor,Coralisle Group Ltd.,"Port of Spain, ","infosec, finance, exec, travel, c, education, math, microsoft, excel",2026-06-10T15:07:34+00:00,https://remoteOK.com/remote-jobs/remote-underwriter-motor-coralisle-group-ltd-1133231
Improver,Jaguar Building Services Ltd,"London, ","scheme, recruiter, non tech",2026-06-10T14:31:45+00:00,https://remoteOK.com/remote-jobs/remote-improver-jaguar-building-services-ltd-1133196
Coordenador de Relacionamento com Cliente,Checkout RH,"São Paulo, ",,2026-06-10T14:08:53+00:00,https://remoteOK.com/remote-jobs/remote-coordenador-de-relacionamento-com-cliente-checkout-rh-1133157
Customer Service Specialist,SORACOM,"Denver, Denver, Colorado, United States","hr, consulting, virtual assistant, exec, design, embedded, architecture, customer support, marketing, speech, microsoft, content writing, golang, engineer, digital nomad, social media, salesforce, travel, legal, sales, medical",2026-06-10T14:02:22+00:00,https://remoteOK.com/remote-jobs/remote-customer-service-specialist-soracom-1133177
Customer Service Specialist,SORACOM,"Phoenix, Phoenix, Arizona, United States","hr, consulting, virtual assistant, exec, design, embedded, architecture, customer support, marketing, speech, microsoft, content writing, golang, engineer, digital nomad, social media, salesforce, travel, legal, sales, medical, sys admin, dev, finance, ops, excel, full time",2026-06-10T14:02:21+00:00,https://remoteOK.com/remote-jobs/remote-customer-service-specialist-soracom-1133179
Customer Service Specialist,SORACOM,"Chicago, Chicago, Illinois, United States","hr, consulting, virtual assistant, exec, design, embedded, architecture, customer support, marketing, speech, microsoft, content writing, golang, engineer, digital nomad, social media, salesforce, travel, legal, sales, medical, sys admin, dev, finance, ops, excel, full time",2026-06-10T14:02:17+00:00,https://remoteOK.com/remote-jobs/remote-customer-service-specialist-soracom-1133180
Biology Expert,YO IT Consulting,"Sydney, Sydney, New South Wales, Australia","consulting, education, technical, customer support, exec, content writing, biotech, engineer",2026-06-10T13:44:18+00:00,https://remoteOK.com/remote-jobs/remote-biology-expert-yo-it-consulting-1133245
Store Manager *CRANBROOK,The Home Depot Canada,"Cranbrook, ","senior, ops, education, payroll, non tech, sys admin, supervisor, infosec, technical, customer support, transcribing, finance, medical, recruiter, exec, part time, marketing, full time",2026-06-10T13:03:44+00:00,https://remoteOK.com/remote-jobs/remote-store-manager-cranbrook-the-home-depot-canada-1133314
Courier,FedEx,"Udaipur, ","virtual assistant, infosec, education, customer support, marketing, exec, finance, ops, medical, engineer",2026-06-10T12:31:16+00:00,https://remoteOK.com/remote-jobs/remote-courier-fedex-1133185
