Job Title,Company,Location,Tags,Date,Apply Link
Audience Writer,ProPublica,,"writer, manager, full-time",2026-02-14T02:00:03+00:00,https://remoteOK.com/remote-jobs/remote-audience-writer-propublica-1130292
Backend Engineer Consumer Engineering,BEDI Partnerships,Mexico City,"code, engineer, engineering, backend",2026-02-14T01:00:41+00:00,https://remoteOK.com/remote-jobs/remote-backend-engineer-consumer-engineering-bedi-partnerships-1130291
Desarrollador Backend .NET ETL,NEORIS,Bogota,"c#, front-end, software, backend",2026-02-14T00:04:19+00:00,https://remoteOK.com/remote-jobs/remote-desarrollador-backend-net-etl-neoris-1130290
Prompt Engineer,Viseven,"Remote, Ukraine","back-end, python, engineer, engineering",2026-02-14T00:04:10+00:00,https://remoteOK.com/remote-jobs/remote-prompt-engineer-viseven-1130289
Information Security Operations Engineer,Bounteous,United States,"security, consultancy, technical, support, management, operations, engineer",2026-02-14T00:04:03+00:00,https://remoteOK.com/remote-jobs/remote-information-security-operations-engineer-bounteous-1130288
Manager Sales Engineering,ControlUp,UK,"manager, saas, technical, support, software, growth, travel, leader, management, lead, operations, operational, marketing, sales, engineering, executive",2026-02-14T00:03:56+00:00,https://remoteOK.com/remote-jobs/remote-manager-sales-engineering-controlup-1130287
Security Access Management Lead,Bounteous,United States,"security, training, consultancy, technical, support, manager, management, lead",2026-02-14T00:03:49+00:00,https://remoteOK.com/remote-jobs/remote-security-access-management-lead-bounteous-1130286
Associate Influencer Marketing,DoorDash USA,"New York, NY; San Francisco, CA; Los Angeles, CA; United States - Remote","support, manager, operational, marketing, non tech",2026-02-14T00:03:42+00:00,https://remoteOK.com/remote-jobs/remote-associate-influencer-marketing-doordash-usa-1130285
Senior Data Engineer,Oowlish Technology,,"python, support, software, growth, api, management, senior, engineer",2026-02-14T00:03:34+00:00,https://remoteOK.com/remote-jobs/remote-senior-data-engineer-oowlish-technology-1130284
Principal Data Operations &amp; Migration Lead,StarCompliance,"York, United Kingdom","technical, support, software, financial, education, finance, leader, management, lead, senior, operations, operational, health",2026-02-14T00:03:27+00:00,https://remoteOK.com/remote-jobs/remote-principal-data-operations-amp-migration-lead-starcompliance-1130283
Senior Medical Science Liaison,Xenon Pharmaceuticals,,"support, growth, code, travel, adult, education, lead, senior, healthcare, neurology",2026-02-14T00:03:21+00:00,https://remoteOK.com/remote-jobs/remote-senior-medical-science-liaison-xenon-pharmaceuticals-1130282
Account Executive,Corporativo Lumston,,"technical, software, growth, microsoft, sales, executive",2026-02-14T00:03:14+00:00,https://remoteOK.com/remote-jobs/remote-account-executive-corporativo-lumston-1130281
Communications Specialist,DCG,National Capital Region,"design, support, strategy, management, health, digital nomad",2026-02-14T00:03:08+00:00,https://remoteOK.com/remote-jobs/remote-communications-specialist-dcg-1130280
Data Science Intern Pricing Analytics,Gametime United,United States,"python, support, test, web, mobile, strategy, analytics",2026-02-14T00:02:59+00:00,https://remoteOK.com/remote-jobs/remote-data-science-intern-pricing-analytics-gametime-united-1130279
Tech Lead,Amplemarket,,"lead, sales, recruitment, non tech",2026-02-14T00:02:51+00:00,https://remoteOK.com/remote-jobs/remote-tech-lead-amplemarket-1130278
Director of Quality Performance,Vanna Health,San Francisco,"director, leader, operations, medical, health, non tech",2026-02-14T00:02:42+00:00,https://remoteOK.com/remote-jobs/remote-director-of-quality-performance-vanna-health-1130277
Technical Sales Manager,Maxcess International,"St. Louis, MO","manager, design, technical, web, sales, digital nomad",2026-02-14T00:02:34+00:00,https://remoteOK.com/remote-jobs/remote-technical-sales-manager-maxcess-international-1130276
Big Data Engineer,Oowlish Technology,,"python, support, software, growth, lambda, operational, analytics, reliability, engineer",2026-02-14T00:02:25+00:00,https://remoteOK.com/remote-jobs/remote-big-data-engineer-oowlish-technology-1130275
Executive Director Safety &amp; Pharmacovigilance,Kyverna Therapeutics,Remote,"director, support, strategy, management, lead, operational, biotech, health, executive",2026-02-14T00:02:17+00:00,https://remoteOK.com/remote-jobs/remote-executive-director-safety-amp-pharmacovigilance-kyverna-therapeutics-1130274
Product Marketing Manager,Lumivero,United States,"manager, training, technical, support, software, growth, analyst, voice, management, lead, content, marketing, analytics, sales, engineering",2026-02-14T00:02:11+00:00,https://remoteOK.com/remote-jobs/remote-product-marketing-manager-lumivero-1130273
Junior Product Support Specialist,Amplemarket,"Remote, LATAM/North America","support, lead, junior, sales, recruitment, non tech",2026-02-14T00:02:00+00:00,https://remoteOK.com/remote-jobs/remote-junior-product-support-specialist-amplemarket-1130272
Head of Professional Services,GoodTime,Remote,"design, support, leader, lead, operational, digital nomad",2026-02-14T00:01:50+00:00,https://remoteOK.com/remote-jobs/remote-head-of-professional-services-goodtime-1130271
VP Practice Operations,Form Health,,"architect, support, growth, adult, video, mobile, operations, operational, medical, health, educational",2026-02-14T00:01:41+00:00,https://remoteOK.com/remote-jobs/remote-vp-practice-operations-form-health-1130270
Sales Development Representative,career,Remote,"design, ceo, software, travel, sales, digital nomad",2026-02-14T00:01:32+00:00,https://remoteOK.com/remote-jobs/remote-sales-development-representative-career-1130269
Senior Manager RFP Response,RxSense,,"manager, saas, growth, leader, strategy, management, senior, sales, health, healthcare, executive",2026-02-14T00:01:23+00:00,https://remoteOK.com/remote-jobs/remote-senior-manager-rfp-response-rxsense-1130268
Community Specialist I,HighLevel,Mexico,"training, technical, support, software, growth, voice, video, api, management, lead, content, marketing, legal, sales",2026-02-14T00:01:15+00:00,https://remoteOK.com/remote-jobs/remote-community-specialist-i-highlevel-1130267
Integrated Marketing Manager,OpenAI,,"manager, design, security, support, developer, strategy, management, lead, content, marketing, executive, digital nomad",2026-02-14T00:01:07+00:00,https://remoteOK.com/remote-jobs/remote-integrated-marketing-manager-openai-1130266
IT Support Technician,Terraformation,"Remote, United States","training, technical, support, education, cloud, microsoft, management, operations",2026-02-14T00:01:01+00:00,https://remoteOK.com/remote-jobs/remote-it-support-technician-terraformation-1130265
Enterprise Account Executive Cloud Sales,Azul,,"saas, gaming, technical, software, financial, cloud, strategy, lead, sales, executive",2026-02-14T00:00:54+00:00,https://remoteOK.com/remote-jobs/remote-enterprise-account-executive-cloud-sales-azul-1130264
Senior Sales Development Representative,Loop,London,"system, training, technical, software, growth, voice, lead, senior, operations, marketing, sales, go",2026-02-14T00:00:46+00:00,https://remoteOK.com/remote-jobs/remote-senior-sales-development-representative-loop-1130263
VP Portfolio & Underwriting,"Pathward, N.A.",,"training, financial, leader, operations",2026-02-14T00:00:40+00:00,https://remoteOK.com/remote-jobs/remote-vp-portfolio-underwriting-pathward-n-a-1130262
Sales Development Representative,Stress Free Auto Care,Austin,sales,2026-02-14T00:00:31+00:00,https://remoteOK.com/remote-jobs/remote-sales-development-representative-stress-free-auto-care-1130261
Database Administrator Cloud,MariaDB plc,Dominican Republic,"design, technical, travel, telecommuting, bank, cloud, dba, administrator, health, blogging, linux, digital nomad",2026-02-14T00:00:22+00:00,https://remoteOK.com/remote-jobs/remote-database-administrator-cloud-mariadb-plc-1130260
CSM I,Carrot Fertility,,"support, manager, management, operational, health, non tech",2026-02-13T23:00:23+00:00,https://remoteOK.com/remote-jobs/remote-csm-i-carrot-fertility-1130259
Staff Data Analyst,Weedmaps,,"analyst, leader, senior, junior, executive",2026-02-13T23:00:14+00:00,https://remoteOK.com/remote-jobs/remote-staff-data-analyst-weedmaps-1130258
YouTube Editor Freelance,Interdependence,Remote,"design, post-production, assembly, content, analytics, digital nomad",2026-02-13T23:00:05+00:00,https://remoteOK.com/remote-jobs/remote-youtube-editor-freelance-interdependence-1130257
Customer Experience Associate,Sure,Remote,"embedded, software, education, fintech, rails, leader, operations, operational, sales",2026-02-13T21:00:02+00:00,https://remoteOK.com/remote-jobs/remote-customer-experience-associate-sure-1130255
Senior Data Scientist,Weedmaps,,"technical, test, finance, senior",2026-02-13T18:00:03+00:00,https://remoteOK.com/remote-jobs/remote-senior-data-scientist-weedmaps-1130254
Director Community & Developer Advocacy,Tines,North America,"developer, director, system, technical, support, growth, content, senior, marketing, digital nomad",2026-02-13T16:01:31+00:00,https://remoteOK.com/remote-jobs/remote-director-community-developer-advocacy-tines-1130252
Senior Software Engineer I Puppet,Perforce,,"software, system, security, technical, support, code, scrum, manager, devops, java, git, ruby, management, senior, engineer",2026-02-13T16:01:15+00:00,https://remoteOK.com/remote-jobs/remote-senior-software-engineer-i-puppet-perforce-1130251
Senior Manager Customer Operations,May Mobility,,"manager, system, financial, senior, operations, operational, go",2026-02-13T16:01:02+00:00,https://remoteOK.com/remote-jobs/remote-senior-manager-customer-operations-may-mobility-1130250
Founding Paralegal,Eudia,,"security, support, growth, senior, operational, legal",2026-02-13T16:00:54+00:00,https://remoteOK.com/remote-jobs/remote-founding-paralegal-eudia-1130249
Channel Business Manager,10x Genomics,Australia,"manager, training, support, strategy, management, marketing, analytics, sales, biotech, non tech",2026-02-13T16:00:32+00:00,https://remoteOK.com/remote-jobs/remote-channel-business-manager-10x-genomics-1130248
Application Engineer CNC & Sheet Metal,Xometry,Brazil,"3d, technical, support, education, sales, engineer, engineering",2026-02-13T00:01:40+00:00,https://remoteOK.com/remote-jobs/remote-application-engineer-cnc-sheet-metal-xometry-1130247
Customer Experience Representative,BRUNT,,engineer,2026-02-13T00:01:32+00:00,https://remoteOK.com/remote-jobs/remote-customer-experience-representative-brunt-1130246
Human Resources & Administrative Coordinator,Ludia Consulting,"Chicago, IL","consulting, hr, coordinator, support, growth, financial, finance, microsoft, senior, operations, operational",2026-02-13T00:01:24+00:00,https://remoteOK.com/remote-jobs/remote-human-resources-administrative-coordinator-ludia-consulting-1130245
Innovation Architect LATAM LATAM,Miro,,architect,2026-02-13T00:01:11+00:00,https://remoteOK.com/remote-jobs/remote-innovation-architect-latam-latam-miro-1130244
Business Development Manager,YipitData (Alternative),US Remote,"manager, growth, investment, e-commerce",2026-02-13T00:00:58+00:00,https://remoteOK.com/remote-jobs/remote-business-development-manager-yipitdata-alternative-1130243
VP of Sales Strategic Accounts,AcuityMD,Boston,"saas, software, growth, leader, lead, sales",2026-02-13T00:00:49+00:00,https://remoteOK.com/remote-jobs/remote-vp-of-sales-strategic-accounts-acuitymd-1130242
Security Engineer,PermitFlow,New York City,"security, frontend, architect, software, testing, cloud, management, engineer, engineering",2026-02-13T00:00:40+00:00,https://remoteOK.com/remote-jobs/remote-security-engineer-permitflow-1130241
Staff+ Software Engineer Observability,Anthropic,"London, UK","software, operational, reliability, engineer",2026-02-12T22:00:13+00:00,https://remoteOK.com/remote-jobs/remote-staff-software-engineer-observability-anthropic-1130240
Senior Account Manager,Workwize,New York,"manager, saas, support, senior",2026-02-12T22:00:04+00:00,https://remoteOK.com/remote-jobs/remote-senior-account-manager-workwize-1130239
Senior Technical Program Manager,Calendly,Remote - US,"manager, technical, growth, management, lead, senior, operational, health, engineering, executive",2026-02-12T20:00:14+00:00,https://remoteOK.com/remote-jobs/remote-senior-technical-program-manager-calendly-1130236
Design Program Manager AI,Figma,"San Francisco, CA","design, manager, technical, management, senior, full-time, digital nomad",2026-02-12T20:00:04+00:00,https://remoteOK.com/remote-jobs/remote-design-program-manager-ai-figma-1130235
SAP Data Migration Architect,CSCI Consulting,,"consulting, architect, design, consultant, technical, support, test, lead, digital nomad",2026-02-12T16:01:50+00:00,https://remoteOK.com/remote-jobs/remote-sap-data-migration-architect-csci-consulting-1130234
Senior Software Engineer Frontend,Blacklane,Barcelona,"frontend, software, design, react.js, front-end, technical, developer, code, senior, junior, go, engineer, digital nomad",2026-02-12T16:01:41+00:00,https://remoteOK.com/remote-jobs/remote-senior-software-engineer-frontend-blacklane-1130233
Supplier Quality Specialist,SpaceX,"Bastrop, TX","technical, support, management, operational, reliability, engineering",2026-02-12T16:01:29+00:00,https://remoteOK.com/remote-jobs/remote-supplier-quality-specialist-spacex-1130232
SOC Analyst,Keyrock,,"analyst, saas, web3, defi, nft, security, technical, support, growth, financial, cloud, api, lead, operations, engineering",2026-02-12T16:01:20+00:00,https://remoteOK.com/remote-jobs/remote-soc-analyst-keyrock-1130231
Lead Digital Media Buyer Latin America,Bluelight Consulting,Heredia,"consulting, consultancy, software, ads, lead",2026-02-12T16:01:12+00:00,https://remoteOK.com/remote-jobs/remote-lead-digital-media-buyer-latin-america-bluelight-consulting-1130230
Licensed Life Insurance Agent Position with Growth,AO Garcia Agency,"Kent, Washington","growth, support, video, sales",2026-02-12T16:00:58+00:00,https://remoteOK.com/remote-jobs/remote-licensed-life-insurance-agent-position-with-growth-ao-garcia-agency-1130229
Staff Product Manager Personalization Foundations,Headspace,"New York City, NY","manager, technical, leader, strategy, management, lead, content",2026-02-12T16:00:51+00:00,https://remoteOK.com/remote-jobs/remote-staff-product-manager-personalization-foundations-headspace-1130228
Permit Specialist work,TaxValet,Philippines,"software, sales",2026-02-12T16:00:41+00:00,https://remoteOK.com/remote-jobs/remote-permit-specialist-work-taxvalet-1130227
Manager Customer Success Operations,Federato,,"manager, support, finance, operations, operational, health, non tech",2026-02-12T15:00:04+00:00,https://remoteOK.com/remote-jobs/remote-manager-customer-success-operations-federato-1130224
Content Manager,SavvyNomad,,"marketing, content writing",2026-02-12T12:43:33+00:00,https://remoteOK.com/remote-jobs/remote-content-manager-savvynomad-1130223
Principal Security Engineer,Auros,,"security, design, technical, cloud, strategy, management, senior, engineer, engineering, digital nomad",2026-02-12T09:00:03+00:00,https://remoteOK.com/remote-jobs/remote-principal-security-engineer-auros-1130222
State Engagement Manager,Radiant,El Segundo,"manager, support, software, test, engineering",2026-02-12T08:00:52+00:00,https://remoteOK.com/remote-jobs/remote-state-engagement-manager-radiant-1130221
Staff Product Security Engineer Customer Platform,Valon Tech,,"security, design, saas, system, architect, technical, support, software, code, financial, c, cloud, api, strategy, senior, operational, engineer, engineering, digital nomad",2026-02-12T08:00:40+00:00,https://remoteOK.com/remote-jobs/remote-staff-product-security-engineer-customer-platform-valon-tech-1130220
Legal Operations Specialist,Boulevard,USA,"design, operations, legal, digital nomad",2026-02-12T08:00:34+00:00,https://remoteOK.com/remote-jobs/remote-legal-operations-specialist-boulevard-1130219
Security Operations Engineer,Alpaca,Remote - EMEA,"security, crypto, architect, financial, investment, api, operations, operational, engineer",2026-02-12T08:00:05+00:00,https://remoteOK.com/remote-jobs/remote-security-operations-engineer-alpaca-1130218
Senior Software Engineer Trading Infrastructure,Gauntlet,New York City / San Francisco / Los Angeles / Remote,"software, design, web3, defi, crypto, system, security, technical, code, financial, finance, cloud, senior, operational, reliability, engineer, engineering, digital nomad",2026-02-12T06:00:10+00:00,https://remoteOK.com/remote-jobs/remote-senior-software-engineer-trading-infrastructure-gauntlet-1130217
Software Engineer Apps,Headout,Bengaluru,"software, design, react, system, travel, mobile, senior, engineer, engineering, digital nomad",2026-02-12T06:00:04+00:00,https://remoteOK.com/remote-jobs/remote-software-engineer-apps-headout-1130216
Associate Manager Digital Media,Unlock Health,"Chicago, Illinois, United States","manager, qa, management, operations, medical, health, healthcare",2026-02-12T00:04:02+00:00,https://remoteOK.com/remote-jobs/remote-associate-manager-digital-media-unlock-health-1130215
Senior Support Operations Manager,DeepIntent,,"manager, support, lead, senior, operations, operational, analytics, healthcare, engineering",2026-02-12T00:03:52+00:00,https://remoteOK.com/remote-jobs/remote-senior-support-operations-manager-deepintent-1130214
Director EMEA Marketing,BambooHR,London,"director, hr, support, growth, investment, leader, strategy, lead, marketing, sales",2026-02-12T00:03:38+00:00,https://remoteOK.com/remote-jobs/remote-director-emea-marketing-bamboohr-1130213
Marketing Associate,Beacon Biosignals,"Boston, MA","strategy, content, operational, marketing, analytics, non tech",2026-02-12T00:03:24+00:00,https://remoteOK.com/remote-jobs/remote-marketing-associate-beacon-biosignals-1130212
Senior Client Success Manager,Force Therapeutics,Remote - US East,"manager, system, support, growth, voice, strategy, senior, health",2026-02-12T00:03:13+00:00,https://remoteOK.com/remote-jobs/remote-senior-client-success-manager-force-therapeutics-1130211
Senior Paid Search Analyst,Unlock Health,"Chicago, Illinois, United States; Nashville, Tennessee, United States; Remote","analyst, microsoft, management, senior, medical, health, healthcare, non tech",2026-02-12T00:03:03+00:00,https://remoteOK.com/remote-jobs/remote-senior-paid-search-analyst-unlock-health-1130210
Customer Success Manager Strategic,AcuityMD,Boston,"manager, saas, training, software",2026-02-12T00:02:50+00:00,https://remoteOK.com/remote-jobs/remote-customer-success-manager-strategic-acuitymd-1130209
Senior DevSecOps Platform Security Engineer,DEFCON AI,,"security, design, software, senior, operational, engineer, engineering, digital nomad",2026-02-12T00:02:39+00:00,https://remoteOK.com/remote-jobs/remote-senior-devsecops-platform-security-engineer-defcon-ai-1130208
Senior Product Manager Connected Care,Linus Health,,"manager, architect, growth, senior, medical, health, healthcare",2026-02-12T00:01:09+00:00,https://remoteOK.com/remote-jobs/remote-senior-product-manager-connected-care-linus-health-1130207
Associate Therapist Fully,Daybreak Health,North Carolina,"students, education, medical, health, educational, non tech",2026-02-12T00:00:40+00:00,https://remoteOK.com/remote-jobs/remote-associate-therapist-fully-daybreak-health-1130206
Senior Cybersecurity Engineer,Accenture Federal Services,"Washington, DC","security, training, technical, support, developer, code, management, senior, health, engineer, engineering, digital nomad",2026-02-11T22:00:28+00:00,https://remoteOK.com/remote-jobs/remote-senior-cybersecurity-engineer-accenture-federal-services-1130205
Customer Service Hospitality Reservations,Destination Knot,Florida,"system, training, travel",2026-02-11T22:00:11+00:00,https://remoteOK.com/remote-jobs/remote-customer-service-hospitality-reservations-destination-knot-1130204
Senior Systems Engineer,Logos,Worldwide,"design, test, senior, engineer, digital nomad",2026-02-11T22:00:04+00:00,https://remoteOK.com/remote-jobs/remote-senior-systems-engineer-logos-1130203
Fullstack Automation Engineer Delivery Automation Team,Hostinger,,"system, frontend, full-stack, architect, support, developer, software, growth, typescript, api, health, engineer, engineering, backend, fullstack, digital nomad",2026-02-11T13:00:08+00:00,https://remoteOK.com/remote-jobs/remote-fullstack-automation-engineer-delivery-automation-team-hostinger-1130201
Founding Marketer,Wing Assistant,Japan,"virtual assistant, design, saas, copywriting, testing, test, growth, education, seo, strategy, lead, content, marketer, marketing, excel, sales, digital nomad",2026-02-11T13:00:01+00:00,https://remoteOK.com/remote-jobs/remote-founding-marketer-wing-assistant-1130200
Software Development Engineer I,QuillBot,India,"software, frontend, students, full-stack, technical, growth, code, nodejs, html, engineer, engineering",2026-02-11T12:00:05+00:00,https://remoteOK.com/remote-jobs/remote-software-development-engineer-i-quillbot-1130199
Business Development Representative UK EU,Alpaca,,"crypto, growth, financial, investment, api, sales",2026-02-11T10:00:13+00:00,https://remoteOK.com/remote-jobs/remote-business-development-representative-uk-eu-alpaca-1130198
Senior Software Engineer Web,BitMEX,Asia,"software, web, crypto, cryptocurrency, security, senior, engineer",2026-02-11T09:00:06+00:00,https://remoteOK.com/remote-jobs/remote-senior-software-engineer-web-bitmex-1130197
Data Analyst 3,SkySlope,Remote,"analyst, salesforce, python, technical, support, software, growth, web, payroll, financial, cloud, mongodb, junior, analytics, go, health, healthcare, apache, full-time",2026-02-11T08:00:29+00:00,https://remoteOK.com/remote-jobs/remote-data-analyst-3-skyslope-1130196
Developer Relations Engineer,Horizen Labs,,"developer, web3, consulting, technical, support, engineer, digital nomad",2026-02-11T08:00:20+00:00,https://remoteOK.com/remote-jobs/remote-developer-relations-engineer-horizen-labs-1130195
Forward Deployed Engineer DevOps,Parloa,New York,"technical, code, devops, cloud, health, engineer, engineering",2026-02-11T08:00:10+00:00,https://remoteOK.com/remote-jobs/remote-forward-deployed-engineer-devops-parloa-1130194
Business Development Representative,C3 Integrated Solutions,United States,"support, marketing, sales",2026-02-11T00:01:10+00:00,https://remoteOK.com/remote-jobs/remote-business-development-representative-c3-integrated-solutions-1130193
Senior Account Manager Feb 2026,Zócalo Health,California,"manager, growth, lead, senior, operational, medical, health, healthcare",2026-02-11T00:00:59+00:00,https://remoteOK.com/remote-jobs/remote-senior-account-manager-feb-2026-zocalo-health-1130192
VP National Accounts,"Integrated Specialty Coverages, LLC",,"growth, management, lead, operations, sales, go",2026-02-11T00:00:45+00:00,https://remoteOK.com/remote-jobs/remote-vp-national-accounts-integrated-specialty-coverages-llc-1130191
Senior Talent Acquisition Manager,Greenhouse,Anywhere in the United States,"manager, saas, senior, go",2026-02-11T00:00:35+00:00,https://remoteOK.com/remote-jobs/remote-senior-talent-acquisition-manager-greenhouse-1130190
Senior Technical Program Manager Infrastructure,Planet,United States,"manager, technical, software, senior",2026-02-10T20:00:37+00:00,https://remoteOK.com/remote-jobs/remote-senior-technical-program-manager-infrastructure-planet-1130189
Web Program Manager,Huntress,United States of America,"web, manager, saas, security, game, senior, operations, go",2026-02-10T19:00:50+00:00,https://remoteOK.com/remote-jobs/remote-web-program-manager-huntress-1130188
Senior Program Manager Workforce Planning,Fluxon,United States,"manager, management, senior, operational, engineering",2026-02-10T19:00:26+00:00,https://remoteOK.com/remote-jobs/remote-senior-program-manager-workforce-planning-fluxon-1130187
Senior Principal SEO GEO & Search Systems,Workwize,Amsterdam,"saas, seo, senior",2026-02-10T17:00:14+00:00,https://remoteOK.com/remote-jobs/remote-senior-principal-seo-geo-search-systems-workwize-1130186
