Job Title,Company,Location,Tags,Date,Apply Link
VP Creative Director,Noodle,"Remote, United States","director, design, support, web, travel, video, education, leader, strategy, management, lead, content, senior, operational, marketing, analytics, sales, digital nomad",2026-04-23T00:01:28+00:00,https://remoteOK.com/remote-jobs/remote-vp-creative-director-noodle-1131284
Associate Director Solutions,YipitData (Alternative),US Remote,"director, technical, investment, analytics",2026-04-23T00:01:22+00:00,https://remoteOK.com/remote-jobs/remote-associate-director-solutions-yipitdata-alternative-1131283
Technical Program Manager — Platform Migration,Cayuse,Remote,"manager, technical, support, test, growth, strategy, lead, senior, operational, health, engineering",2026-04-23T00:01:11+00:00,https://remoteOK.com/remote-jobs/remote-technical-program-manager-platform-migration-cayuse-1131282
Principal Customer Solutions Architect,Caylent,CANADA,"architect, design, amazon, security, technical, web, cloud, lead, sales, executive, digital nomad",2026-04-23T00:00:57+00:00,https://remoteOK.com/remote-jobs/remote-principal-customer-solutions-architect-caylent-1131281
Senior Security Engineer,Bridgewater Associates,Remote,"security, technical, recruiter, developer, software, test, code, investment, cloud, management, senior, engineer, engineering, full-time, digital nomad",2026-04-23T00:00:46+00:00,https://remoteOK.com/remote-jobs/remote-senior-security-engineer-bridgewater-associates-1131280
Business Development Director,Connections Health Solutions,,"director, medical, health",2026-04-23T00:00:34+00:00,https://remoteOK.com/remote-jobs/remote-business-development-director-connections-health-solutions-1131279
Insurance Verifications Specialist,Cranial Technologies,,full-time,2026-04-23T00:00:25+00:00,https://remoteOK.com/remote-jobs/remote-insurance-verifications-specialist-cranial-technologies-1131278
Frontend Engineer,CareerVillage.org,"Remote, United States","frontend, technical, software, code, web, engineer, backend, full-time",2026-04-23T00:00:16+00:00,https://remoteOK.com/remote-jobs/remote-frontend-engineer-careervillage-org-1131277
Senior Account Executive,,,"senior, executive",2026-04-23T00:00:05+00:00,https://remoteOK.com/remote-jobs/remote-senior-account-executive-1131276
Healthcare Account Executive,Vonage,,"software, growth, cloud, api, leader, management, lead, sales, healthcare, executive",2026-04-22T16:00:59+00:00,https://remoteOK.com/remote-jobs/remote-healthcare-account-executive-vonage-1131272
Senior CAD Backend Engineer Mechanical CAD Automation,Foundation EGI,,"design, python, 3d, senior, engineer, engineering, backend, digital nomad",2026-04-22T16:00:50+00:00,https://remoteOK.com/remote-jobs/remote-senior-cad-backend-engineer-mechanical-cad-automation-foundation-egi-1131271
Solution Engineer I,"Onit, Inc.","Pune, Maharashtra","support, software, growth, code, css, microsoft, management, lead, operations, legal, engineer",2026-04-22T16:00:43+00:00,https://remoteOK.com/remote-jobs/remote-solution-engineer-i-onit-inc-1131270
Senior Data Engineer,Capnexus,,"amazon, system, software, cloud, api, lead, senior, engineer, engineering",2026-04-22T16:00:36+00:00,https://remoteOK.com/remote-jobs/remote-senior-data-engineer-capnexus-1131269
Senior App &amp; Frontend Developer AS233,Smart Working Solutions,,"frontend, developer, embedded, architect, technical, testing, growth, cloud, management, senior, junior, marketing, analytics, engineering, apache, digital nomad",2026-04-22T16:00:26+00:00,https://remoteOK.com/remote-jobs/remote-senior-app-amp-frontend-developer-as233-smart-working-solutions-1131268
Provider Services Analyst I,Trend Health Partners,Remote,"analyst, support, software, financial, microsoft, leader, legal, medical, health, healthcare",2026-04-22T16:00:18+00:00,https://remoteOK.com/remote-jobs/remote-provider-services-analyst-i-trend-health-partners-1131267
PPC & Amazon Strategist,Trivium,,"amazon, strategist, growth, video, ads, strategy, lead, senior, marketing, analytics, sales, full-time",2026-04-22T16:00:08+00:00,https://remoteOK.com/remote-jobs/remote-ppc-amazon-strategist-trivium-1131266
Data Scientist,Junction,,"python, technical, cloud, management, lead, analytics, health, healthcare, engineering",2026-04-22T16:00:02+00:00,https://remoteOK.com/remote-jobs/remote-data-scientist-junction-1131265
Shift Lead Downtown,DoorDash USA,"Dallas, TX","support, management, lead, operations, go",2026-04-22T08:00:27+00:00,https://remoteOK.com/remote-jobs/remote-shift-lead-downtown-doordash-usa-1131264
Senior Site Reliability Engineer,Pave Bank,Kuala Lumpur,"crypto, system, security, technical, support, code, financial, fintech, banking, finance, bank, cloud, senior, operations, operational, reliability, engineer",2026-04-22T08:00:17+00:00,https://remoteOK.com/remote-jobs/remote-senior-site-reliability-engineer-pave-bank-1131263
Principal Product Manager,Oportun,,"manager, growth, financial, management, lead, marketing",2026-04-22T08:00:10+00:00,https://remoteOK.com/remote-jobs/remote-principal-product-manager-oportun-1131262
High Paying Hourly Enrollment Specialist,VP Education Group,,customer support,2026-04-22T06:46:22+00:00,https://remoteOK.com/remote-jobs/remote-high-paying-hourly-enrollment-specialist-vp-education-group-1131261
Search Engine Evaluation Specialist Freelance AI Trainer Project,Invisible Agency,United States of America,"trainer, design, training, digital nomad",2026-04-22T00:01:28+00:00,https://remoteOK.com/remote-jobs/remote-search-engine-evaluation-specialist-freelance-ai-trainer-project-invisible-agency-1131259
Senior Security Engineer Vulnerability & Exposure Management,Bridgewater Associates Referrals,,"security, investment, management, senior, engineer",2026-04-22T00:01:19+00:00,https://remoteOK.com/remote-jobs/remote-senior-security-engineer-vulnerability-exposure-management-bridgewater-associates-referrals-1131258
Partner Sales Manager,Prophecy,San Francisco,"manager, design, cloud, operational, marketing, sales, digital nomad",2026-04-22T00:01:10+00:00,https://remoteOK.com/remote-jobs/remote-partner-sales-manager-prophecy-1131257
Associate Product Manager,Automox,"Austin, TX","manager, security, support, ux, director, management, senior, engineering",2026-04-22T00:01:00+00:00,https://remoteOK.com/remote-jobs/remote-associate-product-manager-automox-1131256
Director Human Resources,Cordance,United States,"director, saas, hr, software, growth, financial, leader, senior",2026-04-22T00:00:46+00:00,https://remoteOK.com/remote-jobs/remote-director-human-resources-cordance-1131255
Senior Software Engineer Payments & Monetization,Mighty Networks,,"software, frontend, full-stack, mobile, senior, engineer, backend",2026-04-22T00:00:38+00:00,https://remoteOK.com/remote-jobs/remote-senior-software-engineer-payments-monetization-mighty-networks-1131254
Senior Lead Applied Data Scientist,StyleSeat,,"technical, lead, senior",2026-04-22T00:00:27+00:00,https://remoteOK.com/remote-jobs/remote-senior-lead-applied-data-scientist-styleseat-1131253
Customer Success Manager,Wholesail,,"manager, accounting, financial, operational, go",2026-04-22T00:00:18+00:00,https://remoteOK.com/remote-jobs/remote-customer-success-manager-wholesail-1131252
Senior Cloud Engineer,DV Trading,Remote,"crypto, cryptocurrency, security, support, financial, investment, cloud, management, lead, senior, operational, engineer, engineering",2026-04-22T00:00:08+00:00,https://remoteOK.com/remote-jobs/remote-senior-cloud-engineer-dv-trading-1131251
Senior Account Manager,Keyloop,South Africa,"manager, training, support, growth, director, travel, investment, senior, operational, sales",2026-04-21T16:00:59+00:00,https://remoteOK.com/remote-jobs/remote-senior-account-manager-keyloop-1131249
Manager Digital Media Strategy,"Adswerve, Inc",,"manager, consultancy, technical, support, strategy, lead, senior",2026-04-21T16:00:52+00:00,https://remoteOK.com/remote-jobs/remote-manager-digital-media-strategy-adswerve-inc-1131248
Digital Media Strategist,"Adswerve, Inc",,"consultancy, architect, technical, strategist, testing, growth, strategy, lead, executive",2026-04-21T16:00:34+00:00,https://remoteOK.com/remote-jobs/remote-digital-media-strategist-adswerve-inc-1131247
Product Manager ChartCheck,Radformation,,manager,2026-04-21T16:00:22+00:00,https://remoteOK.com/remote-jobs/remote-product-manager-chartcheck-radformation-1131246
Product Growth Marketer,Happily,,"marketing, product",2026-04-21T13:00:33+00:00,https://remoteOK.com/remote-jobs/remote-product-growth-marketer-happily-1131244
Crypto Trader,Fox GLobal Assets,,"finance, education, crypto, legal, junior, web3, blockchain, defi, part time, other, stats, ops",2026-04-21T08:59:17+00:00,https://remoteOK.com/remote-jobs/remote-crypto-trader-fox-global-assets-1131243
Software Engineer Identity & Access,Patreon,,"software, security, python, support, testing, growth, code, senior, reliability, engineer, engineering",2026-04-21T08:00:36+00:00,https://remoteOK.com/remote-jobs/remote-software-engineer-identity-access-patreon-1131240
Technical Implementations Lead US,Smile Digital Health,Remote US,"system, security, python, technical, support, software, javascript, java, cloud, management, lead, medical, health, healthcare, engineering",2026-04-21T08:00:30+00:00,https://remoteOK.com/remote-jobs/remote-technical-implementations-lead-us-smile-digital-health-1131239
Manager Healthcare Data Analytics,Habitat Health,,"manager, support, analytics, medical, health, healthcare, non tech",2026-04-21T00:01:57+00:00,https://remoteOK.com/remote-jobs/remote-manager-healthcare-data-analytics-habitat-health-1131238
Account Executive Collections Credit Card,BHG Financial,Remote,"training, growth, finance, financial, management, executive",2026-04-21T00:01:49+00:00,https://remoteOK.com/remote-jobs/remote-account-executive-collections-credit-card-bhg-financial-1131237
Sr Technical Program Manager Order Management Services,Natera,US Remote,"manager, system, technical, management, lead, operational, reliability, engineering",2026-04-21T00:01:38+00:00,https://remoteOK.com/remote-jobs/remote-sr-technical-program-manager-order-management-services-natera-1131236
Nurse Care Manager MST,Evergreen Nephrology,,"manager, system, healthcare",2026-04-21T00:01:27+00:00,https://remoteOK.com/remote-jobs/remote-nurse-care-manager-mst-evergreen-nephrology-1131235
Manager Care Team Assistant,Imagine Pediatrics,,"manager, assistant, coordinator, support, health, non tech",2026-04-21T00:01:16+00:00,https://remoteOK.com/remote-jobs/remote-manager-care-team-assistant-imagine-pediatrics-1131234
Senior Product Manager Applied AI,Smartsheet,,"manager, director, management, senior, junior",2026-04-21T00:01:06+00:00,https://remoteOK.com/remote-jobs/remote-senior-product-manager-applied-ai-smartsheet-1131233
Revenue Specialist First Party Auto MVA,EnableComp,,"system, security, support, growth, financial, education, management, health, healthcare",2026-04-21T00:00:55+00:00,https://remoteOK.com/remote-jobs/remote-revenue-specialist-first-party-auto-mva-enablecomp-1131232
SVP Sales,InMarket,,"growth, mobile, leader, lead, operational, marketing, sales",2026-04-21T00:00:08+00:00,https://remoteOK.com/remote-jobs/remote-svp-sales-inmarket-1131231
Senior Technical Lead,Calibrate Group AI,,engineer,2026-04-20T18:38:56+00:00,https://remoteOK.com/remote-jobs/remote-senior-technical-lead-calibrate-group-ai-1131230
Product Engineer,SuperPlane,,"senior, engineer, exec",2026-04-20T16:14:21+00:00,https://remoteOK.com/remote-jobs/remote-product-engineer-superplane-1131228
Interior Design Specifier,Bold Business,"India, Latin America, Philippines","design, designer, technical, support, code, strategy, lead, sales, digital nomad",2026-04-20T16:00:46+00:00,https://remoteOK.com/remote-jobs/remote-interior-design-specifier-bold-business-1131227
Software Engineer Android,Superhuman,Berlin,"software, design, technical, support, ui, assistant, mobile, android, health, engineer, recruitment, educational, full-time, digital nomad",2026-04-20T16:00:36+00:00,https://remoteOK.com/remote-jobs/remote-software-engineer-android-superhuman-1131226
Product Manager Data Platform,Spotify,Toronto,"manager, growth",2026-04-20T16:00:29+00:00,https://remoteOK.com/remote-jobs/remote-product-manager-data-platform-spotify-1131225
Senior EDI e invoicing Integration Engineer with English and German French Italian Chinese,ecosio,,"saas, system, technical, web, cloud, senior, engineer, engineering",2026-04-20T16:00:18+00:00,https://remoteOK.com/remote-jobs/remote-senior-edi-e-invoicing-integration-engineer-with-english-and-german-french-italian-chinese-ecosio-1131224
Field Marketing Manager,Brandwatch,,"manager, growth, voice, strategy, lead, content, marketer, marketing, sales",2026-04-20T16:00:09+00:00,https://remoteOK.com/remote-jobs/remote-field-marketing-manager-brandwatch-1131223
Creative Strategist,Maneuver Marketing,,"strategist, support, testing, growth, financial, video, ads, strategy, content, marketing, health, educational",2026-04-20T08:00:09+00:00,https://remoteOK.com/remote-jobs/remote-creative-strategist-maneuver-marketing-1131221
Creative Strategist,Maneuver Marketing,,"strategist, testing, growth, financial, strategy, marketing, health",2026-04-20T08:00:03+00:00,https://remoteOK.com/remote-jobs/remote-creative-strategist-maneuver-marketing-1131220
Data Analyst,Criptoro,,"other, analyst, crypto, defi, blockchain, web3",2026-04-19T22:35:44+00:00,https://remoteOK.com/remote-jobs/remote-data-analyst-criptoro-1131219
Imaging Research and Development Associate,Alimentiv,,"design, training, support, voice, management, operational, digital nomad",2026-04-19T08:00:33+00:00,https://remoteOK.com/remote-jobs/remote-imaging-research-and-development-associate-alimentiv-1131217
Learning and Development Specialist,Headlight,,"system, training, support, adult, microsoft, management, content, operational, health, healthcare",2026-04-19T08:00:26+00:00,https://remoteOK.com/remote-jobs/remote-learning-and-development-specialist-headlight-1131216
VP of Engineering,Sureify,US,"technical, software, lead, operational, engineering",2026-04-19T08:00:18+00:00,https://remoteOK.com/remote-jobs/remote-vp-of-engineering-sureify-1131215
Licensed Mental Health Counselor,LifeStance Health,"Tacoma, WA","lead, medical, health, healthcare, full-time, non tech",2026-04-19T08:00:07+00:00,https://remoteOK.com/remote-jobs/remote-licensed-mental-health-counselor-lifestance-health-1131214
Business Development Representative Enterprise,Spellbook,,"saas, support, software, test, manager, microsoft, lead, legal, sales, health, recruitment",2026-04-18T16:00:03+00:00,https://remoteOK.com/remote-jobs/remote-business-development-representative-enterprise-spellbook-1131213
Project Manager I,TEECOM,Remote - United States,"manager, training, designer, recruiter, support, travel, financial, microsoft, management, lead, operations, operational, legal, reliability, health, recruiting, recruitment, full-time, non tech",2026-04-18T08:02:00+00:00,https://remoteOK.com/remote-jobs/remote-project-manager-i-teecom-1131212
Customer Success Engineer,Wrike,US,"saas, training, technical, investment, management, lead, senior, engineer",2026-04-18T08:00:11+00:00,https://remoteOK.com/remote-jobs/remote-customer-success-engineer-wrike-1131211
Senior Sales Operations Analyst,Honeycomb.io,United States,"analyst, developer, senior, operations, sales, digital nomad",2026-04-18T00:01:38+00:00,https://remoteOK.com/remote-jobs/remote-senior-sales-operations-analyst-honeycomb-io-1131210
Certified Medical Coder,Cartwheel,"Cambridge, MA","coder, students, director, strategy, lead, operational, health, non tech",2026-04-18T00:01:28+00:00,https://remoteOK.com/remote-jobs/remote-certified-medical-coder-cartwheel-1131209
Vice President Marketing,Imagine Pediatrics,,"support, leader, strategy, marketing, health, non tech",2026-04-18T00:01:19+00:00,https://remoteOK.com/remote-jobs/remote-vice-president-marketing-imagine-pediatrics-1131208
Local Advertising Account Executive,Axios,"Atlanta, GA","testing, financial, healthcare, executive",2026-04-18T00:01:09+00:00,https://remoteOK.com/remote-jobs/remote-local-advertising-account-executive-axios-1131207
Senior Site Reliability Engineer,UJET,"Austin, TX, US","design, system, technical, growth, cloud, leader, senior, operations, operational, reliability, engineer, engineering, digital nomad",2026-04-18T00:01:00+00:00,https://remoteOK.com/remote-jobs/remote-senior-site-reliability-engineer-ujet-1131206
VP People Operations,Machinify,Remote - US,"design, hr, system, financial, operations, health, healthcare, digital nomad",2026-04-18T00:00:47+00:00,https://remoteOK.com/remote-jobs/remote-vp-people-operations-machinify-1131205
Geospatial Database Administrator,Ardent,,"system, support, administrator, management",2026-04-18T00:00:31+00:00,https://remoteOK.com/remote-jobs/remote-geospatial-database-administrator-ardent-1131204
Product Lead Agentic Ads Platform,Hightouch,"SF, NY, Remote","strategist, test, growth, travel, cloud, ads, leader, lead, marketing",2026-04-18T00:00:18+00:00,https://remoteOK.com/remote-jobs/remote-product-lead-agentic-ads-platform-hightouch-1131203
Performance Marketing Manager,Komodo Health,United States,"manager, system, software, marketing, medical, healthcare",2026-04-18T00:00:07+00:00,https://remoteOK.com/remote-jobs/remote-performance-marketing-manager-komodo-health-1131202
Purchasing Specialist III,LG Electronics,"Huntsville, AL","support, c, leader, management, operations, health, non tech",2026-04-17T16:01:06+00:00,https://remoteOK.com/remote-jobs/remote-purchasing-specialist-iii-lg-electronics-1131200
Senior Software Engineer Golang,Insider One,"Istanbul, Turkiye","software, design, saas, system, training, technical, testing, code, voice, senior, marketing, go, golang, health, engineer, engineering, backend, digital nomad",2026-04-17T16:00:57+00:00,https://remoteOK.com/remote-jobs/remote-senior-software-engineer-golang-insider-one-1131199
Sales Executive,OneVest,United States of America,"salesforce, financial, management, sales, executive",2026-04-17T16:00:47+00:00,https://remoteOK.com/remote-jobs/remote-sales-executive-onevest-1131198
Senior Systems Administrator,Entersekt,Oslo,"system, 3d, teaching, financial, banking, administrator, mobile, leader, senior",2026-04-17T16:00:37+00:00,https://remoteOK.com/remote-jobs/remote-senior-systems-administrator-entersekt-1131197
Senior Product Designer,Fluxon,United States,"design, designer, senior, engineering, digital nomad",2026-04-17T16:00:23+00:00,https://remoteOK.com/remote-jobs/remote-senior-product-designer-fluxon-1131196
Master Scheduler,DEFCON AI,USA,"coordinator, software, operational, engineering",2026-04-17T16:00:13+00:00,https://remoteOK.com/remote-jobs/remote-master-scheduler-defcon-ai-1131195
AI Transformation Lead,Insider One,"Istanbul, Turkiye","design, saas, training, technical, support, developer, software, test, code, scrum, voice, qa, strategy, management, lead, marketing, go, health, digital nomad",2026-04-17T16:00:04+00:00,https://remoteOK.com/remote-jobs/remote-ai-transformation-lead-insider-one-1131194
Solution Expert,360Learning,"Canada, Remote","saas, hr, consulting, technical, support, leader, management, lead, health, executive",2026-04-17T08:01:07+00:00,https://remoteOK.com/remote-jobs/remote-solution-expert-360learning-1131192
VP Sales,Unlimit,,"growth, financial, fintech, rails, management, lead, senior, sales",2026-04-17T08:00:58+00:00,https://remoteOK.com/remote-jobs/remote-vp-sales-unlimit-1131191
NEOWIZ Santa Monica Localization Manager,Neowiz,NEOWIZ SANTA MONICA,"manager, game, support, voice, strategy, management, content, operational, marketing, non tech",2026-04-17T08:00:50+00:00,https://remoteOK.com/remote-jobs/remote-neowiz-santa-monica-localization-manager-neowiz-1131190
Executive Director Regulatory Affairs,Kyverna Therapeutics,Remote,"director, support, leader, strategy, management, lead, senior, operational, legal, health, executive",2026-04-17T08:00:43+00:00,https://remoteOK.com/remote-jobs/remote-executive-director-regulatory-affairs-kyverna-therapeutics-1131189
AI Senior Fullstack Engineer,Contentsquare,Germany,"front-end, support, software, web, leader, senior, analytics, engineer, engineering, recruitment, fullstack, full-time",2026-04-17T08:00:35+00:00,https://remoteOK.com/remote-jobs/remote-ai-senior-fullstack-engineer-contentsquare-1131188
Sales Development Representative,Jeeves,Argentina,"system, training, software, financial, finance, fintech, management, lead, content, marketing, sales, full-time",2026-04-17T08:00:28+00:00,https://remoteOK.com/remote-jobs/remote-sales-development-representative-jeeves-1131187
Deputy Director Non entive Programs,CALSTART,"Remote, CA","director, security, training, technical, support, software, growth, travel, bank, leader, strategy, management, content, senior, operational, health, recruiting, recruitment",2026-04-17T08:00:11+00:00,https://remoteOK.com/remote-jobs/remote-deputy-director-non-entive-programs-calstart-1131186
Backend Engineer Rome,Air Apps,Rome,"design, graphql, frontend, support, software, testing, code, financial, cloud, git, operations, reliability, health, engineer, engineering, backend, digital nomad",2026-04-17T08:00:03+00:00,https://remoteOK.com/remote-jobs/remote-backend-engineer-rome-air-apps-1131185
Operations Associate Payment Integrity,Clover Health,USA,"support, financial, management, operations, medical, health, healthcare, backend, non tech",2026-04-17T00:01:18+00:00,https://remoteOK.com/remote-jobs/remote-operations-associate-payment-integrity-clover-health-1131182
Nurse Care Manager Transitions of Care,Evergreen Nephrology,,"manager, system, healthcare",2026-04-17T00:01:10+00:00,https://remoteOK.com/remote-jobs/remote-nurse-care-manager-transitions-of-care-evergreen-nephrology-1131181
Content Compliance Manager OTC Supplements and Cosmetics,Strive Pharmacy,,"manager, content, health, healthcare, non tech",2026-04-17T00:01:02+00:00,https://remoteOK.com/remote-jobs/remote-content-compliance-manager-otc-supplements-and-cosmetics-strive-pharmacy-1131180
Senior Solution Consultant,Highspot,United States,"consultant, salesforce, infosec, technical, support, software, api, microsoft, management, lead, content, senior, sales, health, engineer, executive",2026-04-17T00:00:52+00:00,https://remoteOK.com/remote-jobs/remote-senior-solution-consultant-highspot-1131179
Technical Support Manager,Promenade,Remote,"manager, saas, technical, support, software, voice, management, lead, senior, operations, operational, excel, engineering",2026-04-17T00:00:44+00:00,https://remoteOK.com/remote-jobs/remote-technical-support-manager-promenade-1131178
Creative Director,Runway,,"director, video, leader, content, senior, marketing, go, non tech",2026-04-17T00:00:38+00:00,https://remoteOK.com/remote-jobs/remote-creative-director-runway-1131177
Spanish Bilingual Certified Pharmacy Technician Refill & Medication Adherence,Shields Health Solutions,,"system, support, medical, health",2026-04-17T00:00:31+00:00,https://remoteOK.com/remote-jobs/remote-spanish-bilingual-certified-pharmacy-technician-refill-medication-adherence-shields-health-solutions-1131176
Manager Retention,Evolve,,"manager, consult, strategy, management, lead, senior",2026-04-17T00:00:23+00:00,https://remoteOK.com/remote-jobs/remote-manager-retention-evolve-1131175
Engineering Manager,Calendly,Remote,"manager, technical, software, growth, director, api, leader, senior, engineering",2026-04-17T00:00:14+00:00,https://remoteOK.com/remote-jobs/remote-engineering-manager-calendly-1131174
Senior React Native Developer,Headway,,"engineer, mobile, javascript, react, dev, iOS, android",2026-04-16T18:16:22+00:00,https://remoteOK.com/remote-jobs/remote-senior-react-native-developer-headway-1131173
Global Data Partnership Director,Insider One,United States,"director, saas, training, consulting, test, growth, code, voice, management, content, marketing, sales, go",2026-04-16T16:01:13+00:00,https://remoteOK.com/remote-jobs/remote-global-data-partnership-director-insider-one-1131171
PR Social Media Intern,Sezzle,Colombia,"support, video, fintech, content, marketing, sales, ecommerce, non tech",2026-04-16T16:01:05+00:00,https://remoteOK.com/remote-jobs/remote-pr-social-media-intern-sezzle-1131170
Senior Software Engineer Cloud Platform,Signifyd,United States,"software, system, architect, technical, cloud, management, senior, engineer, engineering",2026-04-16T16:00:56+00:00,https://remoteOK.com/remote-jobs/remote-senior-software-engineer-cloud-platform-signifyd-1131169
