Job Title,Company,Location,Tags,Date,Apply Link
Brand Strategist,Digital,"Boston, Boston, Massachusetts, United States","virtual assistant, education, customer support, dev, travel, microsoft, exec, ops, excel, medical, digital nomad, sys admin, accounting, content writing, recruiter, speech, consulting, strategy, marketing, video, ads, social media",2026-06-12T10:09:34+00:00,https://remoteOK.com/remote-jobs/remote-brand-strategist-digital-1133380
Brand Strategist,Digital,"Los Angeles, Los Angeles, California, United States","virtual assistant, education, customer support, dev, travel, microsoft, exec, ops, excel, medical, digital nomad, sys admin, accounting, content writing, recruiter, speech, consulting, strategy, marketing, video, ads",2026-06-12T10:09:26+00:00,https://remoteOK.com/remote-jobs/remote-brand-strategist-digital-1133374
Freelance Social Media Strategist,Digital,"Boston, Boston, Massachusetts, United States","virtual assistant, education, customer support, dev, travel, microsoft, exec, ops, excel, medical, digital nomad, sys admin, accounting, content writing, recruiter, speech, consulting, strategy, marketing, video, ads, social media",2026-06-12T09:46:12+00:00,https://remoteOK.com/remote-jobs/remote-freelance-social-media-strategist-digital-1133378
Freelance Social Media Strategist,Digital,"Dallas, Dallas, Texas, United States","virtual assistant, education, customer support, dev, travel, microsoft, exec, ops, excel, medical, digital nomad, sys admin, accounting, content writing, recruiter, speech, consulting, strategy, marketing, video, ads, social media",2026-06-12T09:46:10+00:00,https://remoteOK.com/remote-jobs/remote-freelance-social-media-strategist-digital-1133381
Freelance Social Media Strategist,Digital,"New York, New York, New York, United States","exec, customer support, marketing, travel, education, sales, medical, virtual assistant, junior, hr, analyst, design, python, technical, cloud, math, api, data science, ops, stats, digital nomad, consulting, strategy, video, ads, content writing, social media",2026-06-12T09:46:05+00:00,https://remoteOK.com/remote-jobs/remote-freelance-social-media-strategist-digital-1133347
Freelance Social Media Strategist,Digital,"Los Angeles, Los Angeles, California, United States","virtual assistant, education, customer support, dev, travel, microsoft, exec, ops, excel, medical, digital nomad, sys admin, accounting, content writing, recruiter, speech, consulting, strategy, marketing, video, ads, social media",2026-06-12T09:46:03+00:00,https://remoteOK.com/remote-jobs/remote-freelance-social-media-strategist-digital-1133375
Sandwich artist,Subway,"Labrador City, ","medical, full time, education, non tech",2026-06-12T09:44:40+00:00,https://remoteOK.com/remote-jobs/remote-sandwich-artist-subway-1133388
Drug Discovery Analyst,CuraSenseAI,"United States, ","virtual assistant, part time, amazon, customer support, marketing, exec, speech, ops, sales, medical, ecommerce, analyst, design, digital nomad",2026-06-12T08:06:04+00:00,https://remoteOK.com/remote-jobs/remote-drug-discovery-analyst-curasenseai-1133333
Administrative Assistant,The Asher House,,"virtual assistant, part time",2026-06-12T08:00:22+00:00,https://remoteOK.com/remote-jobs/remote-administrative-assistant-the-asher-house-1133331
Trustee,Pickle,,"design, customer support, marketing, accounting, finance, education, exec, senior, ops, excel, legal, medical, recruiter, digital nomad",2026-06-12T08:00:10+00:00,https://remoteOK.com/remote-jobs/remote-trustee-pickle-1133330
