Job Title,Company,Location,Tags,Date,Apply Link
Become a Student Life Coach Flexible Role UK £20 £40 hr,FindTutors,,"hr, education, non tech",2026-06-16T04:08:17+00:00,https://remoteOK.com/remote-jobs/remote-become-a-student-life-coach-flexible-role-uk-20-40-hr-findtutors-1133462
Startup Investment & Strategy Specialist,CapitexAI,,"customer support, analyst, finance, exec",2026-06-16T03:12:10+00:00,https://remoteOK.com/remote-jobs/remote-startup-investment-strategy-specialist-capitexai-1133461
Founding Designer,Leap,"San Francisco, San Francisco, California, United States","music, education, game dev, recruiter, customer support, exec, video, ops, full time, analyst, testing, marketing, finance, microsoft, data science, senior, junior, excel, stats, golang, medical, engineer, design, sys admin, front end, consulting, designer, dev, copywriting, web dev, quality assurance, css, html, ads, content writing, digital nomad",2026-06-16T01:56:01+00:00,https://remoteOK.com/remote-jobs/remote-founding-designer-leap-1133489
Venture Capital & Startup Investment Expert,CapitexAI,,"analyst, customer support, finance, non tech",2026-06-16T01:08:06+00:00,https://remoteOK.com/remote-jobs/remote-venture-capital-startup-investment-expert-capitexai-1133460
FP&A Analyst,CapitexAI,,"analyst, customer support, finance, non tech",2026-06-16T01:02:57+00:00,https://remoteOK.com/remote-jobs/remote-fpa-analyst-capitexai-1133459
North America Field Marketing and Events Manager,Rithum,United States,"exec, dev, marketing, content writing, senior, ops, sales, ecommerce, digital nomad",2026-06-16T00:00:41+00:00,https://remoteOK.com/remote-jobs/remote-north-america-field-marketing-and-events-manager-rithum-1133458
Talent Acquisition Partner,Peak Credit Union,Remote,"education, recruiter, non tech",2026-06-16T00:00:24+00:00,https://remoteOK.com/remote-jobs/remote-talent-acquisition-partner-peak-credit-union-1133457
DevSecOps Engineer,TrueML,"Lenexa, Kansas","design, sys admin, infosec, python, education, docker, technical, recruiter, customer support, dev, testing, marketing, travel, devops, javascript, finance, serverless, cloud, api, exec, ops, engineer, digital nomad",2026-06-16T00:00:10+00:00,https://remoteOK.com/remote-jobs/remote-devsecops-engineer-trueml-1133456
Senior Product Manager,Distru,Remote,"product manager, exec, design, jira, sys admin, technical, dev, testing, marketing, accounting, c, api, senior, ops, sales, engineer, shopify, digital nomad",2026-06-16T00:00:04+00:00,https://remoteOK.com/remote-jobs/remote-senior-product-manager-distru-1133455
Research Analyst,Gritter Francona,"Washington, Washington, District of Columbia, United States","consulting, senior, payroll, admin, design, coordinator, strategy, customer support, marketing, travel, speech, video, seo, exec, content writing, stats, social media, digital nomad, testing, accounting, finance, ops, excel, sales, medical, ecommerce, full time, project manager, jira, embedded, technical, education, microsoft, golang, part time, hr, dev, infosec, analyst",2026-06-15T23:59:33+00:00,https://remoteOK.com/remote-jobs/remote-research-analyst-gritter-francona-1133518
Marketing Assistant,Sleek Marketing,"England, England, United Kingdom","hr, virtual assistant, education, exec, strategy, content writing, ops, marketing, golang, full time, part time",2026-06-15T23:34:54+00:00,https://remoteOK.com/remote-jobs/remote-marketing-assistant-sleek-marketing-1133502
Junior Business &amp; Data Analyst,"Upgrade, Inc.","San Francisco, San Francisco, California, United States","music, education, game dev, recruiter, customer support, exec, video, ops, full time, analyst, testing, marketing, finance, microsoft, data science, senior, junior, excel, stats, golang, medical, engineer",2026-06-15T22:43:02+00:00,https://remoteOK.com/remote-jobs/remote-junior-business-amp-data-analyst-upgrade-inc-1133488
Communications Associate,Discord,San Francisco Bay Area,"music, education, game dev, recruiter, customer support, exec, video, ops, full time",2026-06-15T22:28:15+00:00,https://remoteOK.com/remote-jobs/remote-communications-associate-discord-1133487
Pharmacology Research Specialist,STEM Sync AI,,"exec, design, customer support, marketing, travel, finance, senior, sales, medical, digital nomad, hr, biotech",2026-06-15T21:04:49+00:00,https://remoteOK.com/remote-jobs/remote-pharmacology-research-specialist-stem-sync-ai-1133451
Graphic Designer,The Fountain Group,"San Francisco, San Francisco, California, United States","design, salesforce, hr, designer, technical, dev, web dev, video, marketing, digital nomad",2026-06-15T20:46:22+00:00,https://remoteOK.com/remote-jobs/remote-graphic-designer-the-fountain-group-1133453
Medical Scribe,Angel City VA Recruitment,,"analyst, medical, excel, non tech, dev, virtual assistant, customer support, exec, ops, digital nomad, recruiter",2026-06-15T20:02:19+00:00,https://remoteOK.com/remote-jobs/remote-medical-scribe-angel-city-va-recruitment-1133442
Director National Accounts,Recess,Cincinnati Metropolitan Area,"exec, design, customer support, marketing, travel, finance, senior, sales, medical, digital nomad",2026-06-15T19:57:01+00:00,https://remoteOK.com/remote-jobs/remote-director-national-accounts-recess-1133450
Academic School Mentor &amp; After School Guidance &amp; Flexible Role £20 £40 hr,FindTutors,"London, London, England, United Kingdom","education, writer, customer support, dev, finance, scheme, microsoft, exec, content writing, medical, engineer, digital nomad, design, ops, sales, hr, teaching",2026-06-15T19:34:56+00:00,https://remoteOK.com/remote-jobs/remote-academic-school-mentor-amp-after-school-guidance-amp-flexible-role-20-40-hr-findtutors-1133528
Junior Front End Developer,Work Force Nexus,"Remote, ","exec, design, consulting, customer support, marketing, finance, c, ops, sales, digital nomad, front end, dev, junior, full time",2026-06-15T18:05:00+00:00,https://remoteOK.com/remote-jobs/remote-junior-front-end-developer-work-force-nexus-1133435
Supply Chain Management,Tava Partners,"Pennsylvania, Pennsylvania, United States","music, education, game dev, recruiter, customer support, exec, video, ops, full time, analyst, testing, marketing, finance, microsoft, data science, senior, junior, excel, stats, golang, medical, engineer, design, sys admin, front end, consulting, designer, dev, copywriting, web dev, quality assurance, css, html, ads, content writing, digital nomad",2026-06-15T17:07:06+00:00,https://remoteOK.com/remote-jobs/remote-supply-chain-management-tava-partners-1133490
Lead Specialist,Autoliv,"Jhajjar, ","education, technical, exec",2026-06-15T16:56:28+00:00,https://remoteOK.com/remote-jobs/remote-lead-specialist-autoliv-1133485
Public Relation Freelance,Tiket.com (PT. Global Tiket Network),"Jakarta Raya, ","customer support, travel, exec, marketing",2026-06-15T16:35:28+00:00,https://remoteOK.com/remote-jobs/remote-public-relation-freelance-tiket-com-pt-global-tiket-network-1133433
Joiner,Isle of Man Public Service Careers,"Douglas, ","education, customer support, exec, finance, assembly, scheme, ops, medical, recruiter",2026-06-15T16:10:57+00:00,https://remoteOK.com/remote-jobs/remote-joiner-isle-of-man-public-service-careers-1133524
Water Plant Coordinator,Four Seasons,"Nassau, ","customer support, marketing, exec, education, technical, supervisor, testing, microsoft, infosec, finance, ops, legal, medical, coordinator, engineer",2026-06-15T16:03:23+00:00,https://remoteOK.com/remote-jobs/remote-water-plant-coordinator-four-seasons-1133475
Financial Data Application Specialist Corporate,AlphaSense,Remote - United States,"technical, marketing, exec, finance, content writing, sales, golang",2026-06-15T16:00:27+00:00,https://remoteOK.com/remote-jobs/remote-financial-data-application-specialist-corporate-alphasense-1133432
Regional Sales Manager Lucknow,Johnson &amp; Johnson MedTech,Greater Lucknow Area,"exec, marketing, customer support, design, salesforce, technical, web dev, mobile, medical, digital nomad, sys admin, teaching, education, travel, virtual assistant, senior, ops, sales",2026-06-15T15:59:13+00:00,https://remoteOK.com/remote-jobs/remote-regional-sales-manager-lucknow-johnson-amp-johnson-medtech-1133523
TEST Australia,Faculty,"Sydney, ","testing, technical, finance, medical, recruiter, part time",2026-06-15T15:18:14+00:00,https://remoteOK.com/remote-jobs/remote-test-australia-faculty-1133486
Design Engineer,USB Club,,"engineer, senior, design, dev, front end",2026-06-15T15:00:01+00:00,https://remoteOK.com/remote-jobs/remote-design-engineer-usb-club-1133430
Creative Project Manager,YunoJuno,"West Hollywood, West Hollywood, California, United States","exec, design, customer support, marketing, travel, finance, senior, sales, medical, digital nomad, hr, biotech, project manager, ops",2026-06-15T14:56:51+00:00,https://remoteOK.com/remote-jobs/remote-creative-project-manager-yunojuno-1133452
Receptionist,INVICTA SOFTWARE,,"dev, digital nomad",2026-06-15T14:02:40+00:00,https://remoteOK.com/remote-jobs/remote-receptionist-invicta-software-1133429
Caretaker,South East Employers,"Hailsham, ","education, customer support, exec, finance, assembly, scheme, ops, medical, recruiter, infosec",2026-06-15T13:29:24+00:00,https://remoteOK.com/remote-jobs/remote-caretaker-south-east-employers-1133525
Executive Assistant,Triwill Group,"دبي, دبي الإمارات العربية المتحدة","virtual assistant, technical, customer support, dev, travel, exec, ops, full time, digital nomad",2026-06-15T12:15:29+00:00,https://remoteOK.com/remote-jobs/remote-executive-assistant-triwill-group-1133431
Chief of Staff Operating Partner CEO Office,Stableton,"London, London, England, United Kingdom","exec, design, consulting, customer support, marketing, finance, c, ops, sales, digital nomad",2026-06-15T11:12:04+00:00,https://remoteOK.com/remote-jobs/remote-chief-of-staff-operating-partner-ceo-office-stableton-1133434
Chief of Staff Operating Partner CEO Office,Stableton Financial AG,"Zürich, Zürich, Zürich, Schweiz","exec, design, consulting, customer support, marketing, finance, c, ops, sales, digital nomad, front end, dev, junior, full time",2026-06-15T11:12:00+00:00,https://remoteOK.com/remote-jobs/remote-chief-of-staff-operating-partner-ceo-office-stableton-financial-ag-1133436
Junior Creative Strategist & UGC Co Ordinator,Elavate Superfoods,"United Kingdom, ","strategy, junior",2026-06-15T08:11:01+00:00,https://remoteOK.com/remote-jobs/remote-junior-creative-strategist-ugc-co-ordinator-elavate-superfoods-1133422
AP Operations Analyst,D2B,,"analyst, education, customer support, marketing, accounting, finance, php, microsoft, exec, ops, excel, full time",2026-06-15T08:00:04+00:00,https://remoteOK.com/remote-jobs/remote-ap-operations-analyst-d2b-1133421
Operations Executive,EFICYENT,"دبي, دبي الإمارات العربية المتحدة","customer support, finance, ops, excel, exec",2026-06-15T05:43:36+00:00,https://remoteOK.com/remote-jobs/remote-operations-executive-eficyent-1133424
Entry Level Administrative Assistant,RecruitLytixs Hire,"المدينة, المدينة المدينة السعودية","customer support, finance, ops, excel, exec, design, marketing, sales, medical, digital nomad, education, mobile, full time, virtual assistant, video, microsoft",2026-06-15T05:37:33+00:00,https://remoteOK.com/remote-jobs/remote-entry-level-administrative-assistant-recruitlytixs-hire-1133427
Learning And Development Specialist,DTI (Diversified Technology Inc.),"Chicago, ",,2026-06-15T03:07:17+00:00,https://remoteOK.com/remote-jobs/remote-learning-and-development-specialist-dti-diversified-technology-inc-1133417
Business Analyst BFSI,WNS,"Bengaluru, Bengaluru, Karnataka, India","analyst, travel, finance, exec, ops, stats, medical",2026-06-14T17:44:33+00:00,https://remoteOK.com/remote-jobs/remote-business-analyst-bfsi-wns-1133503
Executive Assistant the Founders,Silhouette Group Inc.,,"virtual assistant, admin, education, customer support, marketing, part time, non tech, travel, exec",2026-06-14T15:07:23+00:00,https://remoteOK.com/remote-jobs/remote-executive-assistant-the-founders-silhouette-group-inc-1133407
Admin Virtual Assistant,myVA Rocks,,"virtual assistant, admin",2026-06-14T15:03:37+00:00,https://remoteOK.com/remote-jobs/remote-admin-virtual-assistant-myva-rocks-1133405
Social Media Marketing Specialist,Strange Face,"London, London, England, United Kingdom","ios, exec, speech, video, content writing, marketing, social media",2026-06-14T14:36:16+00:00,https://remoteOK.com/remote-jobs/remote-social-media-marketing-specialist-strange-face-1133411
Brand Designer Project,Twine,"Australia, ","designer, ads",2026-06-14T13:07:52+00:00,https://remoteOK.com/remote-jobs/remote-brand-designer-project-twine-1133404
Production Utility,FXI,"Santa Teresa, ","testing, design, dev, recruiter, digital nomad, exec, medical",2026-06-14T11:06:23+00:00,https://remoteOK.com/remote-jobs/remote-production-utility-fxi-1133415
Medical Scribe Female Only,Angel City VA Recruitment,,"recruiter, non tech",2026-06-14T02:10:34+00:00,https://remoteOK.com/remote-jobs/remote-medical-scribe-female-only-angel-city-va-recruitment-1133399
test,Fluidstack,"San Francisco, ","testing, design, dev, recruiter, digital nomad",2026-06-14T00:32:52+00:00,https://remoteOK.com/remote-jobs/remote-test-fluidstack-1133414
Illustrator,Odixcity Consulting,,"architecture, microsoft, exec, junior, consulting, illustrator, full time",2026-06-14T00:08:57+00:00,https://remoteOK.com/remote-jobs/remote-illustrator-odixcity-consulting-1133397
Programa Futuros Profesionales Productos Digitales,Universia Argentina,Buenos Aires y alrededores,,2026-06-13T23:36:41+00:00,https://remoteOK.com/remote-jobs/remote-programa-futuros-profesionales-productos-digitales-universia-argentina-1133398
Customer Service Representative,Point72,"New York, New York, United States","virtual assistant, admin, education, customer support, marketing, part time, non tech",2026-06-13T10:19:12+00:00,https://remoteOK.com/remote-jobs/remote-customer-service-representative-point72-1133406
Sports Events Coordinator,Work From Home Co.,"California, California, United States","design, salesforce, hr, designer, technical, dev, web dev, video, marketing, digital nomad, work from home, education, coordinator, customer support, travel, exec, ops",2026-06-13T07:26:40+00:00,https://remoteOK.com/remote-jobs/remote-sports-events-coordinator-work-from-home-co-1133454
Various Positions,Northern News Services,"Northwest Territories, ","medical, full time",2026-06-13T05:54:11+00:00,https://remoteOK.com/remote-jobs/remote-various-positions-northern-news-services-1133385
Chat Suppore,OnlineJobs.PH,"ห้างฉัตร, ","saas, technical, customer support, dev, ops, full time, digital nomad",2026-06-13T04:50:59+00:00,https://remoteOK.com/remote-jobs/remote-chat-suppore-onlinejobs-ph-1133367
Junior ML Engineer,Work Force Nexus,"Remote, ","junior, engineer, full time",2026-06-13T03:09:27+00:00,https://remoteOK.com/remote-jobs/remote-junior-ml-engineer-work-force-nexus-1133365
Se solicita Gestor de Cobros,Tu Empleo RD,"Santo Domingo Este, ",,2026-06-13T02:50:25+00:00,https://remoteOK.com/remote-jobs/remote-se-solicita-gestor-de-cobros-tu-empleo-rd-1133400
Administrative Assistant,aramco,"Atlanta, Atlanta, Georgia, United States","virtual assistant, education, customer support, dev, travel, microsoft, exec, ops, excel, medical, digital nomad, sys admin, accounting, content writing, recruiter, speech, consulting, strategy, marketing, video, ads, social media",2026-06-13T01:29:49+00:00,https://remoteOK.com/remote-jobs/remote-administrative-assistant-aramco-1133376
Template,Pizza Pilgrims,"Birmingham, ","customer support, ads, non tech",2026-06-13T01:23:58+00:00,https://remoteOK.com/remote-jobs/remote-template-pizza-pilgrims-1133392
Administrative Assistant,aramco,"Cuyahoga County, Cuyahoga County, Ohio, United States","virtual assistant, education, customer support, dev, travel, microsoft, exec, ops, excel, medical, digital nomad, sys admin, accounting, content writing, recruiter, speech",2026-06-13T01:21:17+00:00,https://remoteOK.com/remote-jobs/remote-administrative-assistant-aramco-1133373
Administrative Assistant,aramco,"Chicago, Chicago, Illinois, United States","virtual assistant, education, customer support, dev, travel, microsoft, exec, ops, excel, medical, digital nomad, sys admin, accounting, content writing, recruiter, speech, consulting, strategy, marketing, video, ads, social media",2026-06-13T01:09:42+00:00,https://remoteOK.com/remote-jobs/remote-administrative-assistant-aramco-1133379
Administrative Assistant,aramco,"Kings County, Kings County, New York, United States","virtual assistant, education, customer support, dev, travel, microsoft, exec, ops, excel, medical, digital nomad",2026-06-13T01:08:52+00:00,https://remoteOK.com/remote-jobs/remote-administrative-assistant-aramco-1133368
Administrative Assistant,aramco,"Worcester County, Worcester County, Massachusetts, United States","virtual assistant, education, customer support, dev, travel, microsoft, exec, ops, excel, medical, digital nomad, sys admin, accounting, content writing, recruiter, speech, consulting, strategy, marketing, video, ads, social media",2026-06-13T01:07:58+00:00,https://remoteOK.com/remote-jobs/remote-administrative-assistant-aramco-1133377
Administrative Assistant,aramco,"Broward County, Broward County, Florida, United States","virtual assistant, education, customer support, dev, travel, microsoft, exec, ops, excel, medical, digital nomad, sys admin, accounting, content writing, recruiter, speech",2026-06-13T01:07:03+00:00,https://remoteOK.com/remote-jobs/remote-administrative-assistant-aramco-1133371
Administrative Assistant,aramco,"Los Angeles, Los Angeles, California, United States","virtual assistant, education, customer support, dev, travel, microsoft, exec, ops, excel, medical, digital nomad, sys admin, accounting, content writing, recruiter, speech",2026-06-13T01:04:28+00:00,https://remoteOK.com/remote-jobs/remote-administrative-assistant-aramco-1133372
SEO Content Writer,Inspira Education,"Remote, USA","teaching, exec, writer, dev, marketing, education, seo, content writing, senior, legal, digital nomad",2026-06-13T00:00:22+00:00,https://remoteOK.com/remote-jobs/remote-seo-content-writer-inspira-education-1133357
Customer Experience Associate,Ollie,"Nashville, Nashville, Tennessee, United States","virtual assistant, education, customer support, dev, travel, microsoft, exec, ops, excel, medical, digital nomad, sys admin, accounting, content writing, recruiter, speech",2026-06-12T23:38:17+00:00,https://remoteOK.com/remote-jobs/remote-customer-experience-associate-ollie-1133370
Interdisciplinary,US Army Corps of Engineers,"Savannah, ","customer support, dev, mobile, golang, engineer, recruiter, digital nomad",2026-06-12T21:58:13+00:00,https://remoteOK.com/remote-jobs/remote-interdisciplinary-us-army-corps-of-engineers-1133360
Student Success Advisor Evenings,Walden University,"Columbia, Columbia, Maryland, United States","infosec, teaching, education, customer support, adult, microsoft, exec, medical",2026-06-12T21:48:38+00:00,https://remoteOK.com/remote-jobs/remote-student-success-advisor-evenings-walden-university-1133418
Atendimento ao cliente,Pluris Mídia,"São Paulo, São Paulo, São Paulo, Brasil",,2026-06-12T21:43:42+00:00,https://remoteOK.com/remote-jobs/remote-atendimento-ao-cliente-pluris-midia-1133391
Logistics & Operations Assistant,Valatam,,"education, testing, web dev, content writing, recruiter, non tech, virtual assistant, ops",2026-06-12T21:07:37+00:00,https://remoteOK.com/remote-jobs/remote-logistics-operations-assistant-valatam-1133356
Monitorear noticias sobre panorama informativo con énfasis en migración,VNU Sénégal/Gambie,"Greater Porlamar, ","education, testing, web dev, content writing, recruiter, non tech",2026-06-12T20:45:18+00:00,https://remoteOK.com/remote-jobs/remote-monitorear-noticias-sobre-panorama-informativo-con-enfasis-en-migracion-vnu-senegal-gambie-1133355
Strategic Partnerships Director,peopleworth,"Brisbane, Brisbane, Queensland, Australia","exec, customer support, marketing, video, education, senior, ops, recruiter",2026-06-12T19:53:22+00:00,https://remoteOK.com/remote-jobs/remote-strategic-partnerships-director-peopleworth-1133366
Medical Claims Support I,Moda Health,"Portland, ","virtual assistant, education, customer support, dev, travel, microsoft, exec, ops, excel, medical, digital nomad, sys admin, accounting, content writing, recruiter",2026-06-12T19:20:12+00:00,https://remoteOK.com/remote-jobs/remote-medical-claims-support-i-moda-health-1133369
Administrative Assistant,Somewhere,"Latin America, ","dev, web dev, c, excel, non tech, digital nomad, virtual assistant, full time",2026-06-12T19:03:31+00:00,https://remoteOK.com/remote-jobs/remote-administrative-assistant-somewhere-1133350
ÉQUIPE MET,The Home Depot Canada,"Toronto, ","medical, full time",2026-06-12T19:03:31+00:00,https://remoteOK.com/remote-jobs/remote-equipe-met-the-home-depot-canada-1133386
BCCHW Trainer,Belle,"Georgia, Georgia, United States","infosec, teaching, education, customer support, adult, microsoft, exec, medical, hr, supervisor, travel, ops, recruiter, part time",2026-06-12T18:52:09+00:00,https://remoteOK.com/remote-jobs/remote-bcchw-trainer-belle-1133420
Hotel Storekeeper,Carnival Corporation,"East Grand Bahama, ","customer support, marketing, exec, education, technical, supervisor, testing, microsoft, infosec, finance, ops, legal, medical, coordinator, engineer, dev, digital nomad",2026-06-12T18:31:08+00:00,https://remoteOK.com/remote-jobs/remote-hotel-storekeeper-carnival-corporation-1133476
HR Services Contact Center Associate,The Home Depot,"Atlanta, ","infosec, teaching, education, customer support, adult, microsoft, exec, medical, hr, supervisor, travel",2026-06-12T17:49:51+00:00,https://remoteOK.com/remote-jobs/remote-hr-services-contact-center-associate-the-home-depot-1133419
Social Media Coordinator,The Sociable Society,"Toronto, Toronto, Ontario, Canada","exec, content writing, marketing, stats, social media, full time, coordinator, customer support, speech, video",2026-06-12T17:25:39+00:00,https://remoteOK.com/remote-jobs/remote-social-media-coordinator-the-sociable-society-1133362
Junior Human Resources Assistant,Helic & Co.,"United States, ","exec, customer support, marketing, travel, education, sales, medical, virtual assistant, junior, hr",2026-06-12T17:07:39+00:00,https://remoteOK.com/remote-jobs/remote-junior-human-resources-assistant-helic-co-1133345
Paralegal,Obelisk Support,"Cambridge, Cambridge, England, United Kingdom","customer support, admin, content writing, senior, legal, recruiter, part time, non tech",2026-06-12T15:45:24+00:00,https://remoteOK.com/remote-jobs/remote-paralegal-obelisk-support-1133352
Other Position,PicCollage 拼貼趣,"台北, ","customer support, exec, recruiter",2026-06-12T15:19:13+00:00,https://remoteOK.com/remote-jobs/remote-other-position-piccollage-1133395
Data Analyst,ActivTrak,"Austin, Austin, Texas, United States","exec, customer support, marketing, travel, education, sales, medical, virtual assistant, junior, hr, analyst, design, python, technical, cloud, math, api, data science, ops, stats, digital nomad",2026-06-12T14:34:23+00:00,https://remoteOK.com/remote-jobs/remote-data-analyst-activtrak-1133346
Trade Marketing &amp; Brand Activation Manager,Cloetta,"New York, New York, United States","exec, customer support, marketing, travel, education, sales, medical",2026-06-12T14:21:32+00:00,https://remoteOK.com/remote-jobs/remote-trade-marketing-amp-brand-activation-manager-cloetta-1133344
Head of B2B,Hilo by Aktiia,"London, London, England, United Kingdom","strategy, junior, marketing, travel, finance, exec, medical",2026-06-12T14:18:39+00:00,https://remoteOK.com/remote-jobs/remote-head-of-b2b-hilo-by-aktiia-1133423
Horario fijo Turno Mañana Solo de L a S Asesor de Ventas Con o sin Experiencia Planilla completa,Netcall Group,"Lima, Lima, Perú","web dev, c",2026-06-12T13:04:43+00:00,https://remoteOK.com/remote-jobs/remote-horario-fijo-turno-manana-solo-de-l-a-s-asesor-de-ventas-con-o-sin-experiencia-planilla-completa-netcall-group-1133410
Copywriting Lead Freelance,eStoreLabs,"Warszawa, Warszawa, Woj. Mazowieckie, Polska","customer support, admin, content writing, senior, legal, recruiter, part time, non tech, teaching, education, mobile, full time, copywriting, seo, exec, sales, ecommerce",2026-06-12T11:42:45+00:00,https://remoteOK.com/remote-jobs/remote-copywriting-lead-freelance-estorelabs-1133354
Skilled Handyman,Red Deer Polytechnic,"Red Deer, ","medical, full time, education, non tech, customer support, dev, marketing, digital nomad",2026-06-12T11:13:23+00:00,https://remoteOK.com/remote-jobs/remote-skilled-handyman-red-deer-polytechnic-1133389
Amo,Vashi Integrated Solutions,"Bhiwandi, ",full time,2026-06-12T11:01:40+00:00,https://remoteOK.com/remote-jobs/remote-amo-vashi-integrated-solutions-1133337
🚀 Hiring BlueYonder Professionals PAN INDIA,Covetus,"Bengaluru, ","full time, sys admin, technical, dev, exec, digital nomad",2026-06-12T10:57:07+00:00,https://remoteOK.com/remote-jobs/remote-hiring-blueyonder-professionals-pan-india-covetus-1133338
Localisation Linguist,DNEG,"London, London, England, United Kingdom","design, sys admin, education, technical, customer support, speech, linguistics, quality assurance, content writing, engineer, digital nomad",2026-06-12T10:39:59+00:00,https://remoteOK.com/remote-jobs/remote-localisation-linguist-dneg-1133336
