Job Title,Company,Location,Tags,Date,Apply Link
Client Success Analyst,Termgrid,"India, ",analyst,2026-06-12T03:12:48+00:00,https://remoteOK.com/remote-jobs/remote-client-success-analyst-termgrid-1133318
Online Bidder,JSR Technologies Pvt. Ltd.,"Ludhiana, ","full time, sys admin, technical, dev, exec, digital nomad, sales",2026-06-12T01:52:57+00:00,https://remoteOK.com/remote-jobs/remote-online-bidder-jsr-technologies-pvt-ltd-1133339
Especialista de Soporte Service Desk Remoto Horario rotativo,Canvia,"Lima, Lima, Perú","dev, web dev, c, excel, non tech, digital nomad",2026-06-12T01:08:08+00:00,https://remoteOK.com/remote-jobs/remote-especialista-de-soporte-service-desk-remoto-horario-rotativo-canvia-1133349
Care Specialist,Mixlab,,"virtual assistant, design, digital nomad, infosec, teaching, education, customer support, testing, marketing, travel, exec, finance, video, content writing, medical, recruiter, full time",2026-06-12T00:07:25+00:00,https://remoteOK.com/remote-jobs/remote-care-specialist-mixlab-1133302
Pharmaceutical Research Specialist,CuraSenseAI,"United States, ","virtual assistant, design, digital nomad",2026-06-12T00:01:54+00:00,https://remoteOK.com/remote-jobs/remote-pharmaceutical-research-specialist-curasenseai-1133298
Medical Administrative Assistant,CuraSenseAI,"United States, ",virtual assistant,2026-06-12T00:01:08+00:00,https://remoteOK.com/remote-jobs/remote-medical-administrative-assistant-curasenseai-1133297
Director of Technical Solutions,Triple Whale,Remote - US,"exec, sys admin, technical, senior, marketing, engineer",2026-06-12T00:00:40+00:00,https://remoteOK.com/remote-jobs/remote-director-of-technical-solutions-triple-whale-1133296
Chief of Staff GM Advertising,Instacart,,"consulting, customer support, marketing, speech, exec, finance, ads, content writing, senior, ops",2026-06-12T00:00:24+00:00,https://remoteOK.com/remote-jobs/remote-chief-of-staff-gm-advertising-instacart-1133295
Implementation Project Manager,"Intellum, Inc.",Remote,"project manager, exec, saas, amazon, technical, customer support, marketing, education, sales, medical, engineer",2026-06-12T00:00:17+00:00,https://remoteOK.com/remote-jobs/remote-implementation-project-manager-intellum-inc-1133294
Guru Field Representative Orlando,Brooks Running,"US, Remote","customer support, travel, c, math, exec, marketing, sales, education",2026-06-12T00:00:03+00:00,https://remoteOK.com/remote-jobs/remote-guru-field-representative-orlando-brooks-running-1133293
Healthcare Manager,CuraSenseAI,"Orem, ","analyst, ios, sys admin, consulting, technical, customer support, dev, marketing, microsoft, mobile, exec, biotech, digital nomad, ops, medical",2026-06-11T22:03:50+00:00,https://remoteOK.com/remote-jobs/remote-healthcare-manager-curasenseai-1133290
Medical Secretary,CuraSenseAI,,,2026-06-11T22:00:59+00:00,https://remoteOK.com/remote-jobs/remote-medical-secretary-curasenseai-1133288
Confidential Search,Chandos Construction,"Edmonton, ","senior, ops, education, payroll, non tech, sys admin, supervisor, infosec, technical, customer support, transcribing, finance, medical, recruiter",2026-06-11T21:28:55+00:00,https://remoteOK.com/remote-jobs/remote-confidential-search-chandos-construction-1133309
Learning &amp; Development Specialist,HealthCorps,"Arizona, Arizona, United States","design, infosec, teaching, education, customer support, testing, marketing, travel, exec, finance, video, content writing, medical, recruiter, full time, digital nomad",2026-06-11T19:57:38+00:00,https://remoteOK.com/remote-jobs/remote-learning-amp-development-specialist-healthcorps-1133320
Learning &amp; Development Specialist,HealthCorps,"Pennsylvania, Pennsylvania, United States","virtual assistant, design, digital nomad, infosec, teaching, education, customer support, testing, marketing, travel, exec, finance, video, content writing, medical, recruiter, full time",2026-06-11T19:57:21+00:00,https://remoteOK.com/remote-jobs/remote-learning-amp-development-specialist-healthcorps-1133300
Learning &amp; Development Specialist,HealthCorps,"Texas, Texas, United States","virtual assistant, design, digital nomad, infosec, teaching, education, customer support, testing, marketing, travel, exec, finance, video, content writing, medical, recruiter, full time",2026-06-11T18:56:39+00:00,https://remoteOK.com/remote-jobs/remote-learning-amp-development-specialist-healthcorps-1133301
Learning &amp; Development Specialist,HealthCorps,"Florida, Florida, United States","virtual assistant, design, digital nomad, infosec, teaching, education, customer support, testing, marketing, travel, exec, finance, video, content writing, medical, recruiter, full time",2026-06-11T18:56:36+00:00,https://remoteOK.com/remote-jobs/remote-learning-amp-development-specialist-healthcorps-1133299
test,Doctor's Recruiter.com,"Andaman and Nicobar Islands, ","testing, recruiter, non tech",2026-06-11T17:18:20+00:00,https://remoteOK.com/remote-jobs/remote-test-doctors-recruiter-com-1133284
Customer Experience Manager in,empact,,"exec, sys admin, dev, design, finance, digital nomad",2026-06-11T16:00:37+00:00,https://remoteOK.com/remote-jobs/remote-customer-experience-manager-in-empact-1133281
Customer Success Manager Senior,Orquest - Retail Smart Planning,,"customer support, exec, saas, dev, marketing, c, senior, ops, excel, sales, medical, digital nomad",2026-06-11T16:00:30+00:00,https://remoteOK.com/remote-jobs/remote-customer-success-manager-senior-orquest-retail-smart-planning-1133280
Civil Engineer EN 8.42,Credence,,"design, education, technical, customer support, virtual assistant, exec, medical, engineer, part time, digital nomad",2026-06-11T16:00:24+00:00,https://remoteOK.com/remote-jobs/remote-civil-engineer-en-8-42-credence-1133279
Digital Marketing Manager Dayshift,D2B,,"exec, design, customer support, marketing, seo, ads, microsoft, content writing, ops, sales, digital nomad",2026-06-11T16:00:18+00:00,https://remoteOK.com/remote-jobs/remote-digital-marketing-manager-dayshift-d2b-1133278
Program Manager Fulfillment Operations,SupplyHouse.com,Remote,"exec, sys admin, marketing, finance, ops, ecommerce",2026-06-11T16:00:12+00:00,https://remoteOK.com/remote-jobs/remote-program-manager-fulfillment-operations-supplyhouse-com-1133277
Rural and Suburban Mail Carrier,Canada Post / Postes Canada,"Saint Vincent's-Saint Stephen's-Peter's River, ","senior, ops, education, payroll, non tech, sys admin, supervisor, infosec, technical, customer support, transcribing, finance, medical, recruiter, exec, part time, marketing, full time",2026-06-11T15:46:19+00:00,https://remoteOK.com/remote-jobs/remote-rural-and-suburban-mail-carrier-canada-post-postes-canada-1133312
Director Operations Logistics,Cloetta,"New York, New York, United States","design, infosec, teaching, education, customer support, testing, marketing, travel, exec, finance, video, content writing, medical, recruiter, full time, digital nomad, architecture, senior, ops, sys admin",2026-06-11T15:30:43+00:00,https://remoteOK.com/remote-jobs/remote-director-operations-logistics-cloetta-1133321
General Interest Application,US Mobile,"New York, ","customer support, dev, mobile, golang, engineer, recruiter, digital nomad",2026-06-11T14:56:56+00:00,https://remoteOK.com/remote-jobs/remote-general-interest-application-us-mobile-1133358
sdf,Women Builders Council,,"full time, other",2026-06-11T14:43:27+00:00,https://remoteOK.com/remote-jobs/remote-sdf-women-builders-council-1133263
asdffd,Women Builders Council,,"full time, other",2026-06-11T14:36:18+00:00,https://remoteOK.com/remote-jobs/remote-asdffd-women-builders-council-1133262
sadfsdf,Women Builders Council,,"full time, other",2026-06-11T14:35:57+00:00,https://remoteOK.com/remote-jobs/remote-sadfsdf-women-builders-council-1133261
sdsfda,Women Builders Council,,"full time, other",2026-06-11T14:34:20+00:00,https://remoteOK.com/remote-jobs/remote-sdsfda-women-builders-council-1133260
E Commerce Sales Executive,FoodMe Global / Dine Palace,,"dev, junior, engineer, digital nomad, hr, data entry, exec, front end, design, react, react.js, infosec, docker, technical, customer support, testing, marketing, web dev, javascript, cloud, git, typescript, angular, stats, medical, recruiter, backend, payroll, admin, microsoft, ops, excel, legal, virtual assistant, teaching, education, senior, ecommerce, sales",2026-06-11T14:10:01+00:00,https://remoteOK.com/remote-jobs/remote-e-commerce-sales-executive-foodme-global-dine-palace-1133259
Junior Software Engineer,StatusNeo,"India, ","dev, junior, engineer, digital nomad",2026-06-11T14:00:44+00:00,https://remoteOK.com/remote-jobs/remote-junior-software-engineer-statusneo-1133251
Medical Editor,"Synchrony Group, LLC","West Chester, West Chester, Pennsylvania, United States","analyst, ios, sys admin, consulting, technical, customer support, dev, marketing, microsoft, mobile, exec, biotech, digital nomad, ops, medical, education, video, content writing, excel",2026-06-11T13:42:33+00:00,https://remoteOK.com/remote-jobs/remote-medical-editor-synchrony-group-llc-1133291
Data Scientist,Why Hiring,"Canada, ","customer support, jira, designer, speech, exec, ops, ecommerce, shopify, data science",2026-06-11T13:06:18+00:00,https://remoteOK.com/remote-jobs/remote-data-scientist-why-hiring-1133248
Courier,FedEx,"Kanpur, ","testing, recruiter, non tech, infosec, education, customer support, marketing, exec, finance, ops, medical, engineer",2026-06-11T12:17:33+00:00,https://remoteOK.com/remote-jobs/remote-courier-fedex-1133286
Auxiliar Administrativo Remoto,Empresa Confidencial,"Taboão da Serra, ",,2026-06-11T11:33:28+00:00,https://remoteOK.com/remote-jobs/remote-auxiliar-administrativo-remoto-empresa-confidencial-1133267
Assistente Administrativo Remoto,Empresa Confidencial,"Taboão da Serra, ","marketing, non tech",2026-06-11T11:33:28+00:00,https://remoteOK.com/remote-jobs/remote-assistente-administrativo-remoto-empresa-confidencial-1133270
Life Coach for Students Online Role,FindTutors,"United Kingdom, ","dev, backend, digital nomad, embedded, sys admin, coordinator, customer support, marketing, speech, exec, virtual assistant, finance, cloud, ops, ecommerce, full time, teaching",2026-06-11T11:08:59+00:00,https://remoteOK.com/remote-jobs/remote-life-coach-for-students-online-role-findtutors-1133244
Backend Developer,360Dialog,"Serbia, ","dev, backend, digital nomad",2026-06-11T11:00:57+00:00,https://remoteOK.com/remote-jobs/remote-backend-developer-360dialog-1133242
Junior Web Designer,INFUSE,"Baki, Baki, Jawa Tengah, Indonesia","web dev, design, hr, infosec, designer, customer support, testing, marketing, exec, video, css, html, microsoft, content writing, junior, photoshop, recruiter, illustrator, digital nomad",2026-06-11T09:53:23+00:00,https://remoteOK.com/remote-jobs/remote-junior-web-designer-infuse-1133315
Territory Sales Officer,Unilever,"Lucknow, Lucknow, Uttar Pradesh, India","sys admin, front end, backend, exec, excel, sales, full time",2026-06-11T09:40:31+00:00,https://remoteOK.com/remote-jobs/remote-territory-sales-officer-unilever-1133364
Triage Paralegal,General Legal (YC26),,"education, technical, customer support, dev, testing, marketing, finance, video, sales, golang, medical, digital nomad, design, coordinator, exec, content writing, social media, engineer, senior, ops, excel, recruiter, react, sys admin, front end, travel, javascript, data entry, legal, full time",2026-06-11T07:12:36+00:00,https://remoteOK.com/remote-jobs/remote-triage-paralegal-general-legal-yc26-1133241
Virtual Data Entry,Sundayy,,"education, technical, customer support, dev, testing, marketing, finance, video, sales, golang, medical, digital nomad, design, coordinator, exec, content writing, social media, engineer, senior, ops, excel, recruiter, react, sys admin, front end, travel, javascript, data entry",2026-06-11T07:11:09+00:00,https://remoteOK.com/remote-jobs/remote-virtual-data-entry-sundayy-1133240
Learning Project Manager,Learnlight,,"customer support, scheme, microsoft, exec, excel, medical, recruiter, project manager",2026-06-11T06:10:57+00:00,https://remoteOK.com/remote-jobs/remote-learning-project-manager-learnlight-1133233
E&C Estimator,Shermco Industries,"US Virgin Islands, ","infosec, finance, exec, travel, c",2026-06-11T05:05:19+00:00,https://remoteOK.com/remote-jobs/remote-ec-estimator-shermco-industries-1133230
Administrative Assistant,Somewhere,"Sri Lanka, ","virtual assistant, full time, hr, marketing, exec, bus dev, sales, recruiter",2026-06-11T03:13:13+00:00,https://remoteOK.com/remote-jobs/remote-administrative-assistant-somewhere-1133226
Medical Virtual Assistant,Virtual Rockstar Careers,"Philippines, ","virtual assistant, full time",2026-06-11T03:08:19+00:00,https://remoteOK.com/remote-jobs/remote-medical-virtual-assistant-virtual-rockstar-careers-1133224
COURIER,DHL Express,"Kingston, ","infosec, finance, exec",2026-06-11T02:16:16+00:00,https://remoteOK.com/remote-jobs/remote-courier-dhl-express-1133229
Casual Customer Service Executive,Arsenal Football Club,"London, London, England, United Kingdom","customer support, scheme, microsoft, exec, excel, medical, recruiter",2026-06-11T01:22:26+00:00,https://remoteOK.com/remote-jobs/remote-casual-customer-service-executive-arsenal-football-club-1133232
Asistente Ejecutivo a y de Operaciones,our common home,"Madrid, Madrid, Comunidad de Madrid, España","customer support, scheme, microsoft, exec, excel, medical, recruiter, project manager",2026-06-11T01:22:20+00:00,https://remoteOK.com/remote-jobs/remote-asistente-ejecutivo-a-y-de-operaciones-our-common-home-1133234
Clinical Research Professional,CuraSenseAI,"United Kingdom, ","analyst, teaching, customer support, data science, content writing, junior, excel, sys admin, non tech, dev, backend, digital nomad, embedded, coordinator, marketing, speech, exec, virtual assistant, finance, cloud, ops, ecommerce, full time, design, python, technical, travel, javascript, flutter, typescript, medical, engineer, shopify, hr, education, scheme, admin, microsoft, part time, mobile, game dev, testing",2026-06-11T01:14:21+00:00,https://remoteOK.com/remote-jobs/remote-clinical-research-professional-curasenseai-1133219
English speaking Support Associate,Wolt,,"analyst, teaching, customer support, data science, content writing, junior, excel, sys admin, non tech, dev, backend, digital nomad, embedded, coordinator, marketing, speech, exec, virtual assistant, finance, cloud, ops, ecommerce, full time, design, python, technical, travel, javascript, flutter, typescript, medical, engineer, shopify, hr, education, scheme, admin, microsoft, part time",2026-06-11T01:04:44+00:00,https://remoteOK.com/remote-jobs/remote-english-speaking-support-associate-wolt-1133210
Backend Developer,360Dialog,,"analyst, teaching, customer support, data science, content writing, junior, excel, sys admin, non tech, dev, backend, digital nomad",2026-06-11T01:00:47+00:00,https://remoteOK.com/remote-jobs/remote-backend-developer-360dialog-1133201
Backend Developer,360Dialog,"Polska, ","analyst, teaching, customer support, data science, content writing, junior, excel, sys admin, non tech, dev, backend, digital nomad",2026-06-11T01:00:28+00:00,https://remoteOK.com/remote-jobs/remote-backend-developer-360dialog-1133200
Service Desk Analyst 11am 8pm,Slipstream Life Sciences,"Pennsylvania, Pennsylvania, United States","analyst, ios, sys admin, consulting, technical, customer support, dev, marketing, microsoft, mobile, exec, biotech, digital nomad",2026-06-11T00:00:00+00:00,https://remoteOK.com/remote-jobs/remote-service-desk-analyst-11am-8pm-slipstream-life-sciences-1133289
Photographer,University of Florida,"North Port-Sarasota Area, ","teaching, education, technical, customer support, dev, travel, video, exec, content writing, photoshop, medical, ads, digital nomad",2026-06-11T00:00:00+00:00,https://remoteOK.com/remote-jobs/remote-photographer-university-of-florida-1133334
Contador a recibido o estudiante avanzado Para Estudio Contable \ Hibrido Zona Norte,Universia Argentina,"Córdoba, Córdoba, Córdoba, Argentina","dev, web dev, c, excel, non tech, digital nomad, virtual assistant, full time",2026-06-10T23:36:38+00:00,https://remoteOK.com/remote-jobs/remote-contador-a-recibido-o-estudiante-avanzado-para-estudio-contable-hibrido-zona-norte-universia-argentina-1133351
Social Media Coordinator,House of Ruh,New York City Metropolitan Area,"education, technical, customer support, dev, testing, marketing, finance, video, sales, golang, medical, digital nomad, design, coordinator, exec, content writing, social media",2026-06-10T23:19:12+00:00,https://remoteOK.com/remote-jobs/remote-social-media-coordinator-house-of-ruh-1133236
Associate Brand Manager,FuseGlobal,,"hr, virtual assistant, exec, social media, part time, sys admin, education, customer support, content writing, ops",2026-06-10T22:07:07+00:00,https://remoteOK.com/remote-jobs/remote-associate-brand-manager-fuseglobal-1133193
Social Media Manager,Be Balanced Co.,,"hr, virtual assistant, exec, social media, part time",2026-06-10T22:04:17+00:00,https://remoteOK.com/remote-jobs/remote-social-media-manager-be-balanced-co-1133191
Contact Center Representative IHA Scheduling Team,Advantmed,,"hr, virtual assistant",2026-06-10T22:02:55+00:00,https://remoteOK.com/remote-jobs/remote-contact-center-representative-iha-scheduling-team-advantmed-1133190
HR Assistant,Randstad USA,,"hr, virtual assistant",2026-06-10T22:01:33+00:00,https://remoteOK.com/remote-jobs/remote-hr-assistant-randstad-usa-1133189
Learning And Development Specialist,Dagen,"Houston, Houston, Texas, United States","hr, virtual assistant, exec, social media, part time, sys admin, education, customer support, content writing, ops",2026-06-10T21:40:21+00:00,https://remoteOK.com/remote-jobs/remote-learning-and-development-specialist-dagen-1133192
CANDIDATURA SPONTANEA,Irion,"Torino, ","analyst, teaching, customer support, data science, content writing, junior, excel, sys admin, non tech, dev, backend, digital nomad",2026-06-10T21:38:12+00:00,https://remoteOK.com/remote-jobs/remote-candidatura-spontanea-irion-1133202
Supply &amp; Logistics Coordinator,Nabu Casa,"Roma, Roma, Lazio, Italia","analyst, teaching, customer support, data science, content writing, junior, excel, sys admin, non tech, dev, backend, digital nomad, embedded, coordinator, marketing, speech, exec, virtual assistant, finance, cloud, ops, ecommerce, full time, design, python, technical, travel, javascript, flutter, typescript, medical, engineer, shopify, hr, education, scheme, admin, microsoft, part time",2026-06-10T19:58:38+00:00,https://remoteOK.com/remote-jobs/remote-supply-amp-logistics-coordinator-nabu-casa-1133208
Supply &amp; Logistics Coordinator,Nabu Casa,"Madrid, Madrid, Comunidad de Madrid, España","analyst, teaching, customer support, data science, content writing, junior, excel, sys admin, non tech, dev, backend, digital nomad, embedded, coordinator, marketing, speech, exec, virtual assistant, finance, cloud, ops, ecommerce, full time, design, python, technical, travel, javascript, flutter, typescript, medical, engineer, shopify, hr, education, scheme, admin, microsoft, part time",2026-06-10T19:58:38+00:00,https://remoteOK.com/remote-jobs/remote-supply-amp-logistics-coordinator-nabu-casa-1133209
Supply &amp; Logistics Coordinator,Nabu Casa,"Warszawa, Warszawa, Woj. Mazowieckie, Polska","analyst, teaching, customer support, data science, content writing, junior, excel, sys admin, non tech, dev, backend, digital nomad, embedded, coordinator, marketing, speech, exec, virtual assistant, finance, cloud, ops, ecommerce, full time, design, python, technical, travel, javascript, flutter, typescript, medical, engineer, shopify, hr, education, scheme, admin, microsoft, part time",2026-06-10T19:58:38+00:00,https://remoteOK.com/remote-jobs/remote-supply-amp-logistics-coordinator-nabu-casa-1133211
Supply &amp; Logistics Coordinator,Nabu Casa,"Dublin, Dublin, County Dublin, Ireland","analyst, teaching, customer support, data science, content writing, junior, excel, sys admin, non tech, dev, backend, digital nomad, embedded, coordinator, marketing, speech, exec, virtual assistant, finance, cloud, ops, ecommerce, full time, design, python, technical, travel, javascript, flutter, typescript, medical, engineer, shopify, hr, education, scheme, admin, microsoft, part time",2026-06-10T19:58:38+00:00,https://remoteOK.com/remote-jobs/remote-supply-amp-logistics-coordinator-nabu-casa-1133212
Supply &amp; Logistics Coordinator,Nabu Casa,"Athens, Athens, Attiki, Greece","analyst, teaching, customer support, data science, content writing, junior, excel, sys admin, non tech, dev, backend, digital nomad, embedded, coordinator, marketing, speech, exec, virtual assistant, finance, cloud, ops, ecommerce, full time, design, python, technical, travel, javascript, flutter, typescript, medical, engineer, shopify",2026-06-10T19:58:35+00:00,https://remoteOK.com/remote-jobs/remote-supply-amp-logistics-coordinator-nabu-casa-1133206
Supply &amp; Logistics Coordinator,Nabu Casa,"Bucureşti, Bucureşti, Bucureşti, România","analyst, teaching, customer support, data science, content writing, junior, excel, sys admin, non tech, dev, backend, digital nomad, embedded, coordinator, marketing, speech, exec, virtual assistant, finance, cloud, ops, ecommerce, full time, design, python, technical, travel, javascript, flutter, typescript, medical, engineer, shopify, hr, education, scheme, admin, microsoft, part time, mobile",2026-06-10T19:58:35+00:00,https://remoteOK.com/remote-jobs/remote-supply-amp-logistics-coordinator-nabu-casa-1133217
Supply &amp; Logistics Coordinator,Nabu Casa,"London, London, England, United Kingdom","analyst, teaching, customer support, data science, content writing, junior, excel, sys admin, non tech, dev, backend, digital nomad, embedded, coordinator, marketing, speech, exec, virtual assistant, finance, cloud, ops, ecommerce, full time",2026-06-10T19:58:33+00:00,https://remoteOK.com/remote-jobs/remote-supply-amp-logistics-coordinator-nabu-casa-1133203
Supply &amp; Logistics Coordinator,Nabu Casa,"Lisboa, Lisboa, Lisboa, Portugal","analyst, teaching, customer support, data science, content writing, junior, excel, sys admin, non tech, dev, backend, digital nomad, embedded, coordinator, marketing, speech, exec, virtual assistant, finance, cloud, ops, ecommerce, full time",2026-06-10T19:58:33+00:00,https://remoteOK.com/remote-jobs/remote-supply-amp-logistics-coordinator-nabu-casa-1133204
Supply &amp; Logistics Coordinator,Nabu Casa,"Madrid, Madrid, Comunidad de Madrid, España","analyst, teaching, customer support, data science, content writing, junior, excel, sys admin, non tech, dev, backend, digital nomad, embedded, coordinator, marketing, speech, exec, virtual assistant, finance, cloud, ops, ecommerce, full time, design, python, technical, travel, javascript, flutter, typescript, medical, engineer, shopify, hr, education, scheme, admin, microsoft, part time",2026-06-10T19:58:33+00:00,https://remoteOK.com/remote-jobs/remote-supply-amp-logistics-coordinator-nabu-casa-1133214
Supply &amp; Logistics Coordinator,Nabu Casa,"Budapest, Budapest, Budapest, Hungary","dev, backend, digital nomad, embedded, sys admin, coordinator, customer support, marketing, speech, exec, virtual assistant, finance, cloud, ops, ecommerce, full time",2026-06-10T19:58:33+00:00,https://remoteOK.com/remote-jobs/remote-supply-amp-logistics-coordinator-nabu-casa-1133243
Data Technician,Gritter Francona,"Texas, Texas, United States","hr, virtual assistant, exec, social media, part time, sys admin, education, customer support, content writing, ops, jira, infosec",2026-06-10T18:45:35+00:00,https://remoteOK.com/remote-jobs/remote-data-technician-gritter-francona-1133194
Design Engineer,MrBeast,"San Francisco, San Francisco, California, United States","education, technical, customer support, dev, testing, marketing, finance, video, sales, golang, medical, digital nomad, design, coordinator, exec, content writing, social media, engineer, senior, ops, excel, recruiter, react, sys admin, front end, travel, javascript",2026-06-10T18:38:58+00:00,https://remoteOK.com/remote-jobs/remote-design-engineer-mrbeast-1133239
Courier,FedEx,"Greater Madurai Area, ","virtual assistant, infosec, education, customer support, marketing, exec, finance, ops, medical, engineer",2026-06-10T18:18:21+00:00,https://remoteOK.com/remote-jobs/remote-courier-fedex-1133186
Courier,FedEx,"Greater Madurai Area, ","marketing, ops, non tech",2026-06-10T18:18:21+00:00,https://remoteOK.com/remote-jobs/remote-courier-fedex-1133223
Junior Supply Chain Analyst,Helic & Co.,,"hr, consulting, virtual assistant, exec, design, embedded, architecture, customer support, marketing, speech, microsoft, content writing, golang, engineer, digital nomad, social media, salesforce, travel, legal, sales, medical, sys admin, dev, finance, ops, excel, full time, infosec, education, senior, recruiter, analyst, junior",2026-06-10T18:06:52+00:00,https://remoteOK.com/remote-jobs/remote-junior-supply-chain-analyst-helic-co-1133182
Social Media Content Creator,FuseGlobal,,"hr, consulting, virtual assistant, exec, design, embedded, architecture, customer support, marketing, speech, microsoft, content writing, golang, engineer, digital nomad, social media",2026-06-10T18:02:28+00:00,https://remoteOK.com/remote-jobs/remote-social-media-content-creator-fuseglobal-1133176
HR Administrative Assistant,Orchestrate Consulting Group,,"hr, consulting, virtual assistant",2026-06-10T18:00:38+00:00,https://remoteOK.com/remote-jobs/remote-hr-administrative-assistant-orchestrate-consulting-group-1133174
International Advertising Growth Manager,Adoperator.com,,sales,2026-06-10T17:11:09+00:00,https://remoteOK.com/remote-jobs/remote-international-advertising-growth-manager-adoperator-com-1133171
